순위,ISBN,상품번호,상품명,판매가,YES포인트,저자,출판사,설명,출고예상일,관리분류
738,9791161571782,126520811,김섬과 박혜람,"14,220원",790원,임택수 저,나무옆의자,"어떤 사랑도 모든 것을 보여주지 않는다

“눈물맛이 나는 소설이다. 눈물맛을 즐기게 하는 소설이다.” - 박혜진(문학평론가)

2024년 제20회 세계문학상 수상작 『김섬과 박혜람』이 나무옆의자에서 출간되었다. 2005년 첫 수상작 『미실』(김별아)을 시작으로 『아내가 결혼했다』(박현욱), 『내 심장을 쏴라』(정유정), 『저스티스맨』(도선우), 『도서관을 떠나는 책들을 위하여』(오수완), 『우리가 겨울을 지나온 방식』(문미순) 등 쟁쟁한 작품들을 배출해온 한국 대표 장편공모상인 세계문학상에 올해는 응모작 160편이 모였다. ",1,국내도서-소설/시/희곡
739,9791170800187,120502966,광개토태왕 담덕 7,"15,120원",840원,엄광용 저,새움,"""후연이 저물며 북위가 득세하고
백제와 왜국은 고구려를 치기 위한 동상이몽을 꿈꾼다!""

“포로의 시체들을 화장해 쌓아놓은 백골탑이 달빛을 받아 하얗게 빛났다. 건듯 바람이 불었고, 순간 출렁이는 달빛을 받은 해골들이 되살아나 혀를 날름대는 것만 같았다.” _ (백골탑 중)

에서는 고구려를 둘러싼 후연, 북위, 백제, 왜국의 정세가 요동친다. 후연 포로들의 시체를 불태워 요동벌판에 산처럼 쌓아올린 탁발규의 백골탑, 이에 복수로 눈이 먼 후연 모용수의 무모한 정벌 전쟁. 결국 모용수는 퇴각하는 수레 속에서 쓸쓸히 숨을 거두고, 그의 아들들은 주도권을 잡기 위한 내분에 휩싸인다.

“나는 목만치 장군의 마음을 훔치러 왔습니다. 도둑맞기 전에 순순히 마음을 내놓으시지요!” _ (왜국 장수가 된 목만치 장군을 찾아가 설득하는 사두)

젊은 담덕에게 노예의 맹서를 한 백제왕 아신은 은밀히 왜국에 밀사를 보낸다. 왜국으로 도망친 목만치를 불러들이기 위해서다.",1,국내도서-소설/시/희곡
740,9788936439217,119828655,제주도우다 2,"15,300원",850원,현기영 저,창비,"지금 우리 앞에 당도한 최고의 역사소설
『순이 삼촌』 작가 현기영의 필생을 건 대작
유홍준 이창동 도종환 정지아 강요배 박태균 최태성 추천!

4·3을 입 밖으로 내는 게 금기시됐던 군부독재 시절, 무고한 양민들이 학살된 4·3의 진실을 담은 「순이 삼촌」을 발표하면서 제주 4·3의 비극을 널리 알린 소설가 현기영. 그가 제주와 한반도 현대사의 뿌리가 담긴 필생의 역작 『제주도우다』를 선보인다.

4·3의 비극으로부터 살아남은 자 안창세의 목소리로 젊은 세대에게 들려주는 이야기 『제주도우다』는 일제강점기부터 4·3에 이르기까지, 현재 한국사회 갈등 지형의 연원을 들여다볼 수 있는 제주의 근현대사를 시대의 흐름에 따라 총체적으로 다룬 대하소설로, 역사적 비극을 끈질기고도 강렬한 필력으로 보여준다.",1,국내도서-소설/시/희곡
741,9788936438791,111680405,덕다이브,"16,200원",900원,이현석 저,창비,"“묵묵하게 헤엄쳐 그를 구하고, 스스로를 구할 것이다.
설령 또 실패한다고 하더라도 몇번이고 다시.”

젊은작가상 수상 작가 이현석 첫 장편소설
올여름 가장 뜨겁고도 시원한 서핑 소설!

동시대의 윤리와 사회문제를 치열하게 담아내면서도 엄청난 흡인력을 선사하는 작품들로 젊은작가상을 수상하는 등 단연 주목받는 작가 이현석의 첫 장편소설 『덕다이브』가 출간되었다. 창비의 젊은 경장편 시리즈 소설Q의 열네번째 작품이다. 코로나19가 소문으로만 들려올 무렵 발리의 한인 서핑캠프를 배경으로 하는 이번 소설은, 세차게 부서지는 파도처럼 강렬하고 온몸을 감싸는 물결처럼 섬세하다. 마치 서핑보드에 올라선 것처럼 느끼게 하는 생생한 장면들을 따라 독자들은 바다의 정점에서 파도를 가르게 되고, 때로는 제 몸의 몇배는 되는 파도에 휘감겨 소금물을 마시게 된다. 

발리의 아름다운 풍경을 선명히 묘사하는 이번 작품은 동시에 혹독한 현실 역시 세밀하게 그려낸다.",3,국내도서-소설/시/희곡
742,9791158885250,74380974,괴물 장미,"11,700원",650원,정이담 저,황금가지,"강렬한 여성들의 서사가 돋보이는 퀴어 로맨스 소설 『괴물 장미』가 황금가지에서 출간되었다. 심리학과를 졸업한 뒤 가정폭력과 아동보호 관련 기관에서 재직 중인 저자는 가려진 목소리들을 드러내고 싶다는 포부를 담아, 약자와 강자, 폭력과 차별, 사랑과 구원에 대한 이야기를 그려냈다. 친부의 폭력에 시달리며 탈출을 꿈꾸는 소녀가 미모의 여성 뱀파이어와 만나게 되어 운명의 소용돌이에 휘말리는 내용을 그린 이 작품은 온라인 소설 플랫폼인 브릿G의 제1회 로맨스릴러 공모전에서 “로맨스의 외연을 확장한 격렬하고 아름다운 작품”이라는 평을 받으며 높은 점수로 우수작에 선정되었다. ",1,국내도서-소설/시/희곡
743,9788954654081,67134132,문신 1,"14,850원",820원,윤흥길 저,문학동네,"제10회 박경리문학상 수상 

21세기를 빛낼 새로운 고전
집필에서 탈고까지 25년, 거장 윤흥길 필생의 역작

그에게는 우리 시대가 잃어버린 경건성의 바탕이 있었다. 그는 예수 그리스도가 십자가를 지고 골고다로 가듯이, 소설을 짊어지고 그 고통스러운 시대를 통과하고 있었다. _김훈(소설가)
우리의 언어가 이토록 풍요로웠던가. 온몸이 유장한 가락과 고저장단의 리듬을 타며 책 속으로, 이야기 속으로 빠져든다. _오정희(소설가)
그가 펼쳐내는 이야기를 읽다보면 그 안에 뚜렷이 존재하는 그의 영토를 목격하게 된다. _김주영(소설가)

작가 인생 55년, 윤흥길 필생의 역작 『문신』이 완간되었다. 『문신』은 자그마치 원고지 6500매, 출간 도서 기준 2000쪽이 넘는 방대한 분량의 대작으로, 집필부터 탈고까지 25년간의 대장정 끝에 2024년 비로소 완간되었다.",1,국내도서-소설/시/희곡
744,9791160940572,43505078,추락하는 것은 복근이 없다,"11,700원",650원,김해원 저,사계절,"삶은 순간순간 우리를 추락하게 만들지만, 지옥 같은 세상이라도 살아내고 기억하고 서로 위로해야 한다. 그게 바로 인생이니까.
살아 있다는 사실만으로도 칭찬받아 마땅한, 우리 모두를 위한 소설집!

씁쓸한 세상이지만 꿋꿋하게 살아가는 소시민의 용기와 유머를 잘 아는 작가 김해원의 소설집 『추락하는 것은 복근이 없다』에는 삼성 반도체 백혈병 소녀 이야기를 다룬 「최후 진술」, 오리배를 타고 한강을 표류하게 된 소녀의 비일상적 모험을 다룬 「표류」, 실제로 ‘아버지 가방에 들어가시’는 상황을 겪게 된 소년의 사연을 담은 「가방에」, 욕으로 학교를 장악한 ‘껌딱지’의 비참한 몰락을 코믹하면서도 인간적으로 조명한 「추락하는 것은 복근이 없다」 등 7편이 실려 있다. 독창적인 캐릭터와 은근한 유머로 버무린 단편들은 사회를 바라보는 날카로운 시선 속에서도 사람을 향한 따뜻한 이해를 견지하고 있다.",1,국내도서-소설/시/희곡
745,9788954637817,21395106,"사랑이라니, 선영아","9,900원",550원,김연수 저,문학동네,"1994년 『가면을 가리키며 걷기』로 등단한 이후 총 13권의 소설집과 장편소설을 발표하며, 오직 ‘쓴다’라는 동사로만 존재해온 작가, 김연수. 다채로운 그의 소설세계에서 유독 눈에 띄는 한 편이 있다. 작가 스스로 밝히듯, ‘팬들을 위해 쓴 특별판 소설’인 『사랑이라니, 선영아』가 그것이다. 그는 “잠시 쉬었다 가는 기분”으로 이 소설을 썼다고 덧붙이는데, 한 편의 소설을 쓰기까지 오랜 시간에 걸친 취재와 관련 자료를 샅샅이 탐독하는 그의 작업 스타일에 비추어 볼 때, 김연수의 이 말은 작법이 아닌 어떤 마음 상태와 관련된 것으로 받아들여야 할 것이다. 다시 말해, 이 짧은 소설을 쓰기 위해 그는 그답게 ‘사랑’에 관한 수많은 자료를 하나하나 살폈고, 다만 이전과 달리 좀더 경쾌하고 산뜻한 기분으로 이 작품을 썼다고 말이다.",1,국내도서-소설/시/희곡
746,9791130657820,135396705,"오늘도 돌아갑니다, 풍진동 LP가게","15,300원",850원,"임진평,고희은 공저",다산책방,"“상처받은 마음도, 고단한 삶도 그저 다 흘러갈 뿐이야.
빙글빙글 돌아가는 레코드판처럼…”
외로운 삶에 따스하게 재생되는 아날로그 감동 소설

“이 책은 레코드판이 아닙니다.
그렇지만 책장을 여는 순간, 치유의 음악이 들려옵니다.”
- 「배철수의 음악캠프」 배철수 강력 추천 -

★★ 밀리의서재 소설 분야 1위 ★★
★★ 밀리의서재 북마스터 선정 1위 도서 ★★
★★ 2024년 프랑크푸르트 도서전 화제작 ★★

한때 재개발 광풍이 불었지만 공사가 중단되어 떠날 사람들은 이미 다 떠난 서울의 후미진 동네 ‘풍진동’. ",1,국내도서-소설/시/희곡
747,9791160947427,102517428,단명소녀 투쟁기,"10,800원",600원,현호정 저,사계절,"“나는 나의 죽음을 죽일 수 있다.”
1회 박지리문학상 수상작
신인작가 현호정의 첫 책

열아홉 살 소녀 구수정은 반신 북두北斗로부터 ‘스무 살 전에 단명할 운명’이라는 예언을 듣는다. 수정은 스스로 삶을 이어 나가기 위해 긴 여정을 떠난다. 수정이 떠나기 직전, 점집에서 일하는 은주 아줌마는 백설기 백 조각을 싸준다. 수정은 자신이 살던 G시의 지하철역에서 첫 번째 장애물, 술에 취한 남자를 만나며 급격히 현실계를 벗어난다. 때마침 나타난 날개 달린 사자 개의 등에 올라 위기에서 벗어난 수정은, 그대로 날아 다른 세계로 계속해서 이동한다. 검은 산들이 둘러싼 분지에 도착해 백설기를 나눠 먹다 수정은 개의 이름이 ‘내일’이라는 것을 알게 된다. 그리고 그곳에서 ‘이안’을 만난다. 이안은 수정처럼 열아홉 살이고 수정과 반대로 ‘죽기 위한 여정’ 중에 있다.",1,국내도서-소설/시/희곡
748,9788954678674,99273106,미래 산책 연습,"12,150원",670원,박솔뫼 저,문학동네,"가벼운 발걸음으로 시작하는 시간의 춤
결국, 서로의 마음으로 이어지는 경이로운 산책길
박솔뫼 소설의 좋음을 알기에 가장 좋을 신작-로

『미래 산책 연습』은 박솔뫼의 일곱번째 장편소설이자 웹진 [주간 문학동네]에 연재된 작품으로, 지난겨울 갈무리한 원고를 더욱 가다듬어 출간하였다. 2009년 장편소설 『을』을 통해 작품활동을 시작한 박솔뫼는 전혀 새로운 서사 감각과 문체를 선보이며, 등장 자체를 한국문학계의 한 ‘사건’으로 만들었다. 올해로 데뷔 13년, 4권의 소설집과 6권의 장편소설을 출간한 사실이 때로는 무색하고 때로는 어색하게 느껴질 만큼, 매번 자신의 소설세계를 갱신하는 박솔뫼를 ‘젊은 작가의 미래’라고 불러도 전혀 손색이 없을 것이다. 

낯섦, 전위, 구어체와 비문, 문체와 사유의 리듬감, 일상과 생활. 이는 그간 박솔뫼의 소설을 수식해온 단어이자 그의 소설을 읽어내는 키워드이기도 하다.",1,국내도서-소설/시/희곡
749,9788954640176,25929313,밤은 노래한다,"13,500원",750원,김연수 저,문학동네,"수많은 자료들을 통해 이상의 삶과 그 비밀을 추적해들어감으로써 ‘지적 소설의 한 장을 열어젖혔다’는 평을 받은 『꾿빠이, 이상』(2001), 공식적인 역사 기술(記述)이 지워낸 개별적인 인간들의 이야기를 복원하는 데에 성공함으로써 한국소설의 인식론적 깊이를 심화시킨 작품으로 평가되는 『네가 누구든 얼마나 외롭든』(2007)을 잇는 김연수의 세번째 역사소설 『밤은 노래한다』(2008)가 문학동네에서 재출간되었다. 

역사의 소용돌이로부터 한 발 떨어진 채 일상을 살아가던 한 남자가 어느 날 연인이 죽기 직전 보내온 한 장의 편지를 받으면서 역사의 한가운데로 걸어들어가게 되는 『밤은 노래한다』는 우리를 1930년대 초반 북간도로 이끈다. 그 남자의 뒤를 따라가며 우리는 항일유격 근거지에서 일어난 비참한 사건, 즉 ‘민생단 사건’과 마주하게 된다.",2,국내도서-소설/시/희곡
750,9788954614566,5058528,치우천왕기 1~6 세트,"88,200원","4,900원",이우혁 저,엘릭시르,"『퇴마록』의 작가 이우혁이 선보이는 한국 판타지의 결정판! 
단군 이전의 영웅 치우천, 치우비 형제를 중심으로 펼쳐지는 대하 서사 판타지.

『퇴마록』, 『왜란종결자』, 『파이로 매니악』 등을 통해 한국판 판타지의 대표 작가로 자리매김한 이우혁의 장편 판타지다. 작가는 한민족의 신화시대에서 빼놓을 수 없는 영웅 치우천왕을 축으로, 인간을 뛰어넘는 능력을 지닌 선인과 영웅, 상상을 초월한 힘을 지닌 신수, 도깨비와 귀신, 도술과 주술이 얽힌 동양적 판타지의 진수를 보여준다.",2,국내도서-소설/시/희곡
751,9788935659302,1991801,지리산 7,"13,050원",720원,이병주 저,한길사,"좌우 어디에도 속하지 않고 오로지 문학으로 세상을 이야기하려 했던 '자유인' 나림 이병주 선생

마흔네 살 늦깎이로 문단에 데뷔해 1992년 타계하기까지, 짧은 집필 기간 동안 80여 권의 방대한 작품을 남긴 이병주 선생. '한국문학의 위기'를 말하는 오늘날, 한국이 낳은 가장 뛰어난 이야기꾼인 이병주 선생의 문학 세계를 다시 만난다.

그의 작품은 19세기말 개화기에서 1980년대 '제5공화국'에 이르기까지 100여 년에 걸친 한국 현대사를 관통하고 있다. 우리가 그의 작품세계를 '소설로 읽는 한국 현대사'라 명명하는 것은 바...",1,국내도서-소설/시/희곡
752,9788935659272,1991797,지리산 4,"13,050원",720원,이병주 저,한길사,"좌우 어디에도 속하지 않고 오로지 문학으로 세상을 이야기하려 했던 '자유인' 나림 이병주 선생

마흔네 살 늦깎이로 문단에 데뷔해 1992년 타계하기까지, 짧은 집필 기간 동안 80여 권의 방대한 작품을 남긴 이병주 선생. '한국문학의 위기'를 말하는 오늘날, 한국이 낳은 가장 뛰어난 이야기꾼인 이병주 선생의 문학 세계를 다시 만난다.

그의 작품은 19세기말 개화기에서 1980년대 '제5공화국'에 이르기까지 100여 년에 걸친 한국 현대사를 관통하고 있다. 우리가 그의 작품세계를 '소설로 읽는 한국 현대사'라 명명하는 것은 바...",1,국내도서-소설/시/희곡
753,9788936434694,146897013,"꿀잠 선물 가게, 기적을 팝니다","15,300원",850원,박초은 저/모차 그림,토닥스토리,"“마음이 힘들고 지칠 땐 이곳을 찾아주세요.”
꿈처럼 아늑하고 이불처럼 포근한 책

★★★ 러시아, 태국, 베트남 등 해외 수출 계약 확정
★★★ 밀리의 서재 ‘밀리로드’ 주간 1위 『꿀잠 선물 가게』시리즈

끝없는 생각과 걱정으로 밤잠을 설치는 이들을 위해 달콤한 잠을 선물하는 소설 『꿀잠 선물 가게, 기적을 팝니다』가 출간되었다. 시도 때도 없이 조는 중에도 미소가 떠나지 않는 주인 오슬로와 야무진 조수 부엉이 자자가 운영하는 꿀잠 선물 가게가 소설의 배경이다. 두려움과 불안 속에 이곳을 찾은 손님들은 자자가 건네는 마법의 꿀차를 마시고 잠 못 이루는 속사정을 털어놓으며 잠에 빠져든다. 손님이 잠을 자는 사이에 자자는 손님의 꿈속으로 날아들고, 오슬로는 파도처럼 밀려오는 장면을 함께 지켜본다. 손님을 괴롭게 하는 것은 무엇인지, 지금 가장 필요한 위로는 무엇인지 살펴본 오슬로는 불면을 해소해줄 ‘꿀잠 아이템’을 추천한다.",1,국내도서-소설/시/희곡
754,9791141607272,134766932,그녀의 취미생활,"19,800원","1,100원",서미애 저,엘릭시르,"작가들의 작가, 서미애 데뷔 30주년 기념판!

“서미애라는 이름만으로 충분하다.” - 표창원(프로파일러)

명실상부한 ‘한국 미스터리 소설의 대가’로 이름을 알린 서미애 작가의 발표된 모든 단편과 장편을 모은 작품집이 드디어 출간된다. 대학로에서 신드롬에 가까운 인기를 끈 데뷔작 「남편을 죽이는 서른 가지 방법」이나, 영화로 만들어져 부천판타스틱 영화제에서 상영된 「그녀의 취미생활」 등의 작품은 그저 제목으로만 떠돌 뿐, 정리된 지면으로 만나볼 기회가 도통 없었다. 초기 걸작으로 꼽히는 「살인 협주곡」과 서미애 소설 세계의 지평을 넓혔다고 평가받는 단편 「목련이 피었다」도 마찬가지다.

엘릭시르에서는 서미애 작가 데뷔 30주년을 맞아 그 작품 세계를 온전히 톺아볼 수 있는 기회를 마련했다.",1,국내도서-소설/시/희곡
755,9788954698214,125132115,문신 5,"14,850원",820원,윤흥길 저,문학동네,"제10회 박경리문학상 수상 

21세기를 빛낼 새로운 고전
집필에서 탈고까지 25년, 거장 윤흥길 필생의 역작

그에게는 우리 시대가 잃어버린 경건성의 바탕이 있었다. 그는 예수 그리스도가 십자가를 지고 골고다로 가듯이, 소설을 짊어지고 그 고통스러운 시대를 통과하고 있었다. _김훈(소설가)
우리의 언어가 이토록 풍요로웠던가. 온몸이 유장한 가락과 고저장단의 리듬을 타며 책 속으로, 이야기 속으로 빠져든다. _오정희(소설가)
그가 펼쳐내는 이야기를 읽다보면 그 안에 뚜렷이 존재하는 그의 영토를 목격하게 된다. _김주영(소설가)

작가 인생 55년, 윤흥길 필생의 역작 『문신』이 완간되었다. 『문신』은 자그마치 원고지 6500매, 출간 도서 기준 2000쪽이 넘는 방대한 분량의 대작으로, 집필부터 탈고까지 25년간의 대장정 끝에 2024년 비로소 완간되었다.",1,국내도서-소설/시/희곡
756,9791160406122,102471263,다른 사람,"12,420원",690원,강화길 저,한겨레출판,"누구도 함부로 대할 수 없고, 우습게 볼 수 없는 사람
상처받지 않고 겁먹지 않는 사람
당신은 ‘다른 사람’입니까?

데이트 폭력, 여성 혐오 범죄, 성폭력, 강간 등 한국 사회에서 여성에게 가해지는 수많은 폭력의 형태를 날카롭고 집요하게 추적해온 강화길의 첫 장편소설이자, 제22회 한겨레문학상 수상작인 『다른 사람』이 개정판으로 다시 찾아온다. 2017년 출간 이후 “우리 이야기, 너의 이야기, 나의 이야기”라는, 독자들의 적극적 지지를 받아온 『다른 사람』은 그로부터 5년이 흐른 지금도 그 의미가 건재한 페미니즘 소설의 대표작이다. 단순 폭력을 넘어, N번방과 같은 디지털 성범죄가 만연한 오늘날 사회 시스템 속에서 생존을 위해 치열하게 분투하는 여성들이 있는 한, 소설 『다른 사람』은 언제나 그들 손에 들린 ‘최신형’ 무기가 된다.",1,국내도서-소설/시/희곡
757,9788965749295,93613199,태백산맥 9,"15,750원",870원,조정래 저,해냄,"“20세기 한국인에게 가장 큰 영향을 미친 소설”
30여 년 동안 우리 사회 각계각층의 독자들에게
‘내 인생의 책’으로 손꼽히며 감동을 전해온 대하소설 『태백산맥』
작가 등단 50주년 기념 개정판 출간

『태백산맥』은 한반도가 해방과 분단을 동시에 맞아 남한의 단독정부가 수립되고, 4·3항쟁과 여순사건이 일어난 1948년 10월부터 6·25전쟁이 끝나고 분단이 고착화된 1953년 10월까지를 시간적 배경으로 한다. ‘민족사의 매몰시대’, ‘현대사의 실종시대’라 불리는 역사에 정면으로 부딪쳐 80년대 최대의 문제작이 되었다.

1983년 《현대문학》에 제1부가 연재되었고 1987년부터 제2~4부가 《한국문학》에 연재되었다. 1986년 제1부 [한의 모닥불] 출간을 시작으로 1989년 제4부 [전쟁과 분단]이 출간됨으로써 16,500매에 이르는 전10권이 완간되었다.",1,국내도서-소설/시/희곡
758,9788965749271,93613152,태백산맥 7,"15,750원",870원,조정래 저,해냄,"“20세기 한국인에게 가장 큰 영향을 미친 소설”
30여 년 동안 우리 사회 각계각층의 독자들에게
‘내 인생의 책’으로 손꼽히며 감동을 전해온 대하소설 『태백산맥』
작가 등단 50주년 기념 개정판 출간

『태백산맥』은 한반도가 해방과 분단을 동시에 맞아 남한의 단독정부가 수립되고, 4·3항쟁과 여순사건이 일어난 1948년 10월부터 6·25전쟁이 끝나고 분단이 고착화된 1953년 10월까지를 시간적 배경으로 한다. ‘민족사의 매몰시대’, ‘현대사의 실종시대’라 불리는 역사에 정면으로 부딪쳐 80년대 최대의 문제작이 되었다.

1983년 《현대문학》에 제1부가 연재되었고 1987년부터 제2~4부가 《한국문학》에 연재되었다. 1986년 제1부 [한의 모닥불] 출간을 시작으로 1989년 제4부 [전쟁과 분단]이 출간됨으로써 16,500매에 이르는 전10권이 완간되었다.",1,국내도서-소설/시/희곡
759,9791163160427,71979084,현장검증,"12,150원",670원,이종관 저,고즈넉이엔티,"우리 장르문학의 자존심, 케이스릴러 
드디어 형사가 주인공인 스릴러 소설이 나왔다! 

기억과 시력을 잃은 형사, 모방범죄 연쇄살인마를 쫓다

국내 유일의 범죄수사 전문 잡지 편집장으로 15년 
작가의 취재 경험을 녹여낸 범죄소설의 놀라운 리얼리티!

국내 최고의 프로파일러와 국립과학수사연구원 부장조차 감탄한 
과학수사와 형사 세계의 완벽한 재현",1,국내도서-소설/시/희곡
760,9788954636933,19597143,촐라체,"14,400원",800원,박범신 저,문학동네,"인간의 실존을 시험하는 마의 산, 히말라야
신성한 세계를 갈망하며 존재의 기원을 찾아나선 세 사내 이야기

『촐라체』 [고산자] [은교], 박범신 ‘갈망 3부작’의 완성!

2010년 작가 박범신은 장편소설 [은교]를 탈고한 소회를 이렇게 밝혔다.

지난 십여 년간 나를 사로잡고 있었던 낱말은 ‘갈망渴望’이었다. [촐라체]와 [고산자], 그리고 이 소설 [은교]를, 나는 혼잣말로 ‘갈망 3부작’이라 부른다. [촐라체]에서는 히말라야를 배경으로 인간 의지의 수직적 한계를, [고산자]에서는 역사적 시간을 통한 꿈의 수평적인 정한情恨을, 그리고 [은교]에 이르러, 비로소 실존의 현실로 돌아와 존재의 내밀한 욕망과 그 근원을 감히 탐험하고 기록했다고 느끼기 때문이다.

2008년부터 2010년까지 1년 간격으로 작가는 장편소설 [촐라체] [고산자] [은교]를 펴냈다.",1,국내도서-소설/시/희곡
761,9788933801918,6259975,그대 아직도 꿈꾸고 있는가,"13,500원",750원,박완서 저,세계사,"『그대 아직도 꿈꾸고 있는가』는 결혼이라는 제도와 사회적 통념 속에서 약자가 되어야만 하는 여자, 그것도 싱글맘의 이야기이다. 비극일 수 있는 소재를 박완서 특유의 수다스러움으로 포장한 냉정한 현실 직시의 리얼리즘은 오히려 현실적인 만큼 도발적이다.",1,국내도서-소설/시/희곡
