순위,ISBN,상품번호,상품명,판매가,YES포인트,저자,출판사,설명,출고예상일,관리분류
473,9791193235263,133890465,까멜리아 싸롱,"16,020원",890원,고수리 저,클레이하우스,"첫눈 내릴 때 열고 동백꽃 필 무렵 닫는 기묘한 다방, 까멜리아 싸롱. 푸른 바다가 내려다보이고 눈 내리는 동백섬 언덕에 있는 붉은 벽돌집에서 머물게 된 사람들. 그들을 맞이하는 건 마담 여순자와 객실장 마두열, 매니저 유이수, 그리고 인생책 읽어주는 사서 지원우다. 생애 마지막 시간을 대접한다는 이들과 함께하는 49일 동안, 그들 사이에 얽힌 놀라운 인생의 비밀들이 하나둘 드러난다.

누구에게나 한 걸음도 더 뗄 수 없을 것만 같은 순간이 찾아온다. 투명 인간이라도 된 듯 누구도 나를 제대로 들여다봐주지 않는 기분이 들 때, 더는 무엇을 해야 할지 알 수 없을 때 우리는 어떻게 해야 할까? 이승과 저승 사이의 환상적인 공간 까멜리아 싸롱에는 눈을 맞추며 진심을 다해 이야기를 들어주는 사람들이 있다. 나이도 성별도 성격도 생각도 제각각, 너무나도 다른 여덟 명이 여덟 번의 밤을 함께 보내는 동안 일어나는 기적과도 같은 변화는 우리 안에 내재한 힘이 얼마나 강한지 보여준다. ",1,국내도서-소설/시/희곡
474,9788954651059,60550872,마당이 있는 집,"12,420원",690원,김진영 저,엘릭시르,"“마당에서 시체 냄새가 난다.” 
한국 미스터리계를 휩쓸 강렬한 신인, 강력한 데뷔작 출간!

의사 남편에 똑똑하고 잘생긴 아들, 모자랄 것 없는 풍족한 가정. 주란의 가족은 누구나 꿈꾸는 ‘완벽한 집’으로 이사한다. 주란은 이 행복한 가정 속에서 완벽한 아내이자 주부, 어머니로서 행복을 누리며 산다. 단 한 가지 신경을 거스르는 것은 마당에서 나는 냄새. 남편은 금방 사라질 거름 냄새로 치부하지만 예쁜 수채화에 찍힌 기름 얼룩처럼 좀처럼 머릿속에서 지워지지 않는다. 별것 아닌 것 같았던 이 불안감은 조금씩 커져, 완벽한 것 같았던 남편의 행동들도 하나씩 수상쩍게 느껴지기 시작한다. 남편은, 살인자인가? 

행복한 일상을 의심하기 시작한 여자와 불행한 일상을 탈출하기 위해 분투하는 두 여자의 삶이 교차하며 변해가는 과정을 그린 『마당이 있는 집』은, 지금 이 사회를 살아가는 사람들에게 깊은 공감과 함께 강렬한 인상을 심어줄 심리 서스펜스이자 가정 스릴러다.",1,국내도서-소설/시/희곡
475,9791167375421,144381502,구원,"16,200원",900원,임성순 저,은행나무,"세계문학상·젊은작가상·SF어워드 수상 작가
임성순의 ‘회사’ 3부작 완결편!

우리가 선하다고 믿는 것은 정말 진실일까
선과 악이 뒤섞인 사회를 고발하는 뛰어난 통찰력

독창적인 소재와 날카로운 문장으로 우리 사회를 파헤치는 소설가 임성순의 장편소설 《구원》이 은행나무출판사에서 새롭게 출간되었다. 2012년 《오히려 다정한 사람들이 살고 있다》는 제목으로 독자들을 만난 바 있는 이 작품은 《컨설턴트》 《문근영은 위험해》에 이은 작가의 ‘회사’ 3부작의 마지막 이야기이다. 이번 작품에서는 자본주의와 생명을 결부시킴으로써 부조리한 사회를 조율하고자 하는 ‘회사’가 등장한다. 그 회사가 운영하는 병원에서 15년 만에 다시 만난 두 인물의 과거와 현재가 겹쳐지며 이야기는 충격적인 진실로 나아간다. 과연 그들이 15년 전에 숨긴 것은 무엇이기에 이들을 잔인한 상황 속으로 몰아넣는가.",2,국내도서-소설/시/희곡
476,9788936439644,133758484,내일의 엔딩,"14,400원",800원,김유나 저,창비,"나의 세상이 온통 어둠으로 차오를 때,
멀리서부터 하나둘 불을 밝혀오는 아름답고 눈부신 기억들

창비신인소설상 수상 작가 김유나의 첫번째 소설

2020년 “화자의 갈팡질팡하는 마음 곁에 나란히 서서 그 마음을 물끄러미 응시하게 되는 독특한 힘이 있다”는 평을 받으며 창비신인소설상을 통해 등단한 작가 김유나의 첫번째 소설 『내일의 엔딩』이 출간되었다. 작가의 첫 책이자 첫 장편인 이번 소설은 창비의 젊은 경장편시리즈 소설Q의 스무번째 작품이다. 『내일의 엔딩』은 아버지의 투병과 죽음을 곁에서 홀로 지켜온 주인공 자경의 삶의 궤적을 따라간다. 간병이 길어질수록 쓸쓸한 감정에 익숙해지고 그저 무미건조한 날들만이 계속된다고 생각했던 자경은 아버지의 마지막을 지나며 언제나 자신의 곁에 있어주었던 소중한 존재들을 하나씩 발견해낸다.",2,국내도서-소설/시/희곡
477,9791193185391,124595457,봄그늘 3,"13,050원",720원,김차차 저,파란 (파란미디어),"너는 내 실수고 오욕의 역사였으며 내 모든 유년의 기억이었다.

“……박우경 니 진짜 미친갱이가.”
“아 개등신 같은 가시나.”

한때의 주말. 칸막이 책상 아래에서 우리가 잡았던 손. 문제집 안에 끼워져 있던 그 애의 쪽지. 깨끗한 교복 셔츠의 섬유 린스 냄새. 내 캔커피를 한 입씩 뺏어 마시며 장난스레 웃던 얼굴. 아, 그 웃는 얼굴. 죄다 지겹다는 듯 잔뜩 찌푸렸다가도 날 보면 일시에 소년처럼 말개지는 얼굴이 좋았다. 콧등을 설핏 찡그리고, 시원하게 휜 입매로 웃던 그 남자애. 나중에 서울에 가면 항상 저와 함께 있자던, 그 치기 어린 목소리. 그 애가 청라에서 보낼 지루한 유배는 아무리 길어도 1년이다. 해를 지나 내년 봄이 올 때까지, 시간을 아무리 더 갉아 내도 우리의 끝은 변하지 않는다. 그러니까 지금은 우리가 다시 헤어질 봄의 그늘 같은 것이다. 그 봄이 제 등 뒤편에나 남긴 그림자였다.",1,국내도서-소설/시/희곡
478,9788954675321,96033354,검은 꽃,"13,500원",750원,김영하 저,문학동네,"문학동네 한국문학전집 제17권은, 자유로운 상상력과 명민한 문장력으로 삶에 대한 고정관념을 “파괴할 권리”를 끊임없이 주장해온 작가 김영하의 『검은 꽃』이다. 『검은 꽃』은 1905년 멕시코로 떠난 한국인들의 이민사(移民史)를 그려낸 장편소설로 2004년 동인문학상 수상 당시 “가장 약한 나라의 가장 힘없는 사람들의 인생 경영을 강렬하게 그린 작품”이라는 평가를 받았다. 백 년 전 멕시코로 떠나 완전히 잊혀져버린 이들의 삶을 간결한 문장과 힘 있는 서사로 생생하게 되살려낸 이 작품은 1900년대라는 시간을 뛰어넘어 오늘날 우리에게 변함없이 뜨거운 울림을 준다.

미래에 대한 막연한 기대를 안고 멕시코행 기선에 승선한 열한 명의 한국인을 기다리고 있는 것은 외려 희망에의 배반이었다. 에네켄 농장의 채무노예가 된 그들은 고국으로 돌아가지도 못한 채 멕시코 전역을 떠도는 신세로 전락한다. 한번 배반당한 희망은 소설을 관통하는 내내 회복되지 않는다.",2,국내도서-소설/시/희곡
479,9788932018140,2710858,친절한 복희씨,"12,600원",700원,박완서 저,문학과지성사,"우리 삶의 지평을 넓혀온 박완서 문학 37년
화수분처럼 끊임없이 길어낸 진솔한 이야기의 감동

박완서 작가가 문단에 데뷔한 지 올해로 37년이다. 불혹의 나이에 등단하여 올해로 일흔 일곱을 맞기까지, 누구보다도 왕성한 창작활동을 펼쳐온 그가 신작 소설집 『친절한 복희씨』를 펴냈다. 『너무도 쓸쓸한 당신』(1998) 이후 9년 만에 낸 소설집이다.

영화 '친절한 금자씨'의 금자씨가 그랬듯이, 『친절한 복희씨』의 복희씨 역시 알고 보면 친절한 사람은 못 된다. 하지만 그럴만한 사정이 있다. 화자인 복희씨는 열 아?..",1,국내도서-소설/시/희곡
480,9788933801956,6259993,그 남자네 집,"15,300원",850원,박완서 저,세계사,"소설가 박완서의 첫사랑에 대한 자전적 장편 소설!

한국 소설계의 어머니 박완서가 고희 넘도록 감춰두었던 첫사랑을 매혹적인 문장에 담았다. 첫사랑이라는 본성에 가까운 감정과 대비를 이루며 전후 피폐한 일상과 그 생활전선을 직접 몸으로 겪어야 했던 여성들의 실상이 가슴 찡하게 그려낸다. 

전후 50년대 서울의 피폐한 풍경이 눈에 보이듯 그려지고 있는 이 작품은, 현재 나이 든 주인공이 당시의 첫사랑 ‘그 남자’가 살았던 돈암동 안감내를 찾아가는 것으로 시작된다.",1,국내도서-소설/시/희곡
481,9791194654834,147048570,퇴마록 말세편 4,"19,800원","1,100원",이우혁 저,반타,"한국에서 가장 많이 팔린 장르소설 ‘퇴마록’ 시리즈
최후의 심판을 막기 위한 마지막 혈전!
《퇴마록_말세편》 전 5권

누적 판매량 1,000만 부를 돌파, 역대 한국 장르소설 베스트셀러 1위, 온오프라인 서점 스테디셀러 등 누구도 뛰어넘을 수 없는 압도적인 기록을 보유한 한국 오컬트 판타지의 시초 《퇴마록》. 

2025년 4월 《퇴마록 국내편》(전 2권)이 출간된 데 이어 《퇴마록 말세편》(전 5권)도 5월 오팬하우스에서 새롭게 출간된다. 

말세편은 ‘퇴마록’ 시리즈의 마지막 본편으로, 세상의 종말을 원하는 악의 집단과 이를 막으려는 선한 집단의 대혈전을 담고 있다. 전 세계의 내로라하는 영능력자들이 한자리에 총출동하는 만큼 어느 편에서도 볼 수 없었던 역대급 격투 장면이 펼쳐지는데, 이는 30여 년 넘게 이어져 온 대장정의 서사에 걸맞은 장대한 마무리라 할 수 있다.",1,국내도서-소설/시/희곡
482,9791193185384,124595451,봄그늘 2,"13,050원",720원,김차차 저,파란 (파란미디어),"너는 내 실수고 오욕의 역사였으며 내 모든 유년의 기억이었다.

“……박우경 니 진짜 미친갱이가.”
“아 개등신 같은 가시나.”

한때의 주말. 칸막이 책상 아래에서 우리가 잡았던 손. 문제집 안에 끼워져 있던 그 애의 쪽지. 깨끗한 교복 셔츠의 섬유 린스 냄새. 내 캔커피를 한 입씩 뺏어 마시며 장난스레 웃던 얼굴. 아, 그 웃는 얼굴. 죄다 지겹다는 듯 잔뜩 찌푸렸다가도 날 보면 일시에 소년처럼 말개지는 얼굴이 좋았다. 콧등을 설핏 찡그리고, 시원하게 휜 입매로 웃던 그 남자애. 나중에 서울에 가면 항상 저와 함께 있자던, 그 치기 어린 목소리. 그 애가 청라에서 보낼 지루한 유배는 아무리 길어도 1년이다. 해를 지나 내년 봄이 올 때까지, 시간을 아무리 더 갉아 내도 우리의 끝은 변하지 않는다. 그러니까 지금은 우리가 다시 헤어질 봄의 그늘 같은 것이다. 그 봄이 제 등 뒤편에나 남긴 그림자였다.",1,국내도서-소설/시/희곡
483,9788936432904,96351807,장길산 특별합본호 세트,"72,000원","4,000원",황석영 저,창비,"시대를 초월한 걸작, 세대를 뛰어넘는 감동!
새 세상을 꿈꾼 사람들의 절실한 염원

우리 시대 최고의 작가 황석영의 대표작 『장길산』(전12권)이 산뜻한 장정의 특별합본호 4권으로 다시 독자들을 만난다. 1974년부터 1984년까지 10년에 걸쳐 완성된 황석영 대하소설 『장길산』은 해방 이후 남한 최고의 역사소설 중 하나로 평가받은 작품의 명성에 걸맞게 지금까지 350만부 이상 판매되었으며, 현재의 판본을 바탕으로 제작된 SBS 대하드라마가 2004년 인기리에 방영되어 수차례 중쇄를 거듭하고, 연극 「장산곶 매」 등으로도 변주되는 등 꾸준히 독자들에게 사랑받고 있는 시대를 초월한 걸작으로 손꼽힌다. 손에 잡힐 듯 생생하고 뜨거운 인물들의 활약이 육중한 분량의 페이지를 가볍게 넘기게 하고, 불합리한 사회 질서를 타개하는 장길산의 활극은 통쾌함을 느끼게 한다. 또한 풍요로운 우리말 어휘와 아름다운 문장을 읽으며 모처럼 한국어의 진미를 만끽하는 보람도 누릴 수 있다.",1,국내도서-소설/시/희곡
484,9791190147996,108948788,까칠한 재석이가 달라졌다,"11,250원",620원,고정욱 저,애플북스,"베스트셀러 작가 고정욱의 대한민국 대표 청소년 성장소설
[까칠한 재석이]의 네 번째 하이킥! 
2016 세종도서 문학나눔 선정작! 

청소년에게 큰 사랑을 받은 [까칠한 재석이] 시리즈는 통통 튀는 매력의 캐릭터, 청소년들의 고민이 현실감 있게 담겨서 시리즈가 거듭될수록 더 큰 인기를 얻고 있다. 이렇게 ‘까칠한 재석이’가 독자들에게 장수 시리즈로 지속될 수 있는 이유는 고정욱 작가가 매해 300회 이상 강의를 통해 초중고 학생들을 만나 호흡하면서 아이들의 생활을 누구보다 현장에서 가까이 지켜보고 있기 때문일 것이다. 작가 역시 “재석이의 생명력은 전적으로 독자들이 준 것”이라며 작품을 사랑해주고 함께 소통해준 독자들에게 감사의 마음을 전했다.",1,국내도서-소설/시/희곡
485,9788932015712,1452396,태평천하,"11,700원",650원,채만식 저/이주형 편,문학과지성사,"부정적인 상황들이 난무하는 시대 현실을 독자적인 문학적 기법과 비판의식으로 그려냄으로써 ‘문학적 미’를 추구했던 작가 채만식의 대표적인 장편소설 『태평천하』. 판소리 사설의 반어, 자기 폭로, 비유, 과장, 희화화 등의 표현법에 사투리까지 섞은 요설로, 창을 듣는 듯한 느낌과 재미를 선사하는 작품. 세태풍자소설의 장을 열었던 채만식이 쓴 가족사소설의 전형.

문학과지성사 한국문학전집 2차분. 한국 현대 문학이 이 땅에서 출발한지 반세기. 이제 문학과지성사가 그 역사를 정리해본다. '살아 있는 동시대의 문학으로 ...",1,국내도서-소설/시/희곡
486,9791130647975,133320609,시티 뷰,"15,300원",850원,우신영 저,다산책방,"은희경, 전성태, 이기호, 편혜영, 백가흠, 최진영, 박준 작가 추천!

“이 소설은 우리에게 묻는다. 
당신의 밑바닥에는 무엇이 있는지.”

제14회 혼불문학상 수상작 『시티 뷰』가 출간되었다. 은희경, 전성태, 이기호, 편혜영, 백가흠, 최진영, 박준 등 현재 가장 활발하게 활동하는 한국 문학 작가 7인이 직접 심사하고 선정한 소설이다. 강박과 결핍, 자해와 산재, 트라우마 등에 시달리면서도 겉으로는 매끄러운 삶을 영위하려 애쓰는 오늘날 도시인의 초상을 세밀하게 그렸다. 경제적으로 안정된 중년의 중산층부터 불안정한 생계를 이어가는 이삼십 대 청년 노동자까지, 한 도시를 구성하는 여러 계층의 욕망과 상처를 “입체적이며 복합적인 인물을 통해 탁월하게 드러낸”다는 극찬과 함께 수상작으로 선정되었다.",1,국내도서-소설/시/희곡
487,9791130640525,103438824,중증외상센터 : 골든 아워 6~10 세트,"67,500원","3,750원",한산이가 저,몬스터,"이비인후과 전문의이자 구독자 70만 유튜브 채널 ‘닥터프렌즈’의 진행자,
네이버 시리즈의 대표 베스트셀러 작가, ‘한산이가’ 이낙준의 본격 메디컬 소설

2,500만 다운로드 이상을 기록하며, 명실상부한 네이버 시리즈의 간판 웹소설로 자리 잡은 『중증외상센터: 골든 아워』의 두 번째 시리즈가 몬스터(다산북스)에서 출간되었다. 16권 분량의 본편을 종이책 5권으로 압축 편집해 이야기의 흐름과 속도감을 놓치지 않은 1부에 이어, 새롭게 선보이는 2부도 웹소설의 필치는 살리되 방대한 분량이 주는 부담을 덜 수 있도록 이야기의 가지를 섬세하게 다듬었다. 

대한민국의 중증외상 시스템을 정상 궤도에 올려놓은 ‘난폭한 천사,’ 사람 살리는 일이라면 물불 안 가리는 의사 백강혁이 파키스탄의 작은 도시 한구에 자리를 잡으며 2부의 이야기는 막이 오른다.",1,국내도서-소설/시/희곡
488,9788965745617,29230415,풀꽃도 꽃이다 1,"16,650원",920원,조정래 저,해냄,"성적보다는 인간의 가치를 더 소중하게 여기며 사는 나라,
대한민국의 미래를 그리는 100년의 약속, 교육을 고민한다!
세계의 급속한 변화 속에서 결코 놓쳐서는 안 되는 장기 프로젝트,
우리 사회와 교육의 지향점을 제안하는 조정래 장편소설

분단과 전쟁으로 계속된 삶의 피폐함을 극복하고 입에 풀칠하고 내 자식 거두느라 급급했던 전쟁 세대 이후, ‘배우지 않으면 먹고살기 힘들다’는 위기의식 아래 모두가 ‘자식 공부’를 삶의 최종 목표로 삼고, 교육만을 위해 발버둥친 지 50여 년, 아버지 세대가 이루지 못한 꿈과 희망을 그 자식들은 결국 해냈을까?

",1,국내도서-소설/시/희곡
489,9791193128084,140001795,"시간이 멈춰 선 화과자점, 화월당입니다","15,120원",840원,이온화 저,다이브,"★★★ 전 세계를 사로잡은 최고의 화제작 ★★★ 
★★★ 국내 최초 출간 전 해외 11개국 판권 수출! ★★★ 

“당신의 인생 마지막 소원은 무엇입니까?”
한 입 먹는 순간 신비한 기적이 펼쳐진다!

어느 날, 죽은 연인으로부터 디저트가 배달된다면? 동네 한 귀퉁이에 자리 잡은 전통 화과자점 화월당. 밤 10시부터 12시까지 딱 2시간만 영업하며 골목을 밝히는 화월당에는 특별한 비밀이 있다. 바로 이곳을 찾는 손님들이 모두 어딘가 미스터리하고, 이들이 주문하는 디저트들 또한 신비한 기운을 내뿜는다는 것! 거기다 신묘한 검은 고양이가 드나든다는 소문까지 파다한데?!
프랑크푸르트 도서전에서 화제를 모으며, 국내 소설 최초로 출간 전 해외 11개국 판권 수출이 확정된 소설 《시간이 멈춰 선 화과자점, 화월당입니다》가 드디어 출간되었다. K-문학의 새로운 가능성을 보여준 이 작품은 리디북스 국내 판타지 분야 1위에 오르며 국내 독자들 사이에서도 폭발적인 반응을 얻고 있다.",1,국내도서-소설/시/희곡
490,9791193185407,124595462,봄그늘 4,"13,050원",720원,김차차 저,파란 (파란미디어),"너는 내 실수고 오욕의 역사였으며 내 모든 유년의 기억이었다.

“……박우경 니 진짜 미친갱이가.”
“아 개등신 같은 가시나.”

한때의 주말. 칸막이 책상 아래에서 우리가 잡았던 손. 문제집 안에 끼워져 있던 그 애의 쪽지. 깨끗한 교복 셔츠의 섬유 린스 냄새. 내 캔커피를 한 입씩 뺏어 마시며 장난스레 웃던 얼굴. 아, 그 웃는 얼굴. 죄다 지겹다는 듯 잔뜩 찌푸렸다가도 날 보면 일시에 소년처럼 말개지는 얼굴이 좋았다. 콧등을 설핏 찡그리고, 시원하게 휜 입매로 웃던 그 남자애. 나중에 서울에 가면 항상 저와 함께 있자던, 그 치기 어린 목소리. 그 애가 청라에서 보낼 지루한 유배는 아무리 길어도 1년이다. 해를 지나 내년 봄이 올 때까지, 시간을 아무리 더 갉아 내도 우리의 끝은 변하지 않는다. 그러니까 지금은 우리가 다시 헤어질 봄의 그늘 같은 것이다. 그 봄이 제 등 뒤편에나 남긴 그림자였다.",1,국내도서-소설/시/희곡
491,9791167763983,122319145,푸틴을 죽이는 완벽한 방법,"16,920원",940원,김진명 저,이타북스,"『무궁화꽃이 피었습니다』김진명 작가 집필 30주년 기념작
장편소설 『푸틴을 죽이는 완벽한 방법』
출간과 동시에 전 세계 출판계와 OTT 문의 쇄도

전쟁에서 지면 권좌에서 추락해야 하는 운명의 푸틴
그가 패배 직전의 이 전쟁에서 핵을 쓰지 않을 거라는
당신의 확신은 과연 타당한가

밀리언셀러 작가 김진명, 우크라이나 전쟁을 쓰다
신작 소설 『푸틴을 죽이는 완벽한 방법』출간

우크라이나 키이우 북쪽의 도시 부차. 미하일은 생일을 맞아 사랑하는 가족과 함께 저녁 식사를 하던 중 갑자기 나타난 러시아군의 칼에 찔려 의식을 잃고, 아내와 딸을 잃는다. 슬픔에 빠져 자살을 시도하지만 그조차 실패한 미하일은 어느 날 마을에서 자취를 감춰버린다. 미국 대통령 바이든이 이끄는 극비 오퍼레이션 ‘네버어게인’의 일원인 스토니. 그는 러시아인 여성 구호 활동가 구출 명령을 받고 도움을 청하기 위해 미국 해군사관학교 시절 동기 케빈 한을 찾아간다.",1,국내도서-소설/시/희곡
492,9791130630793,91401512,중증외상센터 : 골든 아워 1~5 세트,"67,500원","3,750원",한산이가 저,몬스터,"“사람 살리는 일에 무슨 승인이 필요합니까?”
네이버 웹소설 최고의 화제작, 현직 의사가 쓴 중증외상센터 분투기

외상 외과 전문의 이국종 교수의 분투를 지켜보며, 대한민국의 의료 체계에 회의를 품은 이들이 많을 것이다. 핏물을 뒤집어써가며 환자를 살려내는 일에 삶을 쏟아부어도 돌아오는 건 적자로 점철된 청구서와 철저한 무관심뿐.  여전히 중증외상센터의 상황은 나아지지 않았다. 이런 답답한 현실을 시원하게 도려낼 메디컬 소설 『중증외상센터: 골든 아워』가 몬스터에서 출간되었다. 

네이버 시리즈에서 누적 다운로드 1,500만 회를 돌파하며 화제작으로 떠오른 이 소설은 사명감 넘치는 또라이 외상 외과의 백강혁을 중심으로 위태로운 생명을 구해내는 한국대학교병원 중증외상센터를 다룬다. 이게 가능하나 싶은 시술들, 다양한 의학 상식들. 놀랍게도 이 모두는 철저한 고증을 따른 묘사로 오류가 전혀 없다. 이 소설을 써낸 ‘한산이가’가 현직 이비인후과 의사 이낙준이기 때문이. 자신의 재능을 다양하게 풀어내는 작가 이낙준의 본격 메디컬 소설을 기대해도 좋을 것이다. 


",1,국내도서-소설/시/희곡
493,9788974564698,8434969,생의 이면,"11,700원",650원,이승우 저,문이당,"제1회 대산문학상 수상작. 종교적 사유, 인간에 대한 이해와 성찰이라는 진지한 주제를 독특한 소설 영역을 확보하고 있는 이승우가 유년을 향한 고통스러운 여행을 감행하는 한 작가의 내면을 밀도 있게 형상화한 장편 소설이다. 이 작품은 소설가인 화자 '나'가 다른 한 소설가를 추적하여 그 삶을 재구성하는 평전체란 특이한 형식으로 쓰여진 자전성 강한 소설이다. 

인격 이면에 숨어 있는 근원적인 실체가 인간을 성장케 한다는 작가의 믿음으로 이 소설을 썼다는 저자는 어린 시절의 상처로 인해 대인 기피증을 가진 인물이 운명적인 사랑을 하고 신에게로 나아감으로써 그 콤플렉스를 치유, 승화시키는 과정을 밀도 있게 그려내고 있다. 문장 하나하나가 평론적이라 할 만큼 분석적이면서 깊이가 있어, 작가의 감칠맛 나는 글쓰기 스타일의 전형을 보여주는 대표 작품이다.",2,국내도서-소설/시/희곡
494,9788933801871,6259966,서 있는 여자,"15,300원",850원,박완서 저,세계사,"‘미풍양속’이라는 탈을 뒤집어쓴 부덕에의 강요
전통적 사고가 틀렸다고 말할 수 있는 주체적 여성의 갈등

연지는 평범한 중산층에서 태어나 대학 교육을 마치고 잡지사에서 일하는 주체적인 여성으로서, 일도 결혼도 여성성에 기대지 않고 남성과 평등한 상태로 영위해나가고자 한다. 이런 연지를 부모님 세대는 걱정스러운 눈으로 바라본다. 연지는 자신의 요구조건(평등한 결혼생활)을 수용해줄 수 있는 오랜 친구 철민과 결혼한다. 두 사람은 번갈아가며 대학원 공부를 하기로 하고 철민부터 공부를 시작한다.",1,국내도서-소설/시/희곡
