순위,ISBN,상품번호,상품명,판매가,YES포인트,저자,출판사,설명,출고예상일,관리분류
223,9791167763686,118610490,무궁화꽃이 피었습니다 1,"15,120원",840원,김진명 저,이타북스,"대한민국은 핵을 가져야 하는가?
경이로운 600만 부 판매부수를 기록했던 시대의 명작
김진명의 소설 『무궁화꽃이 피었습니다』 
집필 30주년 특별 개정판 출간!

1993년 출간 이후 600만 부의 경이로운 판매 부수를 기록한 김진명 작가의 『무궁화꽃이 피었습니다』가 올해 30주년을 맞아 이타북스에서 특별 개정판으로 출간된다. 『무궁화꽃이 피었습니다』는 김진명 작가를 단번에 대중소설가이자 밀리언셀러 작가로 만들어준 그의 첫 작품으로, 대한민국의 안보 문제에 대한 통찰을 흥미로운 서사 방식으로 담아냈다. 

김진명 작가가 소설을 통해 보여준 대한민국의 핵 보유 담론은, 『무궁화꽃이 피었습니다』가 출간된 1993년부터 2023년에 이르는 지금까지도 끊임없이 논의되고 있다. 이처럼 대한민국은 여전히 핵 자산 운용이라는 국제적 갈등의 중심에 있기에 작가는 핵무기 보유와 비핵화 선언 사이에서, 무엇이 옳은지 고민하는 국민 모두에게 이 책을 읽어볼 것을 권한다.",1,국내도서-소설/시/희곡
224,9788993607017,3472398,혼불 1,"10,450원",원,최명희 저,매안출판사,"우리 민족의 근원적인 정서, 원형질에 대한 완벽한 복원!
최명희 대하소설 『혼불』

1930년대 말. 전라도의 한 유서 깊은 문중에서 무너지는 종가(宗家)를 지키며 치열하게 몸을 일으키는 宗婦 3대와, 천하고 남루한 상민들이 겪을 수밖에 없었던 애환에 대한 이야기다. 어두운 역사, 암울한 시절. 외형적으로는 국권을 잃고 일제의 탄압을 극심하게 받았지만 내부적으로는 여전히 조선말의 정신구조와 문화를 지탱하고 있던 이중적 시대상황 속에서, 처참하게 부서지고, 상처받고, 뒤집히고, 고뇌하며, 한없이 몸부림치지만 ?..",1,국내도서-소설/시/희곡
225,9791197346521,125574654,다 하지 못한 말,"16,200원",900원,임경선 저,토스트,"『호텔 이야기』『가만히 부르는 이름』『곁에 남아 있는 사람』등, 동시대 사람들의 애틋한 이야기를 특유의 간결하고 담백한 문체로 담아내는 작가 임경선이 격정적인 사랑 소설 『다 하지 못한 말』로 돌아왔다. 

사랑의 달뜸과 황홀, 고통에 대한 지극한 회고

사랑에 빠지면 왜 하고 싶지만 못 하는 말이 생기고, 하기 싫지만 해야 하는 말을 의식하기 시작할까? 혼자만의 일상을 잘 보살피며 지내오던 여성 직장인인 ‘나’는 남성 피아니스트인 ‘당신’을 만나 운명처럼 그에게 빠져들며 단정했던 일상은 조금씩 흐트러져간다. “나를 잃어버리지 않는 사랑이 가능하기나 한가?”라며 그렇게 사랑의 달뜸, 황홀 그리고 고통을 온몸으로 겪어간다. 

‘나’는 ‘당신’을 잃을 두려움에 말을 아끼고 그 어쩔 줄 모르는 고통에 편지인지, 일기인지, 혹은 단순히 혼잣말인지 모를 글을 쓴다. 오직 깊이 사랑했던 사람만이 내게 깊은 상처를 줄 수 있는 것.",1,국내도서-소설/시/희곡
226,9788936439231,120234991,노 휴먼스 랜드,"13,500원",750원,김정 저,창비,"제3회 창비×카카오페이지 영어덜트 소설상 대상 수상작

아무도 없는 서울, 그곳에 나타난 정체불명의 존재들
올여름 당신을 사로잡을 SF 재난 블록버스터

휘몰아치는 서사와 독보적인 상상력의 강렬한 SF 블록버스터가 올여름 독자들을 찾는다. 김정 장편소설 『노 휴먼스 랜드』(소설Y)는 “근미래에 있을 법한 일로 정교한 세계를 만들어 내는 힘이 뛰어나다”는 평가를 받으며 제3회 창비×카카오페이지 영어덜트 소설상 대상을 수상한 작품으로, 기후 난민 청소년 ‘미아’가 멸망한 한국에 조사단으로 파견되어 겪는 모험을 다룬다. 초반부터 속도감 있게 전개되는 서사로 압도적인 몰입감을 선사하고, 쉼 없이 몰아치는 미스터리는 결말까지 눈을 뗄 수 없게 하며, 상상 이상의 반전이 잊을 수 없는 여운을 남긴다. 전 지구적 규모로 펼쳐지는 스펙터클한 서사가 시선을 사로잡는 가운데, 기후 재난 속에서 분투하는 인물들의 모습은 기후 위기 시대를 살아가는 우리에게 서늘한 공감을 불러일으킨다.",1,국내도서-소설/시/희곡
227,9788932025322,12021460,탁류,"14,400원",800원,채만식 저,문학과지성사,"파행적인 자본주의화가 불러들인 폐해
2014년 현재는 청류(淸流)라고 할 수 있는가

1930년대, 자본의 수렁에서 허우적거리는 식민지 조선의 부조리한 현실을 하류에 이르면서 흐려지는 금강에 비유한 명작, 채만식의 장편소설 『탁류』가 문학과지성사의 한국문학전집 마흔두번째 책으로 출간됐다. 

작품은 군산의 한 미두장에서 돈을 잘못 놀린 ‘정주사’가 자식뻘 되는 젊은이에게 모욕을 당하는 장면에서 출발한다. 미두는 요즘 식으로 말하자면 쌀 선물거래다. 미두처럼 초고도로 복잡하게 파생된 자본증식 시스템은 끊임없이 유입되는데 그 앞에서 ‘정주사’와 같은 일반인은 구조적 모순을 전혀 눈치채지 못한 채 돈을 향한 마음만 자꾸 앞세우다가 주머니를 몽땅 털리고 만다. 채만식은 본인은 물론 가족까지 파탄으로 내몰고 마는 정주사의 이런 행태를 한 개인의 비뚤어진 욕망으로 치부해버리지 않았다.",1,국내도서-소설/시/희곡
228,9791170520634,109323034,언제나 밤인 세계,"15,120원",840원,하지은 저,황금가지,"2세대 환상 문학의 마에스트로, 『얼음나무 숲』 하지은 7년 만의 대귀환!
런칭 즉시 카카오페이지 문학 탭 랭킹 1위 등극!

한국 환상 문학의 중흥기를 이끈 작가, 하지은의 신간 『언제나 밤인 세계』가 출간되었다. 샴쌍둥이로 태어났지만 서로 운명이 엇갈려 버린 두 남매의 애증을 그린 판타지 스릴러, 『언제나 밤인 세계』는 하지은 작가의 7년 만의 장편 신작이다. 그의 대표작 『얼음나무 숲』은 한국의 2세대 환상 문학을 대표하는 기념비적 작품으로, 탁월한 문학성과 특유의 탐미적이고 매혹적인 필체로 많은 독자를 사로잡았다. 2020년, 출간 11년 만에 개정판으로 재출간된 후 베스트셀러에 오르며 웹툰·드라마 판권 계약은 물론 러시아·일본 등에 출판 계약이 체결되는 등 국내외 장르 문학계의 뜨거운 사랑과 관심을 한 몸에 받은 바 있다.",1,국내도서-소설/시/희곡
229,9791194654919,147048255,퇴마록 세계편 3,"19,800원","1,100원",이우혁 저,반타,"한국에서 가장 많이 팔린 장르소설 ‘퇴마록’ 시리즈
상상을 초월하는 스케일과 재미로 사랑받은
《퇴마록_세계편》 전 3권

누적 판매량 1,000만 부를 돌파, 역대 한국 장르소설 베스트셀러 1위, 온오프라인 서점 스테디셀러 등 누구도 뛰어넘을 수 없는 압도적인 기록을 보유한 한국 오컬트 판타지의 시초 《퇴마록》. 

2025년 4월 《퇴마록 국내편》(전 2권)이 출간된 데 이어 《퇴마록 세계편》(전 3권)도 5월 오팬하우스에서 새롭게 출간된다. 국내에서만 주로 활동하던 퇴마사들이 그 영역을 넓혀 세계로 뻗어나가는 세계편은 여러 국가의 문화, 신화에 관한 묘사가 다채로워지며 국내편보다 볼거리가 풍성해졌다는 점에서 독자들에게 큰 사랑을 받아왔다. 그뿐만 아니라 강력하고 많아진 새 악인들의 등장으로 액션 장면이 더욱 화려해졌으며, 각자의 능력치를 점점 강화하면서 비로소 한 팀처럼 움직이는 퇴마사들의 성장을 지켜볼 수 있다는 것도 오직 세계편에서만 맛볼 수 있는 재미다.",1,국내도서-소설/시/희곡
230,9788937473074,17972275,한국이 싫어서,"12,600원",700원,장강명 저,민음사,"“사람은 가진 게 없어도 행복해질 수 있어. 
하지만 미래를 두려워하면서 행복해질 수는 없어.
나는 두려워하면서 살고 싶지 않아.”

한국에서의 익숙한 불행보다
호주에서의 낯선 행복을 택한 노마드 청춘의 등장
거침없는 수다로 한국 사회의 폐부를 드러내는
글로벌 세대의 ‘문제적’ 행복론

사회 비판적 문제에서 SF까지 아우르는 다양한 소재, 흡인력 있는 스토리 전개, 날렵하고 군더더기 없는 문장. 일본 대중 문학의 기수 오쿠다 히데오에 비견되며 한국 문학에 새로운 활기를 불어 넣고 있는 작가 장강명의 장편소설 『한국이 싫어서』가 민음사 ‘오늘의 젊은 작가’시리즈로 출간되었다. 한겨레문학상·수림문학상·제주4.3평화문학상에 이어 최근의 문학동네작가상까지, 문학상 4관왕 성취를 이룬 작가가 수상작들을 출간하기에 앞서 가장 먼저 선보이는 작품이다.

『한국이 싫어서』는 20대 후반의 직장 여성이 회사를 그만두고 호주로 이민 간 사정을 대화 형식으로 들려주는 소설이다.",1,국내도서-소설/시/희곡
231,9791161572109,142070496,거의 황홀한 순간,"15,120원",840원,강지영 저,나무옆의자,"지옥 같은 삶의 끝에서 마주한 거의 황홀한 순간
사랑이 우리에게 구원이 될 수 있을까?

절묘한 서술 트릭을 통한 반전과 전율의 카타르시스
디즈니플러스 오리지널 시리즈 『킬러들의 쇼핑몰』 원작자 강지영 신작 소설

미스터리 스릴러에서 판타지, 코미디, 로맨스까지 어떤 장르의 옷을 입든 압도적이고 파워풀한 서사로 독자를 사로잡아온 강지영 작가의 신작 장편소설. 디즈니플러스 오리지널 시리즈 『킬러들의 쇼핑몰』 원작 소설로 화제가 된 『살인자의 쇼핑몰』, tvN 드라마로 제작 방영된 『살인자의 쇼핑목록』, 영국의 대형 출판사에 수억 원의 선인세를 조건으로 판권이 판매된 『심여사는 킬러』 등 다양한 작품에서 기발한 설정과 독보적인 캐릭터를 선보여온 작가가 이번에는 ‘연향’이라는 중소도시를 배경으로 운명적으로 얽힌 두 여성의 이야기를 강렬한 색채로 그린다.",1,국내도서-소설/시/희곡
232,9788936438609,104721426,나인,"15,300원",850원,천선란 저,창비,"“어느 날, 식물들의 목소리가 들리기 시작했다.”
독보적 상상력, 폭발하는 스토리텔링!
『천 개의 파랑』 천선란 신작 장편소설

재미와 감동을 전 세대에 전하는 [소설Y] 시리즈가 새로운 K-영어덜트의 세계를 펼쳐 보인다. 한국형 영어덜트 소설의 지평을 넓히는 이번 시리즈의 두 번째 권으로 제4회 한국과학문학상 대상을 수상한 천선란 작가의 신작 장편소설 『나인』이 출간되었다. 이 소설은 평범한 고등학생 ‘나인’이 어느 날 식물들의 목소리를 듣기 시작하면서 펼쳐지는 이야기다. 숲의 속삭임을 따라 우연히 2년 전 실종 사건의 전말을 알게 된 나인은 친구 미래, 현재, 승택과 함께 숨겨진 진실을 파헤치기 시작한다. 사소한 것도 지나치지 않는 나인과 친구들의 모습은 우리가 어떤 목소리에 귀 기울여야 하는지를 깊이 성찰하게 한다. 흡인력 있는 스토리 전개와 참신한 상상력, 속도감 넘치는 서스펜스를 모두 갖춘 이 특별한 소설은 천선란 작가의 찬란한 성취로 기억될 작품이다.",1,국내도서-소설/시/희곡
233,9788936434151,14940652,계속해보겠습니다,"14,400원",800원,황정은 저,창비,"지금 황정은을 읽지 않는다면 
처연하게 아름다운 세계를 놓치고 있는 것이다

『계속해보겠습니다』는 2012년 가을호부터 2013년 여름호까지 ‘소라나나나기’라는 제목으로 계간 『창작과비평』에 연재되었던 작품이다. 연재 종료 후 일년여 동안 심혈을 기울여 개고한 끝에 주인공 소라와 나나, 나기의 감정선이 더욱더 깊고 선명해져 행간에서조차 세 인물의 호흡이 느껴질 정도로 작품의 농도가 짙어졌다. 황정은은 앞선 두권의 소설집에서 기발한 상상력과 그것을 구현해내는 뛰어난 언어 조탁력을 보여주었고 그의 첫 장편이자 한국일보문학상 수상작인 『백의 그림자』에서 기저에 품은 서정성을 유감없이 보여주었다. 『계속해보겠습니다』는 그 서정의 결을 이어가면서도 잔잔하게 흘러가 폭발적으로 파급되는 황정은식 서정의 마력은 더욱 강력해졌다.",1,국내도서-소설/시/희곡
234,9788954637800,21395076,파도가 바다의 일이라면,"15,120원",840원,김연수 저,문학동네,"사람과 사람 사이에는 심연이 존재한다. 깊고 어둡고 서늘한 심연이다. 살아오면서 여러 번 그 심연 앞에서 주춤거렸다. 심연은 이렇게 말한다. “우리는 서로에게 건너갈 수 없다.” 
나를 혼잣말하는 고독한 사람으로 만드는 게 바로 그 심연이다. 심연에서, 거기서, 건너가지 못한 채, 그럼에도 뭔가 말할 때, 가닿을 수 없다는 사실을 알면서도 심연 저편의 당신을 향해 말을 걸 때, 그때 내 소설이 시작됐다. _‘작가의 말’에서

타인에게는 내가 짐작할 수 없는 아득하고 깊은 부분이 있다는 것을 알게 되었을 때, 거기서 멈춰 서 타인을 이해하려는 노력을 포기하는 사람도 있겠지만, 김연수의 소설은 바로 여기에서부터 시작된다. 우리에게는 서로가 건너기 힘든 아득한 심연이 있고, 바로 그렇기 때문에 이해하려는 노력을 멈추지 말아야 한다는 것.",1,국내도서-소설/시/희곡
235,9788937473302,95746166,초급 한국어,"12,600원",700원,문지혁 저,민음사,"2010년 단편소설 「체이서」를 발표하며 작품 활동을 시작한 문지혁의 네 번째 장편소설 『초급 한국어』가 민음사 ‘오늘의 젊은 작가’ 시리즈로 출간되었다. 『초급 한국어』는 작가의 경험에서 출발한 자전적 소설이다. 이민 작가를 꿈꾸며 뉴욕에서 한국어를 가르치는 『초급 한국어』의 주인공 ‘문지혁’을 보고 있으면 자연스레 강사이자 번역가, 소설가인 현실의 문지혁이 떠오른다. 소설은 어디까지 진실이고 어디서부터 허구인가? 작가에 따르면 모든 소설은 “수정된 자서전”이다. 소설가의 삶을 ‘다른 이름으로 저장’한 결과로 생겨난 소설은 허구인 동시에 그만의 방식으로 진짜다. 문지혁이 보여 주는 또 다른 진실인 『초급 한국어』는 이방인의 시선으로 한국어를 바라보게 하고, 한국어를 사용하는 우리들의 삶을 한 발짝 거리 둔 채 돌아보도록 한다.",1,국내도서-소설/시/희곡
236,9788936431419,133877508,율의 시선,"12,600원",700원,김민서 저,창비,"”난생처음 타인의 시선이 궁금해졌다.“

무성한 말들로 상처뿐인 이곳
너와 내가 눈으로 전하는 투명한 진심

출간 직후 베스트셀러에 오르며 큰 사랑을 받은 김민서 장편소설 『율의 시선』이 새로운 장정으로 독자들을 다시 만난다. 청소년심사단으로부터 압도적인 지지를 얻으며 제17회 창비청소년문학상을 수상한 이번 작품은 “찬란하게 아름답다.” “삶의 의미를 찾는 모두에게 추천한다.” 등의 찬사와 함께 “청소년만 아니라 어른들에게도 권하고 싶은 책”으로 무수한 추천을 받았다.

『율의 시선』은 타인과의 눈 맞춤을 어려워하며 관계 맺기에 서툰 중학생 ‘안율’의 시선을 따라간다. 진심 어린 교류를 이해하지 못하며 반 친구들과도 피상적인 관계만을 유지하던 율은 어느 날 독특한 아이 ‘이도해’를 만나며 자신의 세상에 균열을 느끼게 된다.",1,국내도서-소설/시/희곡
237,9788997870752,124217524,6교시 인성 영역,"14,220원",790원,김송은 저,스피리투스,,2,국내도서-청소년
238,9791165348274,123379687,죽은 남편이 돌아왔다 1,"14,220원",790원,제인도 저,팩토리나인,"죽은 남편의 얼굴을 기억 못 하는 여자.
자신이 죽은 남편이라고 주장하는 남자.

둘 중 누군가는 연극을 하고 있다!

남편의 사망 선고를 받은 날, 보험금을 받을 기쁨에 들뜬 효신에게 남편 재우가 살아있다는 비보가 전해진다. 경찰의 말을 믿지 못하는 효신. 사실 그녀는 남편을 죽인 후, 애인 필주와 함께 가평 빌라에 시체를 유기했기 때문이다. 청송 요양원에서 발견된 재우는 그녀가 알고 있는 남편이 아니었다. 그러나 시어머니와 경찰 등 모든 사람이 그를 재우로 인정한다. 할 수 없이 재우와 함께 집으로 돌아온 효신. 그렇게 두 사람의 불안한 동거가 시작되는데…. 『죽은 남편이 돌아왔다』는 한적한 전원마을의 듀플렉스 하우스를 배경으로, 살아남기 위해 혹은 복수하기 위해 서로를 속이고 배신하는 남녀의 이야기다.",1,국내도서-소설/시/희곡
239,9791167371898,110508491,여름과 루비,"15,300원",850원,박연준 저,은행나무,"나와 당신을 루비처럼 빛나게 해준 여름,
‘첫 순간’이 유성우처럼 쏟아지던 우리들의 유년에 대하여
박연준 시인의 첫 장편소설! 

모든 이별은 언덕 위에서 이루어진다. 사소한 이별이라 해도 그게 이별이라면, 올라선 곳에서 내려와야 한다. 내려오기. 그게 이별이다. 다리가 후들거리는 건 낙차 때문이다. 당신이 있는 곳과 없는 곳, 거기와 여기, ‘사이’라는 높이. -본문 중에서

시집 『속눈썹이 지르는 비명』 『아버지는 나를 처제, 하고 불렀다』 『베누스 푸디카』 『밤, 비, 뱀』, 산문집 『소란』 『인생은 이상하게 흐른다』 『모월모일』 『쓰는 기분』 등으로 자기만의 작품세계를 구축해온 박연준 시인의 첫 장편소설 『여름과 루비』가 출간되었다. 소설 『여름과 루비』는 세계의 모든 것을 받아들이는 ‘첫 순간’, 유성우처럼 황홀하게 쏟아지는 유년 시절의 그 순간들을 그녀만의 깊고 섬세한 통찰로 그려내고 있다.

독자들에게 박연준은 시인과 에세이스트다.",1,국내도서-소설/시/희곡
240,9788956609454,23157877,댓글부대,"15,120원",840원,장강명 저,은행나무,"“사람들이 두려워하는 걸 건드려야 해. 두려움과 죄의식. 

백만 명, 이백만 명을 한꺼번에 공략하는 방법은 그것뿐이야!”



누가 우리의 진실을 왜곡하는가!

다수의 진실을 조종하는 보이지 않는 손들의 음모



경쾌하고 날렵한 문체, 거침없이 이야기를 밀고나가는 힘!

2015년 한국문학이 주목한 작가 장강명 화제의 수상작



제3회 제주4.3평화문학상 수상작 장강명 장편소설 《댓글부대》가 출간된다. 그간 《표백》 《한국이 싫어서》 등 사회성 짙은 소설을 써온 장강명의 소설 《댓글부대》는 이전 작품들보다 훨씬 더 강력한 목소리로 부박한 현실에 정면 돌파를 시도한 소설이다. 



인터넷저널의 순기능과 역기능을 정치권력이 악의적으로 이용하고, 그들의 하수인으로 살다 결국 용도 폐기되는 이십 대 젊은이들의 참혹한 조건을 사실적으로 그려냄으로써 ‘댓글정치’가 지닌 대중조작의 폭력성을 신랄하게 그려내는 데 성공했다.",2,국내도서-소설/시/희곡
241,9791160404517,96536946,삼미 슈퍼스타즈의 마지막 팬클럽,"12,420원",690원,박민규 저,한겨레출판,"“1할 2푼 5리의 승률로 살아가는 모두에게”
마이너리티들의 영원한 히어로, 베스트셀러 소설가 박민규의 대표작
『삼미 슈퍼스타즈의 마지막 팬클럽』 개정 2판 출간

“치기 힘든 공은 치지 않고, 잡기 힘든 공은 잡지 않는다.”
‘낙오자들’에게 띄우는 조금은 슬픈, 그러나 유쾌한 연가

필요 이상으로 일하고, 필요 이상으로 빠르게 흘러가는 세상에서 우리는 어떻게 살아남아야 할까. 이 질문에 대한 도발적인 대답으로 제8회 한겨레문학상을 수상한 박민규 작가의 『삼미슈퍼스타즈의 마지막 팬클럽』 개정 2판이 출간됐다. 이 작품은 출간 당시 기존 소설에서 접하기 어려웠던 기발하고 유쾌한 상상력, 감각적인 문장으로 대단한 신인 작가의 탄생을 알리며 문단의 주목을 받았으며, 이후 많은 독자의 공감과 사랑을 받아왔다.",1,국내도서-소설/시/희곡
242,9791193190364,147069442,"당신의 잘린, 손","12,600원",700원,"배예람,클레이븐 저",텍스티(TXTY),"같은 한 줄, 다른 두 편의 이야기. 매드앤미러 프로젝트. 

매드앤미러는 ‘매력적인 한 문장이 각기 다른 작가를 만날 때 어떻게 달라질까?’라는 재미있는 상상에서 시작한 텍스티(TXTY)의 프로젝트다. 그 상상을 현실로 만들기 위해 호러 전문 창작 집단 ‘매드클럽’과 환상문학 웹진 ‘거울’을 모았다. 같은 한 줄에서 출발했으나, 전혀 다른 이야기가 펼쳐지는 다채로운 매드앤미러의 이야기 세계로 독자들을 초대한다.

공통 한 줄:
바다에서 거대한 손이 올라왔다.",1,국내도서-소설/시/희곡
243,9791130699516,119458466,토지 5,"15,300원",850원,박경리 저,다산책방,"54년 만에 현대적 감각으로 재탄생한
우리 시대 최고의 고전 ‘토지’!
“어떠한 역경을 겪더라도 생명은 아름다운 것이며
삶만큼 진실한 것은 없다.”

명실상부 한국 문학사의 기념비적 작품으로 자리하고 있는 박경리의 대하소설 『토지』가 첫 집필 54년 만에 현대적 감각으로 다시 탄생했다. 주지하다시피 우리 근대사의 굵직한 사건들이 선명하게 기록되어 있는 『토지』는 우리말의 미적 감각을 첨예하게 보여주는 작품이다. 이러한 『토지』는 누구도 부인할 수 없는 한국문학의 대표 작품으로서 오늘날까지 범국민적으로 읽혀온 것이 사실이다. 한말부터 일제강점기까지 근대 우리 민족이 겪은 피탈의 상처들을 아우르며 격변하는 시대 속 한민족의 삶을 생생하게 그려낸 대하소설 『토지』. 한국 문학사에 다시없을 걸작이 원전을 충실하게 살린 편집과 고전에 대한 선입견을 완벽하게 깨부수어줄 디자인으로 새 시대의 새 독자를 만날 준비를 마쳤다.",1,국내도서-소설/시/희곡
244,9791130640266,103026865,그는 흰 캐딜락을 타고 온다,"12,600원",700원,추정경 저,다산책방,"강원랜드의 거리에서 SF와 누아르가 만나다
“어차피 능력이 아니라 저주였어” 
질병은 능력이었고, 능력은 저주였다. 

카지노 촌 뒷골목에서 전당포 직원으로 살아가던 소년 진. 그는 알 수 없는 자들로부터 무자비하게 사냥당하기 시작한다. 이 모든 건, 병인 줄만 알았던 그의 저주 같은 능력 때문. 그를 노리는 이들과 그를 지키려는 사람들의 대립 속에서 남은 선택은 하나뿐이다. 
능력을 각성하든가, 죽든가.",1,국내도서-소설/시/희곡
245,9788936434144,13518051,투명인간,"14,400원",800원,성석제 저,창비,"성석제 소설의 정점, 절대적인 감동!
각박한 이 세상, 바보같이 아름다운 한 사람이 있었다

우리 시대 최고의 이야기꾼 성석제가 2년 만의 새 장편 『투명인간』으로 돌아왔다. 특유의 입담과 해학은 경지에 달했고, 시대와 개인의 핵심을 묘파하는 날렵한 필치는 가히 절정에 이르렀다. 그가 천의무봉의 솜씨로 펼쳐놓는, 눈물겹게 아름다운 한 인간의 이야기. 누구도 주목하지 않았지만 묵묵히 우리 곁을 지켜온 그의 일생이 우리가 잊고 있던 주변의 누군가를 돌아보게 하고, 굴곡의 역사 가운데 던져진 개인의 운명을 생각하게 한다. “우리 모두가 기다려오던 바로 그 걸작” “한국소설의 새 지평이 열리는 장면”(염무웅)이라는 평이 무색하지 않은, 성석제 소설의 결정판, 우리 시대를 대표할 작품의 탄생이다.

한 남자가 한강 다리 위에 서 있다. 금방이라도 다리 아래로 몸을 던질 것만 같은 모습을 하고 있지만, 그는 누구의 눈에도 띄지 않는 투명인간이다.",2,국내도서-소설/시/희곡
