순위,ISBN,상품번호,상품명,판매가,YES포인트,저자,출판사,설명,출고예상일,관리분류
1,9788998441012,8759796,모순,"11,700원",650원,양귀자 저,쓰다,"초판이 나온 지 벌써 15년이 흘렀지만 이 소설 『모순』은 아주 특별한 길을 걷고 있다. 그때 20대였던 독자들은 지금 결혼을 하고 30대가 되어서도 가끔씩 『모순』을 꺼내 다시 읽는다고 했다. 다시 읽을 때마다 전에는 몰랐던 소설 속 행간의 의미를 깨우치거나 세월의 힘이 알려준 다른 해석에 놀라면서 “내 인생의 가장 소중한 책 한 권”으로 꼽는 것을 주저하지 않는다. 『모순』이 특별한 것은 대다수의 독자들이 한 번만 읽고 마는 것이 아니라 적어도 두 번, 혹은 세 번 이상 되풀이 읽고 있다는 사실에 있다.

『모순』의 주인공은 25세의 미혼여성 안진진. 시장에서 내복을 팔고 있는 억척스런 어머니와 행방불명의 상태로 떠돌다 가끔씩 귀가하는 아버지, 그리고 조폭의 보스가 인생의 꿈인 남동생이 가족이다. 여기에 소설의 중요 인물로 등장하는 이모는 주인공 안진진의 어머니와는 일란성 쌍둥이로 태어났지만 인생행로는 사뭇 다르다.",1,국내도서-소설/시/희곡
2,9788936434120,13137546,소년이 온다,"13,500원",750원,한강 저,창비,"말라파르테 문학상, 만해문학상 수상작 
우리 시대의 소설 『소년이 온다』 출간 10주년 기념 특별한정판 

2014년 만해문학상, 2017년 이탈리아 말라파르테 문학상을 수상하고 전세계 20여개국에 번역 출간되며 세계를 사로잡은 우리 시대의 소설 『소년이 온다』를 출간 10주년을 맞아 특별한정판으로 새롭게 선보인다. 이 작품은 『채식주의자』로 인터내셔널 부커상을 수상한 한강 작가에게 “눈을 뗄 수 없는, 보편적이며 깊은 울림”(뉴욕타임즈), “역사와 인간의 본질을 다룬 충격적이고 도발적인 소설”(가디언), “한강을 뛰어넘은 한강의 소설”(문학평론가 신형철)이라는 찬사를 선사한 작품으로, 그간 많은 독자들에게 광주의 상처를 깨우치고 함께 아파하는 문학적인 헌사로 높은 관심과 찬사를 받아왔다. ",1,국내도서-소설/시/희곡
3,9788937473401,116586303,급류,"12,600원",700원,정대건 저,민음사,"2020년 《한경신춘문예》에 장편소설 『GV 빌런 고태경』이 당선되어 작품 활동을 시작한 소설가 정대건의 두 번째 장편소설 『급류』가 오늘의 젊은 작가 시리즈 40번으로 출간되었다. 『급류』는 저수지와 계곡이 유명한 지방도시 ‘진평’을 배경으로, 열일곱 살 동갑내기인 ‘도담’과 ‘해솔’의 만남과 사랑을 그린 소설이다. 

아빠와 함께 수영을 하러 갔던 도담이 한눈에 인상적인 남자아이 ‘해솔’이 물에 빠질 뻔한 것을 구하러 뛰어들며 둘의 인연은 시작된다. 운명적이고 낭만적으로 보이는 첫 만남 이후 둘은 모든 걸 이야기하고 비밀 없는 사이가 되지만, 그 첫사랑이 잔잔한 물처럼 평탄하지만은 않다. 모르는 사이에 디뎌 빠져나올 수 없이 빨려드는 와류처럼 둘의 관계는 우연한 사건으로 다른 국면을 맞이한다.",1,국내도서-소설/시/희곡
4,9791197221989,145567095,"첫 여름, 완주","15,300원",850원,김금희 저,무제,"세심한 온정의 세계를 빚어내는 우리 시대의 작가 김금희의 신작 장편소설. 돈을 갚지 않고 사라진 선배 고수미의 고향 완주 마을을 찾은 성우 손열매는 그곳에서 합동 장의사 겸 매점을 운영하는 수미 어머니의 집에 머물게 된다. 오갈 데 없는 처지에 목소리에까지 이상이 생긴 열매는 수미 어머니의 매점을 지키며 각양각색의 동네 사람들을 만난다. 외계인 같은 수수께끼의 청년 ‘어저귀’ 강동경과 춤은 좋아하고 슬픈 이야기는 싫어하는 옆집 중학생 한양미, 시고르자브르종 개 샤넬과 함께 사는 배우 정애라 등 생생하고 개성 넘치는 인물들이 열매와 함께 여름 한 철 저마다의 완주를 이어 간다.

박정민 배우의 무제 출판사에서 펴내는 ‘듣는 소설’ 프로젝트의 첫 권인 이 소설은 시각 장애인을 위한 오디오북을 염두에 두고 쓰여 장편소설이면서도 대사와 지문이 살아 있는 독특한 글쓰기로 읽는 재미를 더한다.",1,국내도서-소설/시/희곡
5,9788954682152,103495056,작별하지 않는다,"15,120원",840원,한강 저,문학동네,"무엇을 생각하면 견딜 수 있나.
가슴에 활활 일어나는 불이 없다면.
기어이 돌아가 껴안을 네가 없다면.

이곳에 살았던 이들로부터, 이곳에 살아 있는 이들로부터
꿈처럼 스며오는 지극한 사랑의 기억

2016년 『채식주의자』로 인터내셔널 부커상을 수상하고 2018년 『흰』으로 같은 상 최종 후보에 오른 한강 작가의 5년 만의 신작 장편소설. 2019년 겨울부터 이듬해 봄까지 계간 [문학동네]에 전반부를 연재하며 큰 관심을 모은 작품으로, 『소년이 온다』(2014), 『흰』(2016), ‘눈’ 연작(2015, 2017)을 통해 어둠 속에서도 한줄기 빛을 향해 나아가는 인간의 고투와 존엄을 그려온 한강 문학이 도달한 눈부신 현재를 보여준다. 오래지 않은 비극적 역사의 기억으로부터 길어올린, 그럼에도 인간을 끝내 인간이게 하는 간절하고 지극한 사랑의 이야기가 눈이 시리도록 선연한 이미지와 유려하고 시적인 문장에 실려 압도적인 아름다움으로 다가온다.",1,국내도서-소설/시/희곡
6,9788936434595,108422348,채식주의자,"15,300원",850원,한강 저,창비,"인터내셔널 부커상, 산클레멘테 문학상 수상작
전세계가 주목한 한강의 역작을 다시 만나다 

2016년 인터내셔널 부커상을 수상하며 한국문학의 입지를 한단계 확장시킨 한강의 장편소설 『채식주의자』를 15년 만에 새로운 장정으로 선보인다. 상처받은 영혼의 고통과 식물적 상상력의 강렬한 결합을 정교한 구성과 흡인력 있는 문체로 보여주는 이 작품은 섬뜩한 아름다움의 미학을 한강만의 방식으로 완성한 역작이다. “탄탄하고 정교하며 충격적인 작품으로, 독자들의 마음에 그리고 아마도 그들의 꿈에 오래도록 머물 것이다”라는 평을 받으며 인터내셔널 부커상을 수상했던 『채식주의자』는 “미국 문학계에 파문을 일으키면서도 독자들과 공명할 것으로 보인다”(뉴욕타임스), “놀라울 정도로 아름다운 산문과 믿을 수 없을 만큼 폭력적인 내용의 조합이 충격적이다”(가디언)라는 해외서평을 받았고 2018년에는 스페인에서 산클레멘테 문학상을 받는 등 전세계에서 뜨거운 반응을 일으켰다.",1,국내도서-소설/시/희곡
7,9788998441074,72127217,나는 소망한다 내게 금지된 것을,"13,500원",750원,양귀자 저,쓰다,"작가 양귀자의 장편소설. 1992년에 초판이 나오자마자 바로 페미니즘 논란과 함께 화제의 중심에 올랐고 그해 최고의 베스트셀러가 되었다. 1986년, 『원미동 사람들』로 80년대 한국사회의 부박한 삶을 축약해서 보여주고, 90년 첫 번째 장편소설 『희망』으로 급변하는 시대의 갈등과 모순을 굽이치는 이야기에 담아 묵직한 감동을 안겨줬던 작가가 펴낸 두 번째 장편소설이 『나는 소망한다 내게 금지된 것을』이다.

젊은 여성이 인기 남자배우를 납치해서 감금하고 조종하는 이 소설은 발간 직후부터 독자와 평단의 관심을 집중시켰다. 우선은 지금까지의 양귀자 소설과는 달라도 너무 달랐다.",1,국내도서-소설/시/희곡
8,9791193647646,124622440,시한부,"15,120원",840원,백은별 저,바른북스,"“나 이번 크리스마스에 죽을 거야”

신예 작가 백은별의 성장 소설 『시한부』는 우울과 방황의 경계에 선 사춘기 청소년을 섬세하게 그려낸다. 15살의 시선으로 대한민국 학교 현실 최전방에서 ‘자발적 시한부’를 택하는 학생들의 실태를 폭로하고 있다. 최근 통계에 따르면 대한민국은 11년째 청소년 사망 원인 1위가 자살이라고 한다(여성가족부, 2023 청소년 통계). 그만큼 ‘청소년 우울’, ‘청소년 자살’이란 키워드는 현시대를 살아가고 있는 청소년들에게 떼려야 뗄 수 없는 문제가 되었다. 어른들은 그저 철없는 투정, 지나가는 한낱 감정으로 치부하지만, 실제 청소년들이 느끼는 우울감은 더 깊고 무겁다.

백은별 작가는 같은 10대로서 청소년들이 느끼는 우울과 혼란, 죽음에 관한 고민을 『시한부』 등장인물들의 서사에 반영해 구체화했다. 주인공 수아와 단짝 윤서뿐만 아니라 주변 인물들에게도 각각의 서사를 부여함으로써 ‘우울’, ‘자살’에 관한 다양한 관점을 보여준다.",1,국내도서-청소년
9,9791190090261,91766653,천 개의 파랑,"15,300원",850원,천선란 저,허블,"오늘날 전 세계 독자가 사랑하는 “우리의 가장 따듯한 SF”

천선란 작가는 2019년 장편소설 『무너진 다리』를 출간하며 데뷔했으며, 『천 개의 파랑』으로 제4회 한국과학문학상 장편 대상을 수상하며 본격적으로 작품 활동을 시작했다. 『천 개의 파랑』은 출간 이후 독자와 평단의 주목을 받았는데, 2021년 매일경제·교보문고 〈2021년을 여는 책〉에 선정되었을 뿐만 아니라, 소설가 최진영, 영화감독 민규동, 배우 손수현 등 여러 아티스트들의 찬사를 받으며 전 영역에서 뜨거운 관심을 받았다. 이후 문학뿐 아니라 공연과 영화 분야에서도 주목을 받았는데, 2024년 국립극단과 서울예술단에서 각각 연극과 창작가무극으로 제작되어 무대에 올랐으며, 특히 창작가무극은 관객들의 성원에 힘입어 2025년 재공연되었다. 최근 세계 3대 영화사인 워너 브라더스 픽쳐스와 영화화 판권 계약을 체결하며 스크린 진출을 앞두고 있다. ",1,국내도서-소설/시/희곡
10,9791161571188,99308021,불편한 편의점,"15,120원",840원,김호연 저,나무옆의자,"불편한데 자꾸 가고 싶은 편의점이 있다! 
힘들게 살아낸 오늘을 위로하는 편의점의 밤
정체불명의 알바로부터 시작된 웃음과 감동의 나비효과
『망원동 브라더스』 김호연의 ‘동네 이야기’ 시즌 2

2013년 세계문학상 우수상 수상작 『망원동 브라더스』로 데뷔한 후 일상적 현실을 위트 있게 그린 경쾌한 작품과 인간의 내밀한 욕망을 기발한 상상력으로 풀어낸 스릴러 장르를 오가며 독자적인 작품 세계를 쌓아올린 작가 김호연. 그의 다섯 번째 장편소설 『불편한 편의점』이 출간되었다. 『불편한 편의점』은 청파동 골목 모퉁이에 자리 잡은 작은 편의점을 무대로 힘겨운 시대를 살아가는 우리 이웃들의 삶의 속내와 희로애락을 따뜻하고 유머러스하게 담아낸 작품이다. 『망원동 브라더스』에서 망원동이라는 공간의 체험적 지리지를 잘 활용해 유쾌한 재미와 공감을 이끌어냈듯 이번에는 서울의 오래된 동네 청파동에 대한 공감각을 생생하게 포착해 또 하나의 흥미진진한 ‘동네 이야기’를 탄생시켰다.",1,국내도서-소설/시/희곡
11,9791198547514,124235834,수족관,"15,930원",880원,유래혁 저,포스터샵,"누군가에게 과거는 헤어나올 수 없는 커다란 수족관이 되고야 만다. 
그들은 끝내 바다를 만나게 될 수 있을까. 서로의 숨을 훔치지 않고, 자유로울 수 있을까. 

소설 ‘수족관’은 보육 시설에서 자라난 인물 ‘류이치’가, 먼저 보육 시설에서 도망쳐나온 인물 ‘아카리’를 만나 겪게 되는 일들을 그려낸다. 이 두 인물은 자신들이 가진 뿌리 깊은 과거와 상처, 그 이야기가 만들어낸 수족관에서 만나 입을 맞추고, 서로의 숨을 훔쳐가면서도 언젠가 오키나와의 너른 바다에 도착하는 꿈을 나눈다. 이 둘은 수족관을 벗어나 눈부신 햇살 아래 들려오는 파도 소리를 들을 수 있을까.",1,국내도서-소설/시/희곡
12,9791162203620,125761518,파과 (리커버),"16,020원",890원,구병모 저,위즈덤하우스,"한국 소설에 가장 강렬하게 새겨질 새로운 여성 서사를 탄생시킨 구병모 작가의 《파과》가 새 옷을 갈아입었다. 40여 년간 날카롭고 냉혹하게 청부 살인을 업으로 삼아온 60대 여성 킬러 ‘조각(爪角)’. 몸도 기억도 예전 같지 않게 삐걱거리기 시작하면서 이제는 퇴물 취급을 받는다. 노화와 쇠잔의 과정을 겪으며 조각은 새삼스레 ‘타인’의 눈 속에 둥지를 튼 공허를 발견하게 된다. 소멸의 한 지점을 향해 부지런히 허물어지고 있는 모든 것, 깨지고 상하고 뒤틀린 살아 있는 모든 것에 대해 연민을 느끼며, 조각의 마음속에 어느새 지키고 싶은 것들이 하나둘 생겨나기 시작한다. 《파과》는 짧은 시간 빛나다 사라질 살아 있는 모든 것들에 대한 뜨거운 찬사다.",1,국내도서-소설/시/희곡
13,9791141601300,130500819,이중 하나는 거짓말,"14,400원",800원,김애란 저,문학동네,"교보문고 ‘소설가 50인이 뽑은 올해의 소설’ 1위 
알라딘, 예스24 올해의 책
『이중 하나는 거짓말』 특별 한정 니트 에디션

한 해를 마무리하며 저마다 자신에게 소중한 의미로 남은 책의 목록을 되짚어보는 지금, 올여름에 출간되어 현재까지 독자들의 커다란 사랑을 받고 있는 김애란 작가의 두번째 장편소설 『이중 하나는 거짓말』을 특별 한정 ‘니트 에디션’으로 선보인다. 『이중 하나는 거짓말』은 알라딘과 예스24 모두에서 ‘올해의 책’으로 선정되었으며, 특히 발표될 때마다 화제를 모으고 있는 교보문고 특별기획 ‘소설가 50인이 뽑은 올해의 소설’ 1위로도 꼽혔다. 김애란 작가는 2017년에 출간한 『바깥은 여름』으로 1위에 오른 데 이어 이번에도 소설가들의 가장 많은 추천을 받은바, 동시대에 함께 글을 쓰는 동료 작가들의 마음을 움직였다는 점에서 더욱 뜻깊은 결과라고 할 수 있다.
",1,국내도서-소설/시/희곡
14,9791191061048,104663596,언젠가 우리가 같은 별을 바라본다면,"10,800원",600원,차인표 저,해결책,"차인표 작가가 전하는 감동의 휴먼 드라마 
자신을 대변할 수 없었던 이들을 위한 헌사 

『언젠가 우리가 같은 별을 바라본다면』은 고국을 떠나 70년 만에 필리핀의 한 작은 섬에서 발견된 쑤니 할머니의 젊은 시절을 담은 이야기이다. 작가는 우리나라가 일본에 주권을 빼앗긴 채 가난하고 핍박받던 시절을 맨몸으로 버텨 낸 우리 어머니의 어머니, 아버지의 아버지들의 이야기를 남기고자 집필을 시작했다. A4 용지 스무 장 분량으로 시작한 이야기는 10년의 집필 기간 동안 데이터 유실로 의지가 꺾이기도 하고 모든 것을 원점에서 복기하기를 반복하는 등 우여곡절을 겪은 후, 더욱 진정성과 사실에 근거한 서정적이고 아름다운 소설로 완성되었다. 

소설의 배경은 1930년대 백두산 기슭의 호랑이 마을. 엄마와 동생을 해친 호랑이 백호를 잡아 복수하기 위해 아버지와 함께 호랑이 마을로 찾아온 호랑이 사냥꾼 용이와 촌장 댁 손녀 순이 그리고 미술학도 출신의 일본군 장교 가즈오가 등장한다.",1,국내도서-청소년
15,9788936439651,133339464,대온실 수리 보고서,"16,200원",900원,김금희 저,창비,"창경궁 대온실의 비밀을 둘러싼 장엄한 서사
소설이 줄 수 있는 최대의 재미와 감동을 만나다
마침내 탄생한 김금희의 역작!

마음에 이는 무늬를 섬세하게 수놓으며 이야기의 아름다움을 증명해온 소설가 김금희가 장편소설 『대온실 수리 보고서』를 선보인다. 이 작품은 동양 최대의 유리온실이었던 창경궁 대온실을 배경으로, 그 안에 숨어 있는 가슴 저릿한 비밀과 인간에 대한 믿음을 저버리지 않으려는 신념을 감동적으로 보여준다. 작가가 작품활동을 시작한 지 15년 만에 처음 선보이는 역사소설로, 김금희 소설세계를 한차원 새롭게 열며 근래 보기 드문 풍성한 장편소설의 진면목을 보여주는 대작이다.",1,국내도서-소설/시/희곡
16,9788936439002,117873525,두고 온 여름,"12,600원",700원,성해나 저,창비,"독자와 평단이 주목하는 신예 성해나의 첫 장편소설 
우리가 두고 온 모든 인연과 마음을 위하여
한 시절의 여운 속에서 전하는 애틋한 안부 인사

첫번째 소설집 『빛을 걷으면 빛』(문학동네 2022)에서 나와 타인을 가르는 여러 층위의 경계와 그 경계를 넘어 서로를 이해하려는 시도를 진중하고 미더운 시선으로 탐사했던 작가 성해나가 신작 소설 『두고 온 여름』을 펴냈다. 젊은 감각으로 사랑받는 창비의 경장편 시리즈 소설Q의 열여섯번째 작품이다. 왜 타인을 헤아리고 받아들이는 일은 언제나 낯설고 어렵기만 한지, 이제는 함께할 수 없는 인연과 슬픔도 후회도 없이 작별할 수 있는지, 실패한 이해와 닿지 못한 진심은 어떻게 의미 없이 사라지지 않고 희미하게나마 빛나는 기억으로 남게 되는지 한층 깊어진 응시와 서정으로 풀어냈다. 

부모의 재혼으로 잠시 형제로 지냈지만 마음을 나누지 못하고 영영 남이 되어버린 기하와 재하.",1,국내도서-소설/시/희곡
17,9791191714425,125448039,가시고기,"15,300원",850원,조창인 저,산지,"아들을 살릴 수만 있다면 
내 몸을 내어주어도 좋은 가시고기아빠의 사랑

아버지의 사랑은 어떤 모습일까? 어머니의 사랑은 수없이 그려져 왔고, 공감을 불러오기에 의문이 없다. 그러나 아버지의 사랑이 어떤 모습일지 표현하기는 어렵다. 이 책은 아버지의 사랑을 가늠하게 해준다. 속내를 드러내지 않지만, 깊은 곳에 감춰진 숭고한 자기희생의 사랑. 그래서 더 슬프고 아름다운 아버지의 사랑이다. 

알을 낳고 떠나는 엄마가시고기를 대신해 새끼를 돌보고, 결국은 자신의 몸까지 내어주는 아빠가시고기. 주인공 정호연은 그런 가시고기 아빠다. 삶의 전부인 아들은 백혈병에 걸렸다. 게다가 골수이식이 아니면 더 이상 희망이 없다. 아들을 위한 최선은 무엇일까. 아들을 살릴 수만 있다면 내 몸은 뜯어 먹혀도 좋은 가시고기 아빠의 숭고한 사랑이 책 속에 담겨있다.",1,국내도서-소설/시/희곡
18,9788956609959,27643793,종의 기원,"15,120원",840원,정유정 저,은행나무,"3년, 모두가 손꼽아 기다려온 소설 
악惡은 어떻게 존재하고 점화되는가
심연에서 건져 올린 인간 본성의 ‘어두운 숲’

작가 정유정이 돌아왔다! 

펴내는 작품마다 압도적인 서사와 폭발적인 이야기의 힘으로 많은 독자들의 뜨거운 사랑을 받아온 정유정이 전작 《28》 이후 3년 만에 장편소설 《종의 기원》으로 독자들을 찾았다. 새로운 작품을 내놓을 때마다 다음 작품을 기다리게 하는 작가이기에 3년 만에 만나는 그의 신작을 향한 독자들의 기대는 그 시간만큼이나 높게 쌓였을 것이다. 

",1,국내도서-소설/시/희곡
19,9791198363510,119697570,아몬드,"15,120원",840원,손원평 저,다즐링,"* 전 세계 30개국 출간
* 국내 100만 부 판매 베스트셀러 
* 아시아권 최초, 일본 서점대상 1위 수상
* 美 아마존 베스트북 선정
* 특별부록, 단편 외전 수록

인간을 구성하는 두 가지 위대한 키워드, ‘감정’ 그리고 ‘사랑’ 
감정을 느끼지 못하는 독특한 소년의 특별하고 사랑스러운 성장 이야기

청소년, 부모, 성인 독자를 아우르는 
100만 부 베스트셀러, 올타임 스테디셀러 『아몬드』의 귀환!

2017년 처음 출간된 이래 국내 종이책 기준 100만 부 판매를 기록한 베스트셀러이자 스테디 셀러 『아몬드』가 절판기간을 거쳐 재출간된다. 강렬하고 새로운 2종의 표지로 청소년과 성인 독자에게 새롭게 다가가며, 단편 외전이 함께 수록돼 상상력과 읽는 재미를 배가시킨다. 

『아몬드』는 ‘감정을 느끼지 못하는 소년’ 윤재가 세상에 걸음을 내딛는 이야기로, 청소년부터 성인에 이르기까지 전연령대 독자의 꾸준한 사랑을 받아왔다.",1,국내도서-소설/시/희곡
20,9788954616515,5926713,희랍어 시간,"11,700원",650원,한강 저,문학동네,"말語을 잃어가는 한 여자의 침묵과
눈眼을 잃어가는 한 남자의 빛이 만나는 찰나의 이야기

어떤 원인도 전조도 없이, 여자는 말語을 잃는다. 그것이 처음 왔던 것은 열일곱 살 겨울. 말을 잃고 살던 그녀의 입술을 다시 달싹이게 한 건 낯선 외국어였던 한 개의 불어 단어였다. 시간은 다시 흘렀다. 이혼을 하고, 아홉 살 난 아이의 양육권도 빼앗기고, 다시 그렇게 말을 잃어버린 후, 일상의 모든 것들을 다 놓을 수밖에 없었던 여자가 선택한 것은 이미 저물어 죽은 언어가 된 희랍어.",1,국내도서-소설/시/희곡
21,9788954681179,102687133,밝은 밤,"15,300원",850원,최은영 저,문학동네,"백 년의 시간을 감싸안으며 이어지는 사랑과 숨의 기록 
『쇼코의 미소』 『내게 무해한 사람』 최은영 첫 장편소설

공감을 불러일으키는 이야기와 서정적이며 사려 깊은 문장, 그리고 그 안에 자리한 뜨거운 문제의식으로 등단 이후 줄곧 폭넓은 독자의 지지와 문학적 조명을 두루 받고 있는 작가 최은영의 첫 장편소설. ‘문화계 프로가 뽑은 차세대 주목할 작가’(동아일보) ‘2016, 2018 소설가들이 뽑은 올해의 소설’(교보문고 주관) ‘독자들이 뽑은 한국문학의 미래가 될 젊은 작가’(예스24) 등 차세대 한국소설을 이끌 작가를 논할 때면 분야를 막론하고 많은 사람들의 머릿속에 가장 선명히 떠오르며 활발한 작품활동을 이어가던 최은영 작가는 2019년, 예정돼 있던 소설 작업을 중단한 채 한차례 숨을 고르며 멈춰 선다.",1,국내도서-소설/시/희곡
22,9791197671708,110832417,사서함 110호의 우편물,"15,300원",850원,이도우 저,수박설탕,"2004년 첫 출간 이후 누적 110쇄를 돌파하고, 여러 나라에서 번역 출간되며 수많은 독자들의 사랑을 받아온 롱 스테디셀러 『사서함 110호의 우편물』. 누군가에겐 추억으로, 누군가에겐 현재진행형으로, 오랫동안 곁을 지켜온 이 이야기가 작가의 공들인 수정 작업을 거쳐 전면개정판으로 재출간되었다.

라디오 작가 공진솔은 평소 ‘연연하지 말자’가 인생 모토. 마음이 심란할 때 연필 몇 자루를 깎는 소소한 취미를 가졌고 세상과 사랑에 큰 기대없이 살아가려고 애쓰지만, 개편을 맞아 새로운 피디 이건과 프로그램을 함께하면서 인생 목표에 차질이 생기기 시작한다. 그저 자신의 삶을 꾸리며 평온하게 살고 싶을 뿐이었는데. 그런 진솔의 울타리를 매번 부드럽게 노크하며 문밖으로 불러내는 듯한 건을 마냥 외면할 수가 없다. 

30대 초중반, 적당히 쓸쓸하고 마음 한 자락 조용히 접어버린 이들이, 그럼에도 ‘다시 한번 사랑해보기로 하는’ 따스한 이야기.",1,국내도서-소설/시/희곡
