순위,ISBN,상품번호,상품명,판매가,YES포인트,저자,출판사,설명,출고예상일,관리분류
298,9791190090407,98797812,에스에프널 SFnal 2021 Vol.1,"15,300원",850원,테드 창 등저/조너선 스트라한 편,허블,"“테드 창” “켄 리우” 등 세계적 작가의 신작을 바로 만나다!
매년 전 세계 최고의 신작 SF를 선보이는 연간 선집 출간!

『에스에프널 SFnal』 시리즈는 2020년부터 다시 시작한 『올해의 SF 걸작선(The Year's Best Science Fiction)』의 한국어판이다. 2020 휴고상 편집자 부문을 포함해 휴고상에서만 15회 이상 호명된 세계적인 편집자 “조너선 스트라한”이 수록작을 선정하며, 한 해 동안 발표된 중·단편소설 가운데 세계적으로 인정받은 작가와 최근 떠오르는 신예 작가의 작품을 골고루 편성한다. 흥미롭게도, 이 책에 수록된 27편의 작품 중에서 2020년 휴고상, 네뷸러상, 로커스상 수상작이 전부 나왔으며 최종 후보작 또한 다수 포진해 있다. 특히 로커스상 단편 부문의 경우, 최종 후보작에 오른 10편 중 최종 수상작을 포함한 6편이 이 책에 수록돼 있을 정도다. 세계적 SF 작가의 최신작과 아울러 세계적 SF 문학상의 수상작을 바로 만나볼 수 있는 이 선집에, 허블은 “SFnal(=Science Fictional, SF적인)”이라는 제호를 붙였다. 

‘SFnal(SF적인)’은 SF(과학소설)’와 ‘-nal(-적인)’의 합성어로, 일찍이 세계 SF 팬덤과 평단에서는 “Science Fictional” 대신 종종 사용해온 표현이었다. 우리도 2019년에 들어 ‘SF적인’이라는 표현을 즐겨 사용하고 있다. SF적인 서사, SF적인 상상력, SF적인 세계관… 이토록 많이 쓰는 표현인데, 도대체 ‘SF적인’ 것이 뭘까? 우리는 이토록 SF적인 세계를 어떻게 살아야 할까? 그 물음에 대한 대답을, 세계적인 SF 작가들의 생각을 이 책을 통해 읽을 수 있다. 
",1,국내도서-소설/시/희곡
299,9791190885218,91459196,시어도어 스터전,"17,100원",950원,시어도어 스터전 저/박중서 역,현대문학,"광활한 우주의 끝, 고독과 슬픔의 별에서도 
인류의 잠재력과 선한 의지를 믿었던
위대한 낙관주의자, 시어도어 스터전

세계문학을 바라보는 새로운 관점을 제시해 온 현대문학 [세계문학 단편선]의 서른여덟 번째 권은 SF 황금기를 대표하는 미국 작가 시어도어 스터전의 단편 선집이다. 시어도어 스터전은 ‘SF 작가들의 작가’이자 문학사에 큰 발자국을 남긴 거장이다. 최고의 SF 중단편에 수여하는 ‘시어도어 스터전 기념상’으로 국내 독자들에게 친숙한 작가이다. 현대문학에서는 그동안 장편 『인간을 넘어서』와 몇몇 앤솔러지에서만 만날 수 있던 그의 작품을 국내 초역으로 선보인다. 이 책 『시어도어 스터전』은 총 211편에 달하는 스터전의 중단편 중에서 「황금 나선」, 「바다를 잃어버린 사람」을 비롯하여 휴고상과 네뷸러상을 동시 수상한 「느린 조각」 등 작가의 대표작 13편을 담았다.",2,국내도서-소설/시/희곡
300,9791196347024,70749581,냉면,"11,700원",650원,"곽재식,김유리,범유진,전건우,dcdc 공저",안전가옥,"다섯 가지 맛 서로 다른 냉면 이야기.
2018 가을 안전가옥 스토리 공모전 수상 작품집 - 『냉면』
로맨스, SF, 호러, 블랙코미디, 성장물-
문제적 음식 ‘냉면’에 대한 다섯 가지 이야기를 한 권에 담다.

믿지 않는 이들에게는 고깃집에서 먹는 입가심 한 그릇이지만, 
믿는 이들은 역사, 먹는 방법, 그야말로 일거수일투족에 열광하는 한 그릇.

유난히 심한 폭염이 찾아왔던 2018년 8월, ‘모든 이야기들의 안식처’ 안전가옥에서 냉면을 다루는 이야기를 공모했다. 냉면이 등장하는 이야기, 냉면을 둘러싼 사람들의 이야기 등 다양한 이야기가 모였고, 공모전에서 선정된 세 편의 수상작과 두 편의 초대작을 모아 『냉면』 앤솔로지가 탄생했다. 

인기 드라마 [옥탑방 고양이]의 원작자 김유리, 창비어린이문학상으로 등단한 범유진, 장르 하이브리드를 선도하는 dcdc, 호러 미스터리 장르의 대가 전건우, 한계가 없는 이야기를 풀어내는 곽재식.",2,국내도서-소설/시/희곡
301,9788959525713,44024174,스타크래프트 진화,"14,220원",790원,티모시 잔 저/유미지 역,제우미디어,"스타크래프트2 공허의 유산 이후 테란, 저그, 프로토스의 행보를 결정하는 소설

십여 년에 걸친 잔혹한 전쟁이 마침내 끝났다. 불가사의한 프로토스, 야성적인 저그, 인류의 후손인 테란. 이 강대한 세 진영이 휴전에 합의하자, 위태로운 평화의 나날이 이어진다. 하지만 프로토스의 손에 황폐해진 행성이 갑작스럽게 되살아나며, 잦아들었던 갈등의 불씨가 다시 피어오른다. 세 진영의 관계가 다시 악화되고, 각 종족은 저마다의 이유로 분노하기 시작한다. 테란-프로토스의 병사와 연구원으로 구성된 조사단이 이 신비한 저그 행성과 그곳 거주민의 진짜 의도를 확인하기 위해 원정을 떠나지만, 풍요로운 풍경 속에는 어둠의 장막에 가려진 다른 괴물들이 도사리고 있었다. 이들이 풀려나는 순간, 온 우주의 운명은 뒤바뀔 것이다.",2,국내도서-소설/시/희곡
302,9788959522576,7014412,바이오쇼크: 랩처,"13,320원",740원,존 셜리 저/종수 역,제우미디어,"수중도시 『랩처』 탄생에 얽힌 거대한 비밀이 밝혀진다.

1950년대 자본주의와 공산주의가 첨예하게 대립하는 냉전시대. 핵 전쟁의 위협이 도사리는 지상 세계를 떠나 랩처라는 이름의 거대한 수중도시가 건설된다. 전 세계에서 모인 다양한 사람들은 저마다의 이상을 꿈꾸며 랩처로 모이지만, 인간의 탐욕에 의해 그곳에도 조금씩 어두운 그림자가 드리워져 가는데……

'브람 스토커'상을 수상한 인기 소설가이자 영화 각본가 존 셜리가 펼치는 흥미로운 스토리.",1,국내도서-소설/시/희곡
303,9788982739026,1511232,유배 행성,"10,800원",600원,어슐러 K. 르 귄 저/이수현 역,황금가지,"이 책은 ""SF 작가가 노벨 문학상을 받는다면 1순위는 르귄이다"" 라는 말이 있을 정도로 유명한 SF계의 어머니 르귄의 대표작 의 첫 번째 책이다. 헤인 우주 시리즈는 전미 SF 판타지 작가 협회가 선정한 '그랜드마스터'이자 전미 도서상, 휴고 상, 네뷸러 상 수상 작가인 르귄의 대표적 연작 소설을 말한다. 서로 다른 문화를 지닌 수많은 세계들이 공존하는 가상의 '헤인 우주'를 배경으로 사십 년에 걸쳐 집필된 이 시리즈는 오늘날 우리 세계를 비추는 문명 비판적 통찰을 담고 있다.

『유배행성』은 완전히 다른 문화...",1,국내도서-소설/시/희곡
304,9791161693439,146319889,화성의 폐허,"13,500원",750원,"정명섭,설재인,장아미,김이환 저",서랍의날씨,"당신의 미래를 사로잡을
SF 이야기는 무엇인가?

과학의 미래만큼이나
미국에 빠진 이야기들이
지금 시작된다!

우주선을 타고 긴 여행 끝에 화성에 도착한 네 명의 우주인. 화성의 땅을 뚫어서 지각 밑의 구조를 알아보려고 장비를 설치한다. 땅을 파서 내려가는 동안 가끔 이상한 소리나 이상한 그림자가 우주선을 맴돈다. 그리고 갑자기 장비가 망가지고, 그 밑에는 거대한 미로가 있다. 화성에 존재했던 지성체가 만든 미로인지 우주인들이 고민하는 동안, 동료가 무언가에게 납치되어 미로로 끌려가자, 우주인들은 동료를 찾아 미로로 들어간다. 그리고 기이한 사건이 연이어 일어난다.",2,국내도서-소설/시/희곡
305,9791170523673,126527418,야생 조립체에 바치는 찬가,"13,500원",750원,베키 체임버스 저/이나경 역,황금가지,"21세기의 유토피아는 어떤 모습이어야 하는가에 대한 SF 소설의 아름다운 응답
세계 SF계의 가장 큰 화두가 된 ‘솔라 펑크’ 장르의 최고 유명 대표작!

평단과 독자들의 전폭적인 지지를 받으며 양대 SF 소설상인 휴고 상, 로커스 상을 수상한 베키 체임버스의 연작 소설 「수도승과 로봇」 시리즈가 황금가지에서 출간되었다. 서로 간의 사회가 단절된 이후, 호기심이 많은 로봇 ‘모스캡’과 자연에 대한 욕망을 품은 논바이너리(스스로의 성이 여성 혹은 남성으로 규정되는 것을 거부하는 성정체성을 지닌 사람) 수도승 ‘덱스’가 우연히 만나 각자의 세계를 탐험하는 과정을 통해 지속 가능한 개발과 생물과 비생물의 공존이 가능해진 유토피아적 미래를 담은 소설이다. 『워싱턴 포스트』는 ‘놀랍도록 간단한 이야기지만 (……) 주변의 사람 및 사물의 관계를 탐구하며 더 친절한 사회란 정확히 어떤 모습인지를 (독자로 하여금) 탐구하게 한다’라는 평과 함께 이 시리즈를 당해 최고의 SF 소설로 선정했다.",2,국내도서-소설/시/희곡
306,9791168127470,125084986,논터널링,"11,700원",650원,최의택 저,위즈덤하우스,"“저 친구는 이름이 뭐죠?”
벽을 넘는 자와 벽에 갇힌 자의 세상을 바꿔낼 우정

2021년 제1회 문윤성 SF 문학상 대상과 2022년 제9회 한국 SF어워드 대상을 수상한 최의택 작가의 신작 《논터널링》이 위즈덤하우스 단편소설 시리즈 위픽으로 출간되었다. 《논터널링》은 투명 인간 세상에서 살다가 하루아침에 눈에 띄게 되어버린 존재가 익숙한 세계를 낯설게 탐험하며 펼치는 이야기다.

‘초기원’이라 불리는 어느 시점, 모종의 사고로 인류는 멸종되고 행성엔 새로운 인류가 나타나 살아가기 시작했다. 신인류는 의지에 따라 자유롭게 공간을 이동하는 투명 인간들이지만 멸종과 함께 많은 학문 연구의 맥이 끊어진 탓에 아직 행성 밖 우주로 나가는 데 성공하지 못했다. 이론 고고학자인 ‘이더’와 ‘도이’는 고대 인류의 과학적 성과를 복원하고자 연구에 매진한다. 그러던 어느 날, 둘은 고대 인류의 양자역학 실험을 재현하는 과정에서 사고에 휘말리고 마는데…….",1,국내도서-소설/시/희곡
307,9791191824223,119773230,"큔, 아름다운 곡선","12,420원",690원,김규림 저 ,자이언트북스,"반짝이는 첫 소설, 응원하고 싶은 한 걸음 [자이언트 스텝]이 시작된다. 신인 작가의 첫 책을 소개하는 이 시리즈를 통해, 한 작가의 탄생을 지켜보고 흥미진진한 여정의 첫 순간을 함께하는 기쁨을 경험하길 바란다.

시리즈의 문을 여는 작품은 인간의 마음을 탐구하는 SF 소설가 김규림의 장편소설 『큔, 아름다운 곡선』이다. 김규림은 근원적 외로움과 사회적 고독 속에 놓인 오늘날 우리의 모습을 바라보면서, 고립을 친숙히 여기면서도 연결을 갈망하는 모순적인 마음을 너른 시선으로 그려낸다.

인간의 절대적 이해자로 개발된 안드로이드 ‘큔’과 마음의 문을 닫아건 사용자 ‘제이’의 이야기를 통해, 작가는 사랑이 아니라고, 다 끝났다고 외치는 세상을 향해 이렇게 속삭이는 듯하다. 마음을 헤아릴 수 있다면, 둘은 연결될 수 있다고.",1,국내도서-소설/시/희곡
308,9791170610175,120810350,테라리움,"12,600원",700원,이아람 저,북다,"삶과 죽음의 시간이 뒤엉킨 폐쇄된 세계
홀로 남겨진 소년이 내딛는 용기의 여정

제10회 교보문고 스토리공모전 우수상 수상작

제10회 교보문고 스토리공모전 우수상 수상작인 이아람의 장편소설 『테라리움』이 ‘북다’에서 출간되었다. 인류가 멸망한 미래, 사라진 어머니를 찾아 나선 소년의 여정을 다룬 작품은 포스트 아포칼립스 장르 특유의 환상적이고 강렬한 모험 서사를 기반으로 세계의 멸망을 둘러싼 비밀을 파헤친다.

『테라리움』은 대범한 SF적 상상력으로 주술적 세계관을 구축한 세련된 우화이자 촘촘히 배치된 매력적인 단서들로 가득한 미스터리 소설이다. 오직 어머니를 찾는 것만이 목적이던 소년은 초월적인 존재들과의 만남을 통해 새로운 진실들을 알게 되며, 그 영향으로 여행의 목적을 점차 변화시키게 된다. ‘지구’라는 거대한 폐쇄 ‘테라리움’ 안에서, 삶과 죽음, 불멸과 필멸 사이 선택에 놓인 소년은 자신이 바라는 온전한 목적지에 도달할 수 있을까.",1,국내도서-소설/시/희곡
309,9791170610106,119809095,푸른 살,"13,500원",750원,이태제 저,북다,"푸른 살의 창궐로 인해 범죄가 사라진 지구
인류는 정말 도덕적으로 진화했다고 할 수 있을까

제10회 교보문고 스토리공모전 대상 수상작

새로운 출판 브랜드 ‘북다’의 첫 번째 책이자, 제10회 교보문고 스토리공모전 대상 수상작인 이태제의 『푸른 살』이 출간되었다. 근미래, 지구에 불시착한 운석에 묻어온 외계생명체의 포자가 뇌에 기생하며 폭력성이 나타날 때마다 푸른 살이 증식한다는 독특한 설정은 SF적 상상력의 외연을 무한히 확장한다. 또한 인간의 폭력성마저 통제하려는 국가 시스템의 폐해를 드러내는 동시에, 작품에 펼쳐져 있는 다층적 이야기 레이어를 통해 인간의 본성에 대한 진지한 성찰을 요구하고 있다. 푸른 살로 인해 인간의 본성마저 통제된 사회에서, 인류는 과연 도덕적 진화를 이루어낼 수 있을까.",2,국내도서-소설/시/희곡
310,9791169256230,118595491,더스트 2,"15,120원",840원,휴 하위 저/이수현 역,시공사,"가장 새로운 디스토피아 고전의 탄생,
전 세계를 열광시킨 ‘사일로 연대기’ 전권 출간

서점 직원으로 일하며 틈틈이 소설을 써오던 휴 하위는 어느 날 점심시간을 이용해 서점 창고에서 짧은 단편을 하나 완성했다. 제목은 단순하게 〈울〉이라고 붙이고, 아마존 킨들 서비스를 이용해 1달러도 채 안 되는 가격으로 자비 출간을 시작했다(전자책 리더기뿐 아니라 킨들이라는 이름으로 서비스되는 전자책 일체를 가리키는 킨들 서비스에는, 출판사를 거치지 않고 작가가 직접 전자책을 출간할 수 있는 서비스도 포함되어 있다). 그때만 해도 이 짧은 소품이 미국 출판 생태계를 뒤집어놓을 하나의 ‘현상’이 되리라고는 누구도 예상하지 못했다. 

몇 개월 후 이 단편은 입소문만으로 아마존 킨들 1위에 오르는 기현상을 낳았고, 뒷이야기를 써달라는 독자들의 요구에 힘입어 후속작을 쓰기 시작해, 2012년 총 5부로 구성된 장편 『울』을 완성했다.",1,국내도서-소설/시/희곡
311,9791169256223,118595490,더스트 1,"15,120원",840원,휴 하위 저/이수현 역,시공사,"가장 새로운 디스토피아 고전의 탄생,
전 세계를 열광시킨 ‘사일로 연대기’ 전권 출간

서점 직원으로 일하며 틈틈이 소설을 써오던 휴 하위는 어느 날 점심시간을 이용해 서점 창고에서 짧은 단편을 하나 완성했다. 제목은 단순하게 〈울〉이라고 붙이고, 아마존 킨들 서비스를 이용해 1달러도 채 안 되는 가격으로 자비 출간을 시작했다(전자책 리더기뿐 아니라 킨들이라는 이름으로 서비스되는 전자책 일체를 가리키는 킨들 서비스에는, 출판사를 거치지 않고 작가가 직접 전자책을 출간할 수 있는 서비스도 포함되어 있다). 그때만 해도 이 짧은 소품이 미국 출판 생태계를 뒤집어놓을 하나의 ‘현상’이 되리라고는 누구도 예상하지 못했다. 

몇 개월 후 이 단편은 입소문만으로 아마존 킨들 1위에 오르는 기현상을 낳았고, 뒷이야기를 써달라는 독자들의 요구에 힘입어 후속작을 쓰기 시작해, 2012년 총 5부로 구성된 장편 『울』을 완성했다.",1,국내도서-소설/시/희곡
312,9791188140299,61384859,세븐이브스 2,"14,400원",800원,"닐 스티븐슨 저/성귀수,송경아 공역",북레시피,"“지금 세계는 먼지와 자갈의 프랙털 구조 속에서 
종말을 향해 가고 있다”

어느 날 갑자기 달이 일곱 조각으로 분해되고 지구상의 각 국가는 소수 정예 젊은이들을 선발, ‘클라우드아크’라고 하는 소행성을 우주로 발사하는 동시에 인류 보존을 위한 장대한 계획을 세웠다. 이제 달 붕괴 후 2년, 과연 인류의 삶은 지속되고 있을 것인가?

『세븐이브스』는 다양한 분야에 걸친 학문과 교양을 씨줄과 날줄로 엮어 SF서사로 빚어내는 스티븐슨의 장기가 유감없이 발휘된 또 하나의 역작이다. 출간된 뒤 곧장 최고의 권위를 지닌 SF문학상인 ‘휴고 상’ 후보에 올랐으며, 뛰어난 자유주의 SF문학에 수여하는 ‘프로메테우스 상’을 받기도 했다. 

어느 날 아무런 징후도 이유도 없이 달이 폭발하고, 지구는 2년 뒤 거대한 운석들이 수천 년 동안 폭풍처럼 쏟아져 내리는 하드레인Hard Rain을 마주하게 된다.",1,국내도서-소설/시/희곡
313,9788959522798,18497438,스타크래프트 암흑기사단 : 황혼,"13,320원",740원,크리스티 골든 저/심연희 역,제우미디어,"이제 단 한번의 선택으로
우주의 운명이 결정된다.

우연찮게 프로토스의 영혼을 몸속에 담게 된 고고학자 제이크. 프로토스의 영혼은 자신이 가진 지혜를 전하고자 제이크를 프로토스의 고향으로 향하게 한다. 한편, 프로토스의 영혼이 몸속에 머물수록 자신이 죽어간다는 사실을 알게 된 제이크는 서둘러 프로토스의 영혼을 분리하려 한다. 하지만 시간이 얼마 남지 않은 상황에서 테란과 저그가 그를 찾아 모여들기 시작하고, 잠들어 있던 절대악마저 깨어나 그를 쫓는다.",2,국내도서-소설/시/희곡
314,9791166688058,124303387,비에,"12,600원",700원,육선민 저,아작,"“내가 보여? 나는 하나야.”
문윤성SF문학상 수상작가 육선민 첫 단행본
낡은 안드로이드와 그를 깨운 하나의 하나뿐인 삶을 찾는 이야기 

‘호명됨’에 대한 작가들의 사랑에는 오랜 역사가 있습니다만, 여기 아주 익숙하지만 어여쁜 로봇의 사랑 이야기가 있습니다. 로봇 ‘비에’의 사랑은 자신의 이름을 불러준 이를 위해 기계 심장을 훔치는 일이었지만, 작품을 읽는 독자들은 따끔거리는 스스로의 심장을 부여잡게 됩니다.

근래 SF 공모전 응모작에서 나타나는 주제 의식과 경향이 있을텐데요, 비슷한 줄거리를 되풀이해서 읽는 건 심사위원들에게는 반갑지만은 않은 일일 겁니다. 로봇이 아니라면 쉬운 일은 아닐 테니까요.

하지만 그럼에도 불구하고, “이 소설은 정말이지 너무 잘 쓴 작품이라 뽑지 않을 수가 없다.” 정도가 되어야 그 작품은 수상작 명단에 이름을 올릴 수 있겠습니다. 제2회 문윤성SF문학상에서 중단편 부문 가작에 이름을 올린 〈사어들의 세계〉도 그런 작품 중 하나입니다.",2,국내도서-소설/시/희곡
315,9791190090896,117448500,빛과 영원의 시계방,"13,500원",750원,김희선 저,허블,"젊은작가상·이상문학상·SF어워드 수상 작가 김희선의 세 번째 소설집
극단으로 치달아 마법의 영역에 도달한 과학을 압도적인 SF로 완성하다!

우리는 어째서 호러에 매혹되는가? 영국의 문화비평가이자 작가인 마크 피셔는 “기이함의 매력은 통상적 인식이나, 경험 외부에 존재하는 것에 대한 매혹과 관계 있으며, 이러한 매혹은 불안이나 두려움까지 아우른다”고 말한다. 있어야 할 곳에 없는 것, 혹은 없어야 할 곳에 있는 것에 인간은 공포와 매혹을 동시에 느낀다는 것이다. 예컨대, 아버지가 자녀보다 젊은 모습으로 더 오래 산다면? 시간의 터널을 통과해 현재의 내 나이보다 젊은 모습의 부모를 조우했을 때, 우리는 무슨 말을 건넬 수 있을까? 

순수 문학과 SF의 장르를 초월, 오직 천재성만으로 두 독자 군의 인정을 모두 얻은 작가 김희선.",2,국내도서-소설/시/희곡
316,9791158888916,104072379,나와 밍들의 세계,"12,420원",690원,"양진,김유정,박하루,남세오,연여름,천선란,김성일,배지훈 공저",황금가지,"우주와 양자역학, 인공지능과 로봇 등을 소재로 미래의 과학 기술 발전이 야기할 놀라운 이야기를 SF로 담아낸 창작 단편 앤솔러지 『나와 밍들의 세계』가 출간되었다. 지난 4년 동안 온라인 소설 플랫폼 브릿G에 등록된 SF 단편소설 1700여 편 중 편집부의 엄선을 통해 수록된 이번 단편 앤솔러지는 한국과학문학상, 과학기술창작문예상, 황금드래곤문학상 등 다양한 문학상 수상 경력의 저자들을 비롯하여 최근까지 SF 장르의 신작을 꾸준히 발표하며 주목받고 있는 작가 8인의 기상천외한 상상력을 담아낸다.",2,국내도서-소설/시/희곡
317,9791190090476,103600025,SF 연대기,"15,300원",850원,"셰릴 빈트,마크 볼드 공저/송경아 역 ",허블,"“SF란 무엇인가?”에서 시작한 장르 탄생부터 현재까지의 역사
각 시대의 대표 작품으로 구현한 SF 랜드마크 지도

SF는 인류 역사의 중요한 변곡점마다 지대한 영향을 미쳐왔다. 미?소 냉전이 한창이던 1983년, 미국 레이건 대통령은 SF 작품에서 영감을 받은 역사상 최대의 무기 연구 계획을 발표하는데, 레이저 또는 양성자 빔으로 대기권 밖 소련의 미사일을 요격하겠다는 그 계획의 이름은 다름 아닌 “스타워즈”였다. 이 터무니없이 SF적인 계획엔 실제로 SF 작가들이 직?간접적으로 대거 참여했고, 결과적으로 ‘상호확증파괴’ 상태를 깨면서 냉전 종식의 도화선이 됐다. 이처럼 SF의 상상력이 세상을 뒤흔든 사례는 최근에도 있었다. 미국 트럼프 대통령이 취임한 2017년, 텍사스주 의회 앞에서 열린 낙태 규제 법안 반대 시위에 하얀 보닛을 쓰고 붉은 망토 두른 여성들이 눈길을 끌었다.",2,국내도서-소설/시/희곡
318,9791191193091,101684193,뉴 러브,"14,400원",800원,"표국청,황모과,안영선,하승민,박태훈 공저",안전가옥,"안전가옥 앤솔로지 시리즈의 일곱 번째 주제는 ‘뉴 러브’이다. 영화 투자배급사 메가박스중앙(주)플러스엠과 함께한 두 번째 공모전의 응모작 300여 편 가운데 열띤 심사를 거쳐 최종 선정된 다섯 편을 수록했다. ‘이미 셀 수 없이 많은 사랑 이야기에 어떤 새로움을 더할 수 있을까?’라는 물음에 가장 매력적인 대답을 건네준 작품들이다. 

자기 의지를 갖게 된 게임 캐릭터들이 새로운 세계를 펼쳐 내는 「장군님의 총애」, 벨루가 무리에 몰래 섞여 생활하는 로봇 벨루가의 사랑스러운 성장담 「나의 새로운 바다로」, 죽은 남편을 되살릴 기회 앞에 선 아내의 내적 갈등을 담은 「롤백」, 타인의 표정을 훔치며 살아온 이의 서늘한 애정을 그린 「사람의 얼굴」, 물리학도와 한류스타 배우 간의 기묘한 소개팅 스캔들 「가능성 제로의 연애」 등 모든 수록작은 현실을 넘어선 세계의 풍경과 그 세계에서 펼쳐질 수 있는 사랑의 색다른 모습을 보여 준다.",2,국내도서-소설/시/희곡
319,9788950984526,84227419,오늘의 SF #1,"13,500원",750원,"김창규,김초엽,듀나,박해울 등저",arte(아르테),"고호관, 듀나, 정세랑, 정소연 작가가 참여한 [오늘의 SF]
SF 장르가 주는 즐거움을 보다 널리 알리려는 야심 찬 시도!

미국 [아날로그사이언스픽션앤드팩트Analog Science Fiction and Fact], 중국 [커환스제(科幻世界)], 일본 [SF 매거진sfマガジン]. 한국에는 이제 [오늘의 SF]가 있다. 이곳의 목소리, 이곳의 상상력을 담은 SF 잡지가 [오늘의 SF]라는 이름으로 탄생한다. [오늘의 SF]는 고호관, 듀나, 정세랑, 정소연 작가가 편집위원으로 참여한 한국 SF 무크지로, ‘현재성’, ‘다양성’, ‘감수성’을 핵심 키워드로 삼아 사회과학, 자연과학, 예술, 비평, 창작 등 여러 분야의 필진, 인터뷰이와 함께 보다 다양하고 흥미로운 텍스트로 독자들을 만난다.",2,국내도서-소설/시/희곡
