순위,ISBN,상품번호,상품명,판매가,YES포인트,저자,출판사,설명,출고예상일,관리분류
184,9791170525295,141191615,데드 스페이스,"15,300원",850원,칼리 월리스 저/유혜인 역,황금가지,"인공지능이 관리하는 우주 기지에서 발생한 의문의 죽음
진실을 좇는 사이보그 탐정의 활약이 펼쳐지는 SF 스릴러

**제40회 필립 K. 딕 상 수상작**

탐정으로 변신한 인공지능 전문가의 활약이 펼쳐지는 SF 스릴러 『데드 스페이스』가 황금가지에서 출간되었다. 『데드 스페이스』의 무대는 거대 자본이 막강한 영향력을 행사하는 우주의 외딴 소행성이다. 테러 사고로 신체 대부분을 기계로 대체하는 수술을 받고 살아났지만 막대한 빚을 갚기 위해 보안분석가가 된 주인공은 인공지능이 관리하는 폐쇄적인 기지에서 벌어진 살인 사건을 수사하던 중 뜻밖에도 자신이 겪은 사고 이전의 삶과 얽혀 있는 거대한 음모의 진상에 다가간다.",1,국내도서-소설/시/희곡
185,9788954688963,114998524,타이탄의 세이렌,"14,850원",820원,커트 보니것 저/강동혁 역,문학동네,"“이것은 클래식이다. 위트와 유창함과 
폭포처럼 쏟아지는 기발함으로 무르익었다.”
_브라이언 앨디스(SF 작가)

그게, 산다는 게 다 무슨 의미인가 싶은 날이 있다. 너와 나는 무엇을 위해 매일 고군분투하며, 우리 사회는 무엇을 향해 나아가는가. 보니것은 그런 우리 삶의 우주적 무의미함에 대해 노래하고 조롱한다. 반세기를 훌쩍 뛰어넘는 시간이 흐른 뒤에도 작품 속 이야기는 빛바래지 않았다. 보니것의 글은 오늘날의 현실을 그대로 반영하는 거울임과 동시에 과거에서 온 미래의 예언 같기도 하다. “우주는 지독히도 커다란 장소”여서 “이런저런 문제들에 관해 서로 다른 옳은 의견을 가진 사람들이 지독히도 많을 수 있을 만큼 넓은 공간”이라는 그의 문장은 한 영혼의 삶이 모질어지고 모나질 때마다 그를 수렁에서 끌어올리고 부드럽게 등을 토닥여줄 것이다. 생의 괴로움을 처음부터 끝까지 다 알더라도, 한쪽 입꼬리를 올리고 피식 웃어버리며 하루를 더 살아나갈 수 있는 힘을 줄 것이다.",2,국내도서-소설/시/희곡
186,9791161758152,124856380,레디 플레이어 투,"17,550원",970원,어니스트 클라인 저/전정순 역,에이콘출판사,"뉴욕 타임스 베스트셀러 1위에 빛나는 『레디 플레이어 원』 저자 어니스트 클라인의 두 번째 작품
전 세계적으로 사랑받은 베스트셀러 『레디 플레이어 원』의 스릴 넘치는 속편
워싱턴 포스트가 선정한 2020년 최고의 책 중 하나

완벽한 가상현실 오아시스의 창시자가 숨겨둔 두 번째 이스터 에그를 찾아야 한다.
제한시간은 24시간, 인질은 5억 명. 모든 것을 구하기 위한 최후의 퀘스트를 완료하라!

오아시스의 창시자 제임스 할리데이가 개최한 대회에서 우승을 거머쥐고 9일째 되는 날 웨이드 와츠는 모든 것을 바꿀 발견을 한다. 할리데이의 금고에 숨겨진 채로 상속자가 찾아오기만을 기다린 것은 또 한 번 세상을 뒤흔들고 오아시스를 웨이드가 꿈꾸던 것보다 천 배는 더 경이로운 곳으로―그리고 중독성 있는 곳으로―만들 놀라운 기술이다. 이 기술과 함께 새로운 수수께끼와 새로운 퀘스트, 즉 신비에 싸인 보상을 암시하는 할리데이의 마지막 이스터에그가 등장한다.",1,국내도서-소설/시/희곡
187,9788960177581,11163655,제2 파운데이션,"14,400원",800원,아이작 아시모프 저/김옥수 역,황금가지,"미래학자이자 세계 3대 SF 작가로 꼽히는 아이작 아시모프의 대표작. 『로마제국 쇠망사』에서 영감을 얻어 50년간 집필한 작품으로 500년간 은하 제국들의 흥망성쇠를 다룬 대하 소설이다. 각기의 에피소드마다 놀라운 반전과 시선을 뗄 수 없게 만드는 스릴러적 재미, 그리고 추리적 요소가 가득하여 독자들이 책에서 눈을 뗄 수 없게 만든다.",2,국내도서-소설/시/희곡
188,9788993094428,7984519,유빅,"16,200원",900원,필립 K. 딕 저/김상훈 역,폴라북스,"필립 K. 딕이 그려낸 선구자적인 미래! 

20세기 SF문학사를 대표하는 작가 필립 K. 딕의 소설 『유빅』. 암울한 미래상과 인간이 겪는 정체성의 혼란을 그리며 인간성의 본질을 성찰해온 필립 K. 딕의 걸작 장편들을 모은 선집 「필립 K. 딕 걸작선」의 열한 번째 책이다. 1969년에 출간된 이 작품은 엔트로피와 생명의 대립이라는 주제를 장르 SF의 형태로 형상화하고 있다. 

냉동보존된 죽은 사람들의 의식을 주기적으로 되살려 대화하는 것이 가능해지고, 각종 초능력자들이 대두해 인류 사회가 근본적으로 변화한 미래. 반(反) 초능력자 파견회사의 대표인 글렌 런시터는 이름을 숨긴 거부로부터 의뢰를 받아, 반 초능력자 11명과 초능력 측정 기사를 데리고 달로 간다. 그곳에서 적의 함정에 빠져 치명상을 입고 가까스로 지구로 귀환하지만, 시간과 물질이 퇴화하는 듯한 기괴한 현상에 휘말린다. 그것을 막을 유일한 해결책이 ‘유빅’이라는 사실을 알게 된 그들은 탐색에 나서는데….",2,국내도서-소설/시/희곡
189,9791187206590,43946336,제프티는 다섯 살,"13,320원",740원,"할란 엘리슨 저/신해경,이수현 공역",아작,"“신이시여, 할란 엘리슨이네.”
중단편 만으로 휴고상, 에드거상, 네뷸러상 등 각종 문학상을 
60여 차례나 수상한 살아 있는 전설이자 미친 천재!

“여기, 진짜가 나타났다.” 중단편만으로 휴고상, 에드거상, 네뷸러상, 브람스토커상, 세계판타지문학상 등 각종 문학상을 60여 차례나 수상한 SF, 판타지 소설계의 대부이자 살아 있는 전설, 미친 천재 할란 엘리슨의 국내 첫 작품집. 

1,700여 편에 이르는 전방위적인 작품과 더불어, “작가는 모든 것을 알아야 한다”며 청소년 범죄에 관해 쓰기 위해 가짜 신분으로 브루클린 갱단에 들어갔고, 롤링 스톤즈 등과 함께 여행한 뒤 로큰롤을 묘사하기도 했으며, 흑인 참정권 운동을 위해 마틴 루터 킹 목사가 주도한 셀마-몽고메리 행진에 동참하기도 한 행동하는 자유주의자.",1,국내도서-소설/시/희곡
190,9788932924038,124807356,게임 체인저,"15,120원",840원,닐 셔스터먼 저/이민희 역,열린책들,"『수확자』의 닐 셔스터먼이 펼쳐 내는
또 한 번의 짜릿한 SF 걸작

『수확자』 시리즈, 『드라이』의 작가 닐 셔스터먼이 신작 장편소설 『게임 체인저』로 돌아왔다. 고등학교 미식축구 선수인 애시가 『우주의 중심』으로 지목되면서 겪는 좌충우돌을 유쾌하게 그려 낸 소설이다. 주인공 애시는 전형적인 미국 백인 남자애라 할 수 있는 잘나가는 고등학생으로, 머릿속엔 미식축구와 여자 생각뿐 골치 아픈 건 딱 질색이다. 그런 그의 세상이 백팔십도 바뀌는 사건이 일어난다. 

애시는 미식축구 경기에서 자신의 주특기인 들이받기를 하다가 뇌진탕을 심하게 당하고서 교통 신호등의 정지 신호가 파란불로 바뀐 걸 보게 된다. 그다음에 또 뇌진탕을 일으키자 이번엔 부모님이 부자가 되고, 다시 뇌진탕을 당하자 이젠 흑인이며 라티노 친구들이 몽땅 사라진다. 애시는 뇌진탕을 일으킬 때마다 세상이 변화한다는 걸 알고, 자신의 힘을 이용해 세상을 더 좋게 만들 수 있지 않을까 생각하게 된다.",2,국내도서-소설/시/희곡
191,9788972438199,123685755,멋진 신세계,"12,420원",690원,올더스 헉슬리 저/권세호 역,서문당,"『멋진 신세계』(Brave New World)는 올더스 헉슬리가 1932년에 출판한 가상세계에 대한 SF 소설이다. 소설의 세계에서는 과학의 발달로 인간이 시험관 아기로 태어나 시스템에 의해 수정되고, 각각의 계급에 맞게 길러져 병 속에서 제조되며 사회의 통제 속에서 생활한다. 이 소설은 유토피아에서 태어난 인간과 그렇지 않은(책 속에서는 야만인으로 지칭) 인간과의 사고의 대조를 현실감 넘치게 그려내어 읽는 이로 하여금 소름이 끼치게 만들고 있다.

가상 세계의 인간들은 생산되어질 때 계급이 정해지고 거기에 맞추어 신체적인 발육과 지적인 능력이 약품으로 조절되어 생산되어진다. 그리고 이후로는 반복적인 수면교육과 학습으로 인간은 기계화 되며 ‘소마’라는 약품으로 감정이 길들여진다. 남녀의 관계는 단지 성적인 쾌락의 대상이다. 소설은 결혼, 사랑, 애정의 개념이 모두 사라진 세계를 그리고 있으며, 인간은 인간에 의해 감정과 계급이 정해진다.",1,국내도서-소설/시/희곡
192,9791160949070,107683269,당신의 간을 배달하기 위하여,"13,500원",750원,"박애진,임태운,김이환,정명섭,김성희 공저",사계절,"옛날 옛날, 아주 먼 옛날 이야기 속 인물들을
미래에 데려다놓으면 생기는 일 

정명섭 작가의 ‘옛이야기를 SF로 재해석한다’는 한 줄 기획에서 시작된 ‘고전xSF 앤솔러지’가 『당신의 간을 배달하기 위하여』라는 제목으로 출간되었다. 박애진, 임태운, 김이환, 정명섭, 김성희 등 다양한 분야를 넘나들며 흥미로운 글을 쓰는 작가들이 이 기획에 참여했다. 이번 앤솔러지에는 심청전, 별주부전, 해님달님, 장화홍련전, 흥부와 놀부. 이렇게 다섯 편의 옛이야기를 SF라는 장르로 재해석한 다섯 편의 단편소설이 실려 있다.",1,국내도서-소설/시/희곡
193,9788937444722,107528950,이욘 티히의 우주 일지,"16,200원",900원,스타니스와프 렘 저/이지원 역,민음사,"현대 대중문화 전반에 영향을 끼친 선구자이자 SF 문학의 혁명가, 
스타니스와프 렘의 기상천외한 단편집 

폴란드가 낳은 SF 문학의 거장이자 소설가, 극작가, 미래학자, 문명학자, 과학 철학자, 문학 평론가 등 다양한 수식어로 불리는 전방위적 문인 스타니스와프 렘의 『이욘 티히의 우주 일지』가 공인된 폴란드어 판본, 원전 번역으로 출간되었다. IQ 180에 빛나는 명석한 두뇌에 새벽 4시면 어김없이 일어나서 규칙적으로 작품을 집필하는 성실성을 겸비했던 렘은 생전에 단행본만 육십여 권에 달하는 방대한 저작을 남겼다. 사이버네틱스와 유전 공학, 우주 발생론, 컴퓨터 게임, 미래학 등 SF적 상상력과 문학을 절묘하게 접목한 독보적 글쓰기의 영역을 개척했고, 실험적 추리물, 방송극 대본, 문학 평론과 서평, 문화 비평 칼럼, 과학 및 의학 논문, 정치 사회 논평, 철학 에세이 등 픽션과 논픽션을 넘나들며 다양한 장르의 글을 썼다.",1,국내도서-소설/시/희곡
194,9788937444715,107528937,우주 순양함 무적호,"14,400원",800원,"스타니스와프 렘 저/최정인,필리프 다네츠키 공역",민음사,"현대 대중문화 전반에 영향을 끼친 선구자이자 SF 문학의 혁명가, 
스타니스와프 렘의 실험적 대표작

폴란드가 낳은 SF 문학의 거장이자 소설가, 극작가, 미래학자, 문명학자, 과학 철학자, 문학 평론가 등 다양한 수식어로 불리는 전방위적 문인 스타니스와프 렘의 『우주 순양함 무적호』가 공인된 폴란드어 판본, 원전 번역으로 출간되었다. IQ 180에 빛나는 명석한 두뇌에 새벽 4시면 어김없이 일어나서 규칙적으로 작품을 집필하는 성실성을 겸비했던 렘은 생전에 단행본만 육십여 권에 달하는 방대한 저작을 남겼다. 사이버네틱스와 유전 공학, 우주 발생론, 컴퓨터 게임, 미래학 등 SF적 상상력과 문학을 절묘하게 접목한 독보적 글쓰기의 영역을 개척했고, 실험적 추리물, 방송극 대본, 문학 평론과 서평, 문화 비평 칼럼, 과학 및 의학 논문, 정치 사회 논평, 철학 에세이 등 픽션과 논픽션을 넘나들며 다양한 장르의 글을 썼다.",2,국내도서-소설/시/희곡
195,9791170401018,110336183,해저 2만리 2,"12,600원",700원,쥘 베른 저/김석희 역,열림원,"바다 속을 방랑하는 수수께끼의 항해자 네모 선장……
장대한 스케일로 SF의 테두리를 뛰어넘은 쥘 베른의 대표작!

잠수함 ‘노틸러스’ 호는 태평양에서 인도양과 홍해?지중해를 거쳐 대서양으로 향한다. 네모 선장의 안내로 해저 산책에 나선 아로낙스 박사는 바다 밑에 가라앉은 도시의 폐허를 목격한다. 그것은 전설의 대륙 아틀란티스였다. ‘노틸러스’ 호는 남극의 얼음 속에 갇히기도 하고 거대한 문어의 습격을 받기도 하면서 대서양을 북상한다. 그런데 그들 앞에는 절체절명의 위기가 기다리고 있었으니……. 신비로운 해저 세계에서 펼쳐지는 경이로운 대모험.",1,국내도서-소설/시/희곡
196,9788932043388,139705866,스위트 솔티,"15,300원",850원,황모과 저,문학과지성사,"“누군가와 연결되지 못하면
아무리 많은 말을 알아도 허전했다”

한국과학문학상, 2021·2024 SF 어워드
양성평등문화상 신진여성문화인상 수상 작가
한국 SF의 미래, 황모과 두번째 소설집

2019년 한국과학문학상 중단편 부문 대상을 수상하며 한국 SF의 새로운 가능성을 보여준 작가 황모과의 두번째 소설집 『스위트 솔티』가 문학과지성사에서 출간되었다. 수상 당시 “소설의 본질이라 할 수 있는 ‘감동’을 선사”(김보영 소설가)했다는 찬사와 함께 작품성과 주제의식 모두 인정받은 그는, 역사의 뒤안길로 사라져야만 했던 인물과 사건을 재조명하는 작업을 꾸준히 해오고 있다. 특히 자신이 속한 국가와 집단으로부터 외면받아온 이들의 목소리에 귀 기울이기 위해 SF적 장치를 적극적으로 활용한 작품들은 과거의 역사를 돌아보고 오늘날 현실에 비판적으로 접근한다.",2,국내도서-소설/시/희곡
197,9788932041513,118602494,SF 보다 Vol.1 얼음,"12,600원",700원,"곽재식,구병모,남유하,박문영,연여름,천선란 저",문학과지성사,"세계를 얼렸다― 상상력이 열렸다!

얼음 속에서 얼크러지는 여섯 가지 이야기
얼음 표면에 얼비치는 여섯 가지 가능성

〈SF 보다〉 시리즈 첫번째 책의 주제는 ‘얼음’이다. 음료에 들어 있는 아이스 큐브부터 비정형의 빙하까지, 현실 세계에서 자유로이 꼴을 달리하는 얼음은 문학의 세계에서도 다양한 모습으로 나타난다. 문학작품 속에서 얼음은 “낭만과 추억을 상징하기도 하지만, 동시에 낯섦과 공포, 미스터리와 언캐니를 의미하기도 한다”(문지혁). 이토록 무수한 이야깃거리를 품은 매력적인 테마가 『SF 보다―Vol 1. 얼음』에서 각양각색의 상상력을 지닌 여섯 작가와 만난다. 

물과 달리 얼음에 붙잡히면 흐르지 못한다. 얼음은 물질을, 생명을, 시간을 멈춘다. 영구동토의 만년빙에는 먼 과거의 대기 구성 정보가 보존되어 있다. 때로는 고대인의 시신이, 미지의 바이러스가, 외계의 괴물이 들어 있다.",2,국내도서-소설/시/희곡
198,9791193873045,135855124,헤르메스,"15,750원",870원,야마다 무네키 저/김진아 역,빈페이지,"히가시노 게이고의 뒤를 잇는,
《혐오스런 마츠코의 일생》 원작 소설 저자의
긴박감 넘치는 SF 장편 소설!

소행성 충돌과 지하 3천 미터 실험 도시 건설에서 발현된
인간의 모순된 마음을 파헤친다!

2029년 소행성 충돌로 인한 지구 멸망의 대 위기. 충돌은 간신히 피했지만, 종말의 공포를 떨쳐내지 못한 인류는 피난용 지하 실험 도시를 건설하여 피실험자를 모집한다. 지하 3천 미터 실험 도시 eCU3의 열악한 환경에서 생활해야 하는 실험 기간은 10년. 실험 참가자 900명은 실험 종료와 동시에 거액의 보수를 받는다.",2,국내도서-소설/시/희곡
199,9791160516654,133138557,싱크 데이트,"11,700원",650원,남지민 저,씨드북,"가상 현실, 인공 지능, 뇌 스캐닝… 몰아치는 신기술 사이
누군가는 맹목적이라 말하는 마음, ‘팬심’이 발휘하는 커다란 힘

소녀, 내일이 되다! 청소년을 위한 SF 시리즈, ‘내일의 숲’ 열네 번째 책 남지민의 『싱크 데이트 : 나를 사랑한 아이돌』이 출간되었다. 책 속 ‘싱크 데이트’는 스마트 기기를 사용해 아이돌과의 데이트를 생생히 시뮬레이션할 수 있는 서비스다. 가상 현실·인공 지능·뇌 스캐닝이라는 과학적 소재와 주인공 유리의 마음을 대변하는 여러 상징물, 그리고 예측 불가능한 사건들이 매끄럽게 얽히며 순수한 ‘팬심’이 일으키는 커다란 힘이 생동감 있게 그려진다.

보육 홈을 졸업한 지 얼마 안 된 유리는 심한 피부 발진 때문에 야간에만 직업 실습을 하고 있다. 그런 유리에게 하루 10분, 최애 아이돌 노아와의 싱크 데이트는 유일한 낙이다. 그런데 여느 날처럼 싱크 데이트에 접속한 유리는 노아가 묘하게 달라졌다고 느낀다.",2,국내도서-청소년
200,9791159255502,112896037,충청도 뱀파이어는 생각보다 빠르게 달린다,"10,080원",560원,송경혁 저,고블,"‘짧지만 강고한’ 중편/경장편 소설 시리즈, 고블 씬 북 일곱 번째 작품. 

『충청도 뱀파이어는 생각보다 빠르게 달린다』는 충청도 농가에서 벌어지는 좌충우돌 뱀파이어 소동과 그에 얽힌 음모를 다룬 코미디 SF 소설이다. 충청도 출신 스토리텔러 송경혁은 블랙코미디와 호러, SF와 한국형 갱스터 서사, 그리고 눈물 없이는 보지 못할 비극적 인간 드라마를 뒤섞어 ‘충정도 논두렁 SF 액션 드라마’를 창조해냈다.『여섯 번째 2월 29일』로 한국형 하드보일드를 독자에게 선보인 송경혁 작가가 이번에는 어두운 유머 뒤섞인 충청도 로컬 스토리텔링의 모범을 보여준다.",1,국내도서-소설/시/희곡
201,9791185585819,84640495,나는 슈뢰딩거의 고양이로소이다,"12,240원",680원,원종우 저,아토포스,"과학 팟캐스트 1위, [파토의 과학하고 앉아있네] 원종우의
빅뱅처럼 폭발하는 상상력이 SF소설로 쏟아진다!

누적 다운로드 1억을 돌파하며 과학 분야 팟캐스트 1위를 지키고 있는 [파토의 과학하고 앉아있네] 원종우 대표가 첫 소설집을 출간했다. SF 소설 『나는 슈뢰딩거의 고양이로소이다』가 바로 그 책이다. 그런데 대중에게 과학 커뮤니케이터로 널리 알려져 있고, TV 방송에도 자주 얼굴을 비추며, 과학책도 여러 권 집필한 그가 갑자기 SF 소설을 들고 독자들 앞에 나타난 이유는 무엇일까.

원종우 작가는 그 까닭에 대해 “나는 실제로 과학을 연구하는 연구자가 아니라 과학 자체에 관해서 이야기하는 데 한계가 있다”라고 고백한다. 그래서 때로는 전문가의 입을 빌릴 수밖에 없었는데, 소설이라는 형식으로 과학을 말하는 것은 그 한계를 넘어설 수 있는 굉장히 매력적인 방법이라고 힘주어 말한다.",2,국내도서-소설/시/희곡
202,9791191197433,147040188,A.I. 닥터 1~5 세트,"90,000원","5,000원",한산이가 저,상상,"넷플릭스 “중증외상센터” 원작 작가 한산이가(이낙준) 인기작
네이버 시리즈 6,400만 다운로드, 평점 9.89
‘네이버 웹툰’으로 웹툰화된 화제작
SF어워드 웹소설 부문 ‘대상’ 수상작

가난에 허덕이는 고아 출신 레지던트 이수혁. 부푼 꿈을 안고 내과에 진학했지만 불의의 사고에 휘말린다. 그 결과 한쪽 다리를 절게 되었지만, 불행만 있는 것은 아니다.

“이수혁을 세계 최고의 진단 및 치료 목적 의사로 만드는 것으로 목표를 수정합니다.”

태화그룹이 개발 중이던 최강의 인공지능 ‘A.I. 바루다’가 수혁의 머릿속에 박혔다. 세계 최고의 내과 의사가 되기 위해 수혁을 채찍질하는 바루다. 그리고 어려운 환경 속에서도 출세하고자 악착같이 노력하는 수혁의 환상(장) 콜라보.",1,국내도서-소설/시/희곡
203,9788932042039,124060966,그러나 누군가는 더 검은 밤을 원한다,"14,400원",800원,우다영 저,문학과지성사,"몽환과 영원의 세계로 독자를 데려가는 우다영의 세번째 소설집 『그러나 누군가는 더 검은 밤을 원한다』가 문학과지성사에서 출간되었다. 첫 수록작 「우리 사이에 칼이 있었네」로 시작해 표제작 「그러나 누군가는 더 검은 밤을 원한다」로 끝을 맺는 다섯 편의 작품은 그 관념을 서서히 확장하며 우다영이 직조한 세계의 타래를 조금씩 펼쳐놓는다. 2023 SF어워드 우수상 수상작 「긴 예지」, ‘이 계절의 소설’(2020년 가을) 선정작 「태초의 선함에 따르면」 등 미지의 세계를 예고한 바 있는 수작을 함께 엮었다. 

“당신과 내가 이토록 타자이며, 이토록 하나라는 사실”(‘작가의 말’)을 직시하며 씌어진 이번 소설집은 ‘나’와 ‘너’ 사이에서 탄생하는 환상적인 이야기를 선보인다. 두번째 소설집 『앨리스 앨리스 하고 부르면』(문학과지성사, 2020)을 유심히 읽은 독자라면 이번 소설집의 제목이 낯익을지도 모른다.",2,국내도서-소설/시/희곡
204,9788960177598,11163661,파운데이션의 끝,"16,200원",900원,아이작 아시모프 저/김옥수 역,황금가지,"미래학자이자 세계 3대 SF 작가로 꼽히는 아이작 아시모프의 대표작. 『로마제국 쇠망사』에서 영감을 얻어 50년간 집필한 작품으로 500년간 은하 제국들의 흥망성쇠를 다룬 대하 소설이다. 각기의 에피소드마다 놀라운 반전과 시선을 뗄 수 없게 만드는 스릴러적 재미, 그리고 추리적 요소가 가득하여 독자들이 책에서 눈을 뗄 수 없게 만든다.",1,국내도서-소설/시/희곡
205,9791193367094,141316748,스타터 빌런,"16,200원",900원,존 스칼지 저/정세윤 역,구픽,"★★★ 2024 드래곤 상, 알렉스 상 수상
★★★ 2024 휴고 상, 로커스 상 최종후보
★★★ 2023 아마존 편집자 선정 베스트 SF, 굿리즈 독자 선정 베스트 SF

‘노인의 전쟁’ 시리즈의 SF 대가 존 스칼지가 날카로운 유머와 통찰력,
귀여움까지 갖춘 혁명적인 이야기로 돌아왔다. 
자본주의와 소득 불평등, 노동조합과 슈퍼 빌런, 그리고 고양이!!

‘노인의 전쟁’ 시리즈, ‘상호의존성단’ 시리즈, 『레드 셔츠』 등의 작품을 발표한 인기 SF 소설가, 특유의 유머와 날카로운 통찰력으로 엄청난 팬덤을 보유한 존 스칼지의 2023년작 『스타터 빌런』은 길고양이를 키우며 대출금을 걱정하는 임시 교사 찰리가 얼굴도 기억나지 않는 삼촌의 ‘슈퍼 빌런’ 사업을 물려받으면서 펼쳐지는 기발한 이야기를 담고 있다. 엄청난 규모의 비밀 기지, 고도의 기술로 무장한 동물 파트너들에게 둘러싸인 채 슈퍼 빌런 사업에 대한 업무를 숙지해나가야 하는 찰리.",2,국내도서-소설/시/희곡
206,9791165508876,95711718,"우주복 있음, 출장 가능","13,320원",740원,로버트 A. 하인라인 저/최세진 역,아작,"'미스터 SF' 로버트 A. 하인라인이 쓴 최고의 우주 SF
전 세계 SF팬들의 필독서, 많은 이에게 인생의 첫 번째 SF였던 SF의 고전

“어느 날 내게 우주복이 생겼다!”
[마션]을 비롯한 수많은 SF의 원형과도 같은 작품,
SF계 최초의 명인이 쓴 아득한 우주의 꿈!

비누회사 경품대회서 우연히 받게 된 낡은 우주복을 입고 뒤뜰에서 놀던 소년, 무선통신에 다급하게 잡힌 소녀의 목소리와 갑자기 나타난 우주선 두 척! 정신을 차려보니 우주 해적에게 잡혀서 꿈에도 소원하던 달로 가게 되는데… 알고 보니 소녀는 노벨상을 받은 저명한 과학자의 딸, 소녀를 지키려다 지구의 운명까지 짊어지게 된 소년의 앞날은 과연 어떻게 될까? 

20세기 중반 SF의 황금기를 대표하고 이끌었던 ‘빅 쓰리(Big Three)’의 일원인 로버트 A. 하인라인의 대표작 중 하나로, 하인라인의 팬들에게 가장 사랑받는 작품이다.",1,국내도서-소설/시/희곡
