순위,ISBN,상품번호,상품명,판매가,YES포인트,저자,출판사,설명,출고예상일,관리분류
94,9788983710925,242019,콘택트 2,"9,900원",550원,칼 세이건 저/이상원 역,사이언스북스,어린 시절 아버지를 잃은 소녀 엘리는 밤마다 모르는 상대와의 교신을 기다리며 단파 방송에 귀를 기울인다. 천체물리학자가 된 엘리는 사막의 관측소에서 우주로부터 오는 단파 신호를 수신하던 어느 날 직녀성으로부터 정체모를 메시지를 받게 된다. 수신은 계속되고 급기야 그 메시지의 의미를 해독하여 전세계의 이목이 집중된다. 그리고 해독된 메시지의 내용은 은하계를 왕복할 수 있는 이동 수단의 설계도임이 밝혀진다. 이 이동 수단이 완성된다면 인류는 드디오 오랜 숙원인 「외계 생명체와의 만남」을 실현하게 되는데.....,2,국내도서-소설/시/희곡
95,9791158882440,35874336,스페이스 오디세이 완전판 세트,"51,300원","2,850원",아서 C. 클라크  저/송경아 역,황금가지,"아서 C. 클라크 탄생 100주년을 맞아, 그의 대표작인 '스페이스 오디세이 완전판'이 국내 첫 출간되었다. 스탠리 큐브릭 감독과 함께 작업한 「2001 스페이스 오디세이」의 장편소설로서, 그간 국내에선 『2001 스페이스 오디세이』, 『2010 스페이스 오디세이』, 『2061 스페이스 오디세이』만 출간되었고, 완결작인 『3001 최후의 오디세이』는 정식 출간된 적이 없다. '스페이스 오디세이'는 인류 진화에 대한 통찰과 우주를 향한 무한한 상상력을 담아내어 지난 반세기 동안 가장 빛나는 SF로 남은 시리즈로서, 저자인 아서 C. 클라크는 아이작 아시모프, 로버트 A. 하인라인과 함께 SF의 3대 작가로 꼽힐 뿐 아니라 '통신 위성'과 '인터넷', '우주 정거장', '핵발전 우주선' 등 현대 과학에 절대적인 영향을 끼친 미래학자로서도 잘 알려져 있다. 

""‘2001 스페이스 오디세이’의 두 판본(영화와 소설)은 상대에게 보조를 맞출 생각이 전혀 없는 것처럼 보인다. 두 판본은 오롯이 자신의 강점에만 집중한다. 그런데 서로 탁월한 조화를 이루는 것이다."" -이영도(소설가)",1,국내도서-소설/시/희곡
96,9791190090674,112012912,내가 행복한 이유,"16,650원",920원,그렉 이건 저/김상훈 역,허블,"“테드 창”의 숙명적 라이벌, “김초엽”의 가장 추천하는 작가 
‘SF 작가들의 작가’ 그렉 이건의 한국판 특별 선집의 첫 책

세기의 라이벌. 한 명의 천재가 탄생하기 위해선, 라이벌 관계인 또 다른 천재의 존재가 필수적이다. 그렇게 탄생한 두 천재 중에서, 우리는 아직 한 명의 천재 “테드 창”밖에 만나지 못했다. 그리하여 허블은 그 나머지 한 명의 천재 작가를 소개하고자 한다. 테드 창이 여러 인터뷰를 통해 애틋한 팬심을 밝혔던, 그리고 테드 창과 함께 한국 SF 열풍을 이끈 한국문학의 아이콘 “김초엽”이 추천하는 ‘SF 작가들의 작가’. 바로, “그렉 이건”이다.

국내에선 소개가 안 됐지만, 그렉 이건과 테드 창의 라이벌 관계는 세계적으로 유명하다. 둘은 일찍부터 SF 팬덤 사이에서 ‘하드 SF계의 양대산맥’이라 불렸을 뿐만 아니라, 실제 두 작가의 작품들은 소재와 세계관 측면에서 싱크로율이 높다.",1,국내도서-소설/시/희곡
97,9791168341630,124768983,지구 생물체는 항복하라,"15,120원",840원,정보라 저,래빗홀,"치열하게 저항하고 사랑하는 작가
정보라의 첫 자전적 SF소설

당신의 손을 맞잡고 망가진 세상과 맞서며
함께 꾸는 꿈을 현실로 만들어가는 진심의 사랑

“이토록 천연덕스럽게 섬뜩한 소설이 또 있을까.” (황인찬, 시인)
“때때로 현실이 소설보다 더 터무니없고 더 마술적이고 더 잔혹할 수 있잖아요.” (정보라 인터뷰에서)

2022년 부커상 국제 부문에 이어 2023년 국내 최초로 전미도서상 최종 후보에 오르며 세계의 관심을 한 몸에 받은 정보라가 해양 생물을 주제로 자전적인 이야기를 담아낸 SF연작소설을 선보인다. 작가 본인이 살고 있는 바다 도시 포항의 풍경과 더불어, 그의 가족과 이웃, 친구와 똑 닮은 인물들의 경쾌하고 유머러스한 이야기가 담긴다. 수록된 여섯 편의 이야기는 사람답게 살기 위해 치열한 투쟁과 투병을 이어온 기록이자, “좋을 때나 나쁠 때나, 건강할 때나 아플 때나” 약한 손을 마주 잡고 깊은 사랑을 나눠온 장면의 모음이다.",1,국내도서-소설/시/희곡
98,9791158887568,97247828,듄 신장판 3,"22,500원","1,250원",프랭크 허버트 저/김승욱 역,황금가지,"역사상 가장 많이 팔린 SF이자 독자들이 뽑은 역대 최고의 SF인 프랭크 허버트의 대작 『듄』이 신장판 전집으로 황금가지에서 출간되었다. 2001년 첫 번역본이 출간된 이후 20년 만에 재출간된 신장판은, 기존의 18권 반양장본을 원서와 동일한 6권으로 묶은 양장본으로서, 김승욱 역자가 6개월여의 원본 대조 작업을 통해 번역을 새롭게 손본데다, 전집 가격은 20년 전보다 오히려 10% 이상 낮게 책정되었다.

『듄』은 지금까지 2000만 부 이상의 판매고를 올리며 전 세계에서 가장 많이 판매된 SF로 알려져 있으며, 「컨택트」, 「블레이드 러너 2049」의 감독인 드니 빌뇌브에 의해 대작 할리우드 영화로 올 10월 공개될 예정으로, 예고편 공개만으로 원작 소설이 베스트셀러에 오르는 등 전 세계적으로 높은 주목을 받고 있는 기대작이다.",2,국내도서-소설/시/희곡
99,9791156759843,112594110,30일의 밤,"15,120원",840원,블레이크 크라우치 저/이주은 역,푸른숲,"뉴욕 타임스 SF소설 분야 베스트셀러, 
Apple TV+ 시리즈 공개 확정! 
세계 30여 개국, 약 100만 부 이상 판매된 베스트셀러 SF 작가이자 
할리우드 시나리오 작가 블레이크 크라우치의 신작! 

『라스트 타운』 『웨이워드』 『파인드』(〈웨이워드 파인드〉3부작 시리즈〉) 등 전 세계에서 약 100만 부의 판매고를 기록한 SF 스릴러 작가 블레이크 크라우치의 신간 『30일의 밤』(원제 ‘DARK MATTER’)이 푸른숲에서 출간됐다. 『30일의 밤』은 다중우주를 소재로 한 SF 스릴러물로 물리학 교수 ‘제이슨’이 다른 세계의 또 다른 나 ‘제이슨’에게 자신의 인생을 송두리째 빼앗기며 벌어지는 이야기다. 내 삶을 도둑질한 ‘제이슨’의 세계에서 다시 자신의 세계로 돌아가려는 ‘제이슨’의 위험천만한 모험을 스릴 있게 다루며, 북미에서는 원고가 채 완성되기도 전에 소니픽처스가 무려 125만 불에 영상화 판권을 구매해 이슈가 됐다.",1,국내도서-소설/시/희곡
100,9791187206200,29807898,별의 계승자 1,"13,320원",740원,제임스 P. 호건 저/이동진 역,아작,"SF 마니아들이 가장 사랑하며 복간을 기다려온 작품,
세계적 SF 작가 제임스 P. 호건의 대표작 드디어 복간!

달에서 5만 년 전 우주비행사의 시체가 발견되었다
우주복 안의 유골은 인류와 똑같은 호모 사피엔스
과연 그는 5만 년 전에 어떻게, 왜 달에 갔는가
상상을 뛰어넘는 반전의 결말과 인류 기원의 수수께끼 

일본의 권위 있는 SF문학상 성운상을 세 번이나 수상한, 세계적인 SF 작가 제임스 P.호건의 대표작. 일본 SF 문학상을 수상하고, [기동전사 Z건담], [신비한 바다의 나디아] 등 유명 애니메이션들이 앞다투어 오마주했고, 호시노 유키노부가 만화화해서 만화판 역시 2013년 성운상을 수상하기도 했다. 

가까운 미래. 달에서 우주복을 입은 인간의 유해가 발견된다. 연대측정 결과 놀랍게도 그가 사망한 것은 5만 년 전. 온 지구가 발칵 뒤집힌 가운데 '찰리'라고 명명된 그 월인(月人)의 정체를 밝히기 위해 대규모 조사단이 꾸려진다.",1,국내도서-소설/시/희곡
101,9788982739040,3367113,달은 무자비한 밤의 여왕,"17,100원",950원,로버트 A. 하인라인 저/안정희 역,황금가지,"SF 3대 거장, 미국 SF 작가 협회 제1호 그랜드 마스터, 로버트 A. 하인라인의 대표작
지구로부터 독립하려는 달 세계의 투쟁을 다룬 기념비적 SF

아이작 아시모프, 아서 C. 클라크와 더불어 3대 SF 작가로 불리는 작가가 선보이는 놀라운 미래 통찰. ‘달 세계가 지구에 대해 일으킨 독립 혁명’을 소재로 한 이 작품은 아폴로 11호가 달에 착륙하기 전인 1966년 인류의 달 진출 모습과 우주 시대의 사회상을 정교하게 예측하여 유명해졌다.",1,국내도서-소설/시/희곡
102,9791165508845,93760557,얼마나 닮았는가,"13,320원",740원,김보영 저,아작,"美 최대출판사 하퍼콜린스에서 한국 SF 작가로서는 처음으로 
개인 소설집을 출간한, 한국을 대표하는 SF 작가 김보영!

제5회 SF 어워드 중단편부문 대상 수상작 「얼마나 닮았는가」
제2회 SF 어워드 중단편부문 우수상 수상작 「세상에서 가장 빠른 사람」
을 비롯, 과작(寡作)으로 소문난 김보영 작가가 10년간 쓴 주옥같은 중단편 모음집!

우주 예찬을 하고 싶어서 인간 세상에 방문한 중단편의 신

문학의 전당에는 아담한 통로가 하나 따로 나 있어야 한다. 느리지만 꾸준히 일하는 작가의 신간이 나왔을 때 독자가 버선발로 뛰쳐나와 마중 갈 수 있는 통로가 필요하다. 이제 김보영의 신간이 나왔으니, 환호하며 버선발로 뛰어나갈 순간이 왔다. 여러 선집의 형식으로 출간된 김보영 작가의 다양한 단편들을 챙겨 읽은 독자들은 이 소설집이 최신작으로 느껴지진 않을 것이다.",2,국내도서-소설/시/희곡
103,9788952771827,14536114,어둠의 왼손,"17,820원",990원,어슐러 K. 르 귄 저/최용준 역,시공사,"《반지의 제왕》, 《나니아 연대기》와 더불어 세계 3대 판타지소설로 꼽히는 《어스시 시리즈》의 작가이자 2003년 제20대 그랜드 마스터로 선정된 SF 판타지 소설계의 거목 어슐러 K. 르 귄의 대표작 《어둠의 왼손》이 새로운 번역으로 다시 출간되었다. 

〈시공사 르 귄 걸작선〉의 첫 번째 권을 장식할 이번 판본에는 출간된 지 반세기가 다 된 지금에도 여전히 유효한, 이 책을 둘러싼 질문들에 대한 르 귄 자신의 견해를 들려주는 〈40주년 기념판의 서문〉과, 자칫 단순한 사고실험 혹은 공상과학소설로 잘못 이해될 수 있는 SF의 진정한 의미 그리고 SF 작가란 무엇을 추구하는가를 다룬 〈1976년의 서문〉, 작품의 집필 과정을 엿볼 수 있게 해주는 작가 노트와 초기 설정 자료, 게센 행성 지도 등 르 귄을 사랑하는 독자들을 만족시킬 다양한 부록들이 함께 실려 있다. 또한 한국 독자들을 위해 르 귄이 직접 보내온 사인이 함께 실려 있다는 점도 선집만이 줄 수 있는 특별한 즐거움이다.",1,국내도서-소설/시/희곡
104,9791170402480,124586586,모든 사람에 대한 이론,"15,300원",850원,이하진 저,열림원,"“나 말고, 널 믿을게. 기다려줄 거라고 믿을게.”
그 숱한 악의 증명에도 불구하고, 
세상을 이루는 대다수가 선을 잃지 않았다고 믿어볼게.

문학웹진 LIM 연재, 이하진 첫 장편소설!

반복되는 재난을 끊임없이 기억하며 나아가는
모든 이들의, 모든 이들을 위한 SF 드라마

“나는 아직도 과거를 스친 여러 재난의 당일에 무엇을 하고 있었는지, 
어떤 감정을 느꼈는지가 생생히 기억난다.” - 작가의 말 중에서

이하진 작가의 첫 장편소설 『모든 사람에 대한 이론』이 문학웹진 LIM에 연재하며 젊은 독자들의 열렬한 지지로 팬덤을 구축한 후 새로운 물성으로 출간되었다. 작가가 학창 시절부터 10년을 품어온 만큼 압도적으로 정밀한 이 소설은, 이곳을 가로지르는 사회적 의제를 밀도 높은 SF 서사로 벼려 놓는다.",1,국내도서-소설/시/희곡
105,9791170523376,123877206,미키7 : 반물질의 블루스,"15,300원",850원,에드워드 애슈턴 저/진서희 역,황금가지,"봉준호 감독의 차기 SF 영화의 원작『미키7』의 후속작. 
전편에서 풀어내지 못한 이야기를 매듭짓는 완결편.

『미키7』은 미키가 복제인간의 임무를 맡게 된 과정, 우주 디아스포라에 끊임없이 실패하면서도 계속 우주로 뻗어나가려는 인류의 모습과 그에 얽힌 비운의 역사, 그리고 척박한 얼음 행성 니플하임에 죽음을 각오하고 정착지를 만든 개척단의 위태로운 상황과 비밀스러운 니플하임의 지적 생명체 크리퍼의 모습 등 소설 속 세계관이 짧지만 흥미롭게 선보였다. 후속작인 『미키7 - 반물질의 블루스』에서는 본격적으로 니플하임 개척단과 토종 생명체간의 갈등과 교섭이 무대 위에 오른다. 미키의 이번 임무는, 전작에서 사령관 마샬의 위협에서 벗어나기 위해 몰래 숨겨두었던 반물질 폭탄을 되찾아와야 하는 일이다. 이 과정에서 여자친구인 나샤와 절친 베르토, 그리고 보안요원인 캣 등 특수 임무자들이 미키와 함께 목숨을 건 여정에 뛰어든다.",1,국내도서-소설/시/희곡
106,9788967451622,143345084,이터널 메모리 : 기억을 캐는 의사들,"12,420원",690원,박민 저,이른아침,"삶과 죽음을 결정할 여덟 개의 기억

살릴 가치가 없는 환자…
죽고 싶지만 말하지 못하는 환자…
사는 게 더 고통인 환자…
일부러 죽음을 선택한 환자…
이들의 삶과 죽음은 누가 어떻게 정해야 할까?
아무도 대답할 수 없는 물음에 대한 8편의 케이스 스터디!

아주 가까운 미래, 간단한 뇌수술만으로 의식 없는 환자의 과거 기억을 동영상처럼 생생히 재현할 수 있는 신기술(BVS)이 개발된다. 대학병원 신경외과 전문의 유라는 이 기술에 기대어 반드시 살릴 환자와 차라리 죽음을 도와줄 환자를 구분하기 시작하고, 불필요한 연명치료와 꼭 필요한 존엄사 사이에서 갈등하며 점점 범죄와 합법 사이의 위험한 도박에 빠져든다. 
이 소설은 그런 그녀를 바라보는 애인이자 같은 의사인 정우진의 고뇌와 갈등을 그려내되, 여덟 가지 구체적인 임상 사례들을 통해 생동감 넘치는 이야기를 엮어낸다.",2,국내도서-소설/시/희곡
107,9788960171374,2983083,세계대전 Z,"17,100원",950원,맥스 브룩스 저/박산호 역,황금가지,"가상의 전염병이 불러온 대재난을 인터뷰라는 기상천외한 방식으로 풀어낸 소설 『세계 대전 Z』. 출간 즉시 《뉴욕타임스》, 《USA투데이》, 미국 인터넷 서점 Amazon.com의 종합 베스트셀러 1위를 기록하고, 전 세계 10여 개국에 판권이 판매되는 등 폭발적인 인기를 얻고 있는 작품이다.



미국 서점에서 하나의 독립 장르로 구분될 만큼 인기를 얻고 있는 좀비 장르이면서도, 재난에 대처하는 인류의 생존 보고서 형식을 띠고 있는 『세계 대전 Z』는 정치, 군사, 국제 관계, 구조 등에 관한 전문 지식을 밑바탕으로 현장감 넘치는 묘사와 흡인력 있는 구성을 지니고 있다. 저자 맥스 브룩스는 다큐멘터리의 특수성을 살려 국가 권력자와 군부를 신랄하게 풍자하고, 위기의 순간에 다양한 인간군상을 등장시킨다.",1,국내도서-소설/시/희곡
108,9788901104935,3977545,SF 명예의 전당 1,"19,800원","1,100원",아이작 아시모프 등저/로버트 실버버그 편/박병곤 등역,오멜라스,"미국 SF작가협회가 선정한 최고의 SF작품들

미국 SF작가협회에서 선정한 SF 역사상 최고의 작품들을 한 권의 책에 담았다. 미국 SF작가협회의 회장을 역임한 로버트 실버버그는 회원들의 투표를 통해 선정된 작품 중 열세 작품을 추려 〈SF 명예의 전당〉 첫 번째 책으로 엮어 냈다. 투표결과를 토대로 분량이나 균형감, 과학소설에 대한 작가의 전반적인 공헌을 고려하여 1965년 이전의 작품들을 선정하여 실었다.

영미 SF문학계의 3대 거장으로 꼽히는 아이작 아시모프의 「전설의 밤」, 아서 C.",1,국내도서-소설/시/희곡
109,9788954694063,121575850,나 같은 기계들,"15,120원",840원,이언 매큐언 저/민승남 역,문학동네,"『나 같은 기계들』은 현대 영문학을 대표하는 작가 이언 매큐언의 열다섯번째 장편소설이자 그의 유일무이한 SF 소설로, 과학기술이 획기적으로 발전한 가상의 과거를 배경으로 인류 최초의 인조인간을 손에 넣은 청년의 이야기를 통해 인공지능시대의 윤리를 집요하게 묻는 작품이다.

이언 매큐언은 언제나 현실사회에 예민한 안테나를 세운 채 현재진행형의 질문을 던지는 작가다. 1998년 부커상 수상작인 『암스테르담』은 안락사 문제를, 9·11 테러와 이라크전쟁의 여파로 국제사회가 떠들썩하던 2004년 발표한 『토요일』은 전쟁과 테러를 다뤘고, 브렉시트 직후 발표한 『바퀴벌레』는 폐쇄적인 영국의 정치와 사회를 신랄하게 풍자했으며, 열한번째 장편소설 『솔라』에서는 온난화라는 전 지구적인 위기를 블랙유머로 담아냈다. 

『나 같은 기계들』에서 그가 선택한 것은 챗GPT를 비롯해 우리의 삶 곳곳에 빠르게 스며들고 있는 인공지능이다.",1,국내도서-소설/시/희곡
110,9788932919683,73162490,죽음 2,"14,220원",790원,베르나르 베르베르 저/전미연 역,열린책들,"[누가 날 죽였지?] 소설의 주인공 가브리엘 웰즈는 이런 문장을 떠올리며 눈을 뜬다. 그는 죽음에 관한 장편소설의 출간을 앞두고 있는 인기 추리 작가다. 평소에 작업하는 비스트로로 향하던 그는 갑자기 아무 냄새도 맡을 수 없다는 사실을 깨닫고 서둘러 병원으로 향한다. 그러나 의사는 그를 없는 사람 취급하고, 거울에 모습이 비치지 않을 뿐 아니라, 창문에서 뛰어내려도 이상이 없다. 그는 죽은 것이다. 가브리엘은 자신의 갑작스러운 죽음이 살인이라고 확신한다. 머릿속에는 몇몇 용의자가 떠오른다. 다행히 그는 자신의 목소리를 들을 수 있는 영매 뤼시 필리피니를 만난다. 떠돌이 영혼이 된 가브리엘은 저승에서, 영매 뤼시는 이승에서 각자의 수사를 해나가며 진실을 파헤치기 시작한다.",1,국내도서-소설/시/희곡
111,9788993094350,5676581,높은 성의 사내,"16,200원",900원,필립 K. 딕 저/남명성 역,폴라북스,"영화 「블레이드 러너」 「토탈 리콜」 「페이첵」 「콘트롤러」 등의 원작자로 ‘할리우드가 가장 사랑한 작가’로 평가받는 필립 K. 딕. 『높은 성의 사내』는 ‘2차 세계대전에서 만일 연합군이 패했다면?’이라는 가정을 토대로, 독일과 일본이 세계를 양분하여 지배하는 음울한 가상의 1960년대를 배경으로 다양한 인간 군상이 빚어내는 이야기들을 담고 있다. 마치 거울에 비춰본 세상처럼 지금 우리의 현실과 묘하게 닮았으면서도 판이한 세계, 그곳에서 살아가는 사람들은 ‘높은 성의 사내’가 쓴 책을 정신적 위안으로 삼는다.",1,국내도서-소설/시/희곡
112,9791164052455,126014910,청혼,"13,500원",750원,배명훈 저,북하우스,"“고마워. 그리고 안녕.
우주 저편에서 너의 별이 되어줄게.”

11년 만에 돌아온 배명훈의 스페이스 오페라 『청혼』
독자들이 먼저 알아보고 재출간을 요청해왔던 소설

배명훈 작가의 『청혼』이 출간 11년 만에 전면적인 개정 작업을 거쳐 복간되었다. 지구에서 180시간 떨어진 우주 공간에서 군 복무 중인 ‘나’가 지구에 사는 연인에게 보내는 열두 통의 편지로 이루어진 『청혼』은 아득한 우주 공간에서 벌어지는 소리 없는 전쟁과 로맨스를 교차시킨 아름답고 애틋한 소설이다. 이 작품은 첫 발표 당시 짜임새 있는 전술과 생생한 전투 묘사가 자아내는 박진감, 서사를 탄탄하게 뒷받침하는 천체물리학과 군사학 등의 전문 지식, 서정성이 돋보이는 사랑 감정의 서술 등으로 주목을 받았다.

작가는 이번 개정 작업을 통해 거의 모든 문장을 다시 쓰는 정도로 조탁하고 묘사와 표현을 시대감각에 발맞추어 수정했다.",1,국내도서-소설/시/희곡
113,9788932919133,60896871,고양이 2,"13,320원",740원,베르나르 베르베르 저/전미연 역,열린책들,"인간이 상상하기 어려운 타자의 시각을 도입하여, 인간 중심주의를 해체하고 이 지구에서 인간이 차지해야 할 적절한 위치를 끊임없이 고민해 온 베르나르 베르베르가 『개미』에 이어 『고양이』에서는 좀 더 성숙하고 발전된 문제 의식을 보여준다. 파리에서 살고 있는 암고양이 바스테트의 시각에서 바라본 인간의 문명을 그린 장편 소설.",1,국내도서-소설/시/희곡
114,9788932919676,73162483,죽음 1,"14,220원",790원,베르나르 베르베르 저/전미연 역,열린책들,"[누가 날 죽였지?] 소설의 주인공 가브리엘 웰즈는 이런 문장을 떠올리며 눈을 뜬다. 그는 죽음에 관한 장편소설의 출간을 앞두고 있는 인기 추리 작가다. 평소에 작업하는 비스트로로 향하던 그는 갑자기 아무 냄새도 맡을 수 없다는 사실을 깨닫고 서둘러 병원으로 향한다. 그러나 의사는 그를 없는 사람 취급하고, 거울에 모습이 비치지 않을 뿐 아니라, 창문에서 뛰어내려도 이상이 없다. 그는 죽은 것이다. 가브리엘은 자신의 갑작스러운 죽음이 살인이라고 확신한다. 머릿속에는 몇몇 용의자가 떠오른다. 다행히 그는 자신의 목소리를 들을 수 있는 영매 뤼시 필리피니를 만난다. 떠돌이 영혼이 된 가브리엘은 저승에서, 영매 뤼시는 이승에서 각자의 수사를 해나가며 진실을 파헤치기 시작한다.",2,국내도서-소설/시/희곡
115,9788982735622,303478,빼앗긴 자들,"17,100원",950원,어슐러 K. 르 귄 저/이수현 역,황금가지,"마니아들 사이에서 노벨문학상을 탈 수 있는 유일한 SF작가로 평가 받는 어슐러 K. 르귄의 헤인시리즈 4편. 헤인(Hain) 시리즈는 모(母)행성에서 퍼져나가 여러 행성들에 살고 있는 인류 종족의 세계를 다룬 이야기로, 작가는 이 시리즈로 SF 문학의 양대 상인 네뷸러상(1969)과 휴고상(1970)을 동시에 휩쓸었다. 전혀 다른 체제로 유지되고 있는 쌍둥이 행성인 우라스와 아나레스의 소통과 단절에 관한 이야기.",1,국내도서-소설/시/희곡
116,9791159258466,125101758,히아킨토스,"12,600원",700원,박애진 저,고블,"박애진의 『히아킨토스』는 그동안 ‘작지만 강고한 이야기’를 표방해온 고블 씬북에서 소개해온 책 중 가장 두툼한 두께를 가진 경장편 소설이다. 이 소설은 전설적인 만화 『베르사유의 장미』를 우주 개척 시대의 이야기로 다시 그려낸 듯한 배경 속에서, 인공지능과 인간성에 대한 사유를 깊이 녹여냈다.

왕정 시절의 귀족 사회를 바탕으로 하는 행성, 귀족에게 범죄를 가한 혐의로 붙잡힌 로봇 ‘제로델’. 제로델은 수감되어 폐기 되어야 할 처지에 이른다. 하지만 수많은 사람들이 제로델의 편을 드는 등 강력한 반발에 부딪치고 마는데. 사건을 조사하던 신부 ‘카이유와’는 이 행성에서 벌어진 균열과 대립을 바라보며 오래전 참전했던 고향 행성의 전쟁을 떠올린다.",2,국내도서-소설/시/희곡
117,9788932919126,60896840,고양이 1,"13,320원",740원,베르나르 베르베르 저/전미연 역,열린책들,"인간이 상상하기 어려운 타자의 시각을 도입하여, 인간 중심주의를 해체하고 이 지구에서 인간이 차지해야 할 적절한 위치를 끊임없이 고민해 온 베르나르 베르베르가 『개미』에 이어 『고양이』에서는 좀 더 성숙하고 발전된 문제 의식을 보여준다. 파리에서 살고 있는 암고양이 바스테트의 시각에서 바라본 인간의 문명을 그린 장편 소설.",1,국내도서-소설/시/희곡
