순위,ISBN,상품번호,상품명,판매가,YES포인트,저자,출판사,설명,출고예상일,관리분류
1,9788990982704,45353675,용의자 X의 헌신,"16,920원",940원,히가시노 게이고 저/양억관 역,재인,"백 퍼센트의 사랑, 백 퍼센트의 헌신……
추리 소설 역사상 가장 처절하고 가장 아름다운 한 편의 서사시

히가시노 게이고 문학의 정수로 일컬어지는 『용의자 X의 헌신』이 새롭게 번역되어 출간됐다. 일본 문학 전문 번역가 양억관 씨가 자신의 번역을 대폭 손질해 원작이 지닌 문학적 향기와 감동을 오롯이 되살려 냈다. 

『용의자 X의 헌신』은 명실상부 히가시노 게이고의 출세작이자 대표작으로 평가되는 장편 미스터리 소설이다. 출간된 해에[주간 문춘 미스터리 베스트 10] 1위를 수상한 것을 시작으로 이듬해 [본격 미스터리 대상] 1위, [이 미스터리가 대단하다] 1위를 차지했으며, 급기야 일본의 대표적인 문학상인 제134회 나오키 상을 거머쥐었다. 2008년 일본에서 영화로 만들어져 그 해 개봉한 일본 영화 가운데 흥행 수입 3위를 기록했다.",1,국내도서-소설/시/희곡
2,9791193790083,126111057,히든 픽처스,"12,600원",700원,제이슨 르쿨락 저/유소영 역,문학수첩,"★굿리즈 초이스 어워드 호러 부문 1위
★아마존 올해 최고의 미스터리 스릴러
★반스앤드노블 올해 최고의 책
★넷플릭스와 판권 계약

고전적인 공포를 독창적으로 재해석한 미스터리 스릴러의 진화!
장르의 규칙을 비틀어 새로운 규칙을 만들어 낸 신선한 소설의 탄생!

“간결한 문장, 놀라운 스토리, 엄청난 추진력… 정말 대단하다”(스티븐 킹) “기이할 정도로 풍부한 상상력을 가진 작가(뉴욕타임스)”라는 평가를 듣는 제이슨 레쿨릭의 신작 미스터리 스릴러 《히든 픽처스》가 문학수첩에서 출간되었다. 에드거상 최종후보에 오른 데뷔작에 이어 두 번째 소설을 발표한 신인처럼 보이지만, 작가의 숨겨진 이력은 상당하다. 독립출판사의 편집자이자 발행인 역할을 하며 장르문학계에 획을 그은 새로운 소설들을 기획해 세계적 베스트셀러에 올려놓았고, 필명으로 직접 집필한 놀라운 상상력과 기발한 설정의 소설들만 열두 권이 넘는다. 

스릴러의 거장 스티븐 킹으로부터 “손에서 내려놓을 수 없다.",1,국내도서-소설/시/희곡
3,9791190174756,89913383,"칵테일, 러브, 좀비","11,700원",650원,조예은 저,안전가옥,"안전가옥 쇼-트 시리즈의 두 번째 책으로, 조예은 작가의 단편집이다. 안전가옥 오리지널 시리즈의 첫 책 『뉴서울파크 젤리장수 대학살』에서 탄탄한 구성의 호러 스릴러를 선보였던 작가의 연출력은 단편집에서 더욱 다양한 색채로 빛을 발한다. 미묘하지만 분명한 폭력을 감내해 왔던 여성 빌런의 탄생을 그린 「초대」, 물귀신과 숲귀신 사이의 사랑스러운 이끌림을 담은 「습지의 사랑」, 블랙 유머를 통해 가부장제의 이면을 들여다보는 오컬트 좀비물 「칵테일, 러브, 좀비」, 제2회 황금가지 타임리프 공모전에서 우수상을 차지한 「오버랩 나이프, 나이프」 등 네 작품을 수록하였다.",1,국내도서-소설/시/희곡
4,9788972750031,76108857,악의,"15,120원",840원,히가시노 게이고 저/양윤옥 역,현대문학,"『악의』는 [가가 형사 시리즈] 3번째 작품으로, 히가시노 게이고의 초기 대표작이자 많은 미스터리 팬들의 필독서 겸 입문서로 사랑받는 소설이다. 『악의』에서는 번뜩이는 두뇌와 끈기를 자랑하는, 완성형의 가가 교이치로를 만날 수 있을 뿐만 아니라, 사회 과목 교사였던 그가 어째서 교직에서 물러나 경찰의 길을 걷게 되었는지, 개인사를 엿볼 수 있다. 한 인기 작가의 죽음에 얽힌 기나긴 악의의 여정을 탐구해가는 본 작품에서 히가시노는 미스터리 작가로서 절정의 솜씨를 선보인다. 일찌감치 범인의 정체를 공개한 후 살인의 진짜 동기와 방법에 대한 수수께끼를 던지면서 독자와의 정면 대결을 펼친 것.",1,국내도서-소설/시/희곡
5,9788960177758,11865751,그리고 아무도 없었다,"10,800원",600원,애거서 크리스티 저/김남주 역,황금가지,"전 세계 미스터리의 역사를 재창조한 추리 소설의 여왕,
애거서 크리스티를 대표하는 작품만을 모은 에디터스 초이스

1억 부 이상이 팔린 명실공히 최고의 애거서 크리스티 소설이자, 출간 이래 항상 세계에서 가장 많이 팔리고 있는 미스터리 소설! 세계 3대 추리 소설 중의 하나이자, 수없이 많은 영화와 드라마로 제작된 최고의 미스터리이며, 애거서 크리스티 자신이 뽑은 제일 좋아하는 작품 목록의 1위에 올라 있다. 외딴 섬에 저마다 숨기고픈 비밀이 있는 열 명의 손님이 초대를 받는다. 저택의 곳곳에 섬뜩한 내용의 동요 가사가 든 액자가 걸려 있고, 그 동요에 맞춰 10명의 손님들은 차례차례 죽음을 맞이하는데…….",1,국내도서-소설/시/희곡
6,9791160408331,111704883,트로피컬 나이트,"13,500원",750원,조예은 저,한겨레출판,"『칵테일, 러브, 좀비』 『스노볼 드라이브』
한국 문학의 보석, 조예은 신작 소설

“널 등쳐먹어서 미안해. 
넌 대부분 한심하고 가끔 사랑스럽지만 잘 살 거야.”

『트로피컬 나이트』는 누군가에게 힘이 되는 이야기다. 수록작 〈고기와 석류〉를 예로 들면, 이렇다. 남편이 죽고 아들도 떠나 혼자 남은 노인이 있다. 노인은 어린아이의 얼굴을 한 괴물을 우연히 만나고, 괴물을 집 안에 들이고야 만다. 노인은 괴물에게 잡아먹히게 될까? 아니다. 조예은의 이야기는 전혀 다르게 흘러간다. 그의 소설은 힘든 삶을 힘들다고 말하는 데서 끝나지 않는다. 공포를 보여주지만 공포가 우리의 삶을 갉아먹도록 내버려두지 않는다. 어쨌든 삶은 계속되니까. 소설이 끝난 뒤에도 이야기는 이어지니까. 이야기가 계속되는 한 조예은의 인물들은 끝까지 살아내고 버틴다. 삶이 계속되는 한 조예은의 이야기는 반드시 밝은 방향으로 나아간다. 신작 소설 『트로피컬 나이트』 또한 그렇다.",1,국내도서-소설/시/희곡
7,9791185546117,15292219,코너스톤 셜록 홈즈 전집,"19,800원","1,100원",아서 코난 도일 저/바른번역 역,코너스톤(도서),"최신 개정판으로 더욱 풍성하게 돌아온 코너스톤의《셜록 홈즈 전집》!

꼼꼼한 번역, 깔끔한 편집으로 많은 사랑을 받아온 코너스톤의 《셜록 홈즈 전집》이 새로운 모습으로 돌아왔다. 추리소설 역사상 가장 많은 사랑을 받은 탐정, 셜록 홈즈. 번뜩이는 추리와 날카로운 통찰이 빛나는 홈즈만의 우아한 사건 기록을 원전 완역본으로 출간해 많은 사랑을 받았던 코너스톤이 특별한 개정판을 준비했다. 이번 개정판은 꼼꼼한 번역과 깔끔한 편집으로 많은 독자의 사랑을 받았던 기존 텍스트에 박광규 추리소설 전문가의 감수를 받아 작품의 완성도를 높였으며, 리하르트 거트슈미트, 시드니 패짓 등의 삽화를 수록하여 독자들이 셜록 홈즈의 세계에 더욱 몰입할 수 있도록 구성했다. 

120여 년 동안 영화, 연극, 만화와 게임 등 다양한 장르 속에서 수없이 변주되어온 탐정의 대명사, 셜록 홈즈.",1,국내도서-소설/시/희곡
8,9791192483238,143381588,침묵의 퍼레이드,"19,620원","1,090원",히가시노 게이고 저/김난주 역,재인,"법이 실현하지 못하는 정의,
그리고 그 정의를 지키기 위해 침묵하는 용의자들...

히가시노 게이고 작품 사상 가장 강력한 반전!

『용의자 X 의 헌신』 『한여름의 방정식』에 이어
'탐정 갈릴레오 시리즈' 사상 세 번째로 영화화

미스터리의 제왕 히가시노 게이고의 페르소나 유가와 마나부가 돌아왔다. 전작 『금단의 마술』에서 사건을 해결한 후 홀연히 미국으로 떠났던 그가 이번 신작 『침묵의 퍼레이드』에서 다시 ‘탐정 갈릴레오’로 돌아와 의문의 사건을 해결하러 나선다.

『침묵의 퍼레이드』는 30년 가까이 이어지고 있는 히가시노 게이고의 인기 연작 추리소설 ‘탐정 갈릴레오 시리즈’의 아홉 번째 작품으로, 발표와 동시에 독자들로부터 ‘탐정 갈릴레오의 재시동!’이라는 기대와 ‘전대미문의 걸작’이라는 찬사를 한 몸에 받은 화제작이다.",1,국내도서-소설/시/희곡
9,9791191043419,103861082,소문,"14,850원",820원,오기와라 히로시 저/권일영 역,모모,"“마지막 4글자에 모든 것이 뒤바뀐다!”
일본 미스터리 역사상 최고의 반전이라는 입소문이
그 자체로 진실이 된 바로 그 소설, 『소문』 복간!

새로 런칭하는 향수 홍보를 위해 거짓 소문이 퍼진다. ‘한밤중 시부야에 뉴욕에서 온 살인마 레인맨이 나타나서 소녀들을 죽이고 발목을 잘라 가는데, 뮈리엘 로즈를 뿌리면 괜찮다’라고 하는 도시전설과 같은 소문. 이 소문은 여고생들의 입을 타고 시부야를 중심으로 퍼져나가며 향수는 선풍적인 인기를 끌고 입소문 전략은 대성공을 거둔다. 그런데 소문이 현실이 되어 발목이 잘린 소녀의 시체가 하나둘 발견되는데…. 

2009년 국내에 처음 출간된 후 미스터리 독자들 사이에서 최고의 반전 소설으로 꼽혔던 오기와라 히로시의 서스펜스 스릴러 『소문』이 새롭게 태어났다. 『소문』의 일본판 띠지 앞면에는 이렇게 적혀 있다. “헉 소리가 나는 충격적인 마지막 한 줄.” ",1,국내도서-소설/시/희곡
10,9788990982575,14840131,가면산장 살인사건,"15,120원",160원,히가시노 게이고 저/김난주 역,재인,"이런 반전은 없었다.
누구도 결말을 예측할 수 없는 이중 삼중의 트릭, 스릴 만점의 심리전.

“스포일러 금지!”

외딴 산장에 여덟 명의 남녀가 모인 가운데 한밤중 은행 강도범이 침입해 인질극을 벌인다. 인질들은 수차례 탈출을 시도하지만 번번이 실패하고, 강도범과 인질들 사이에 숨 막히는 줄다리기가 펼쳐지는 가운데 인질 한 명이 살해된 채 발견된다. 여기까지만 보면 별로 특이할 것 없는 미스터리 소설의 흔한 소재와 줄거리다. 그러나 히가시노 게이고가 쓰면 다르다.

작품을 먼저 접한 일본 독자들이 아마존 저팬 사이트에 남긴 서평은 한결같이 ‘충격’과 ‘경악’, 그리고 ‘속았다’는 것이다. 그도 그럴 것이, 마치 잘 짜인 무대에서 벌어지는 한 편의 연극과도 같은 이 소설의 전개를 그저 흥미진진한 시선으로 바라보던 독자들이 작품의 클라이맥스에 가서 그 누구도 상상조차 할 수 없었던 엄청난 반전과 맞닥뜨리며 머리를 한 대 얻어맞은 것과 같은 충격에 휩싸이기 때문이다.",1,국내도서-소설/시/희곡
11,9791171713608,145261633,고독한 용의자,"17,550원",970원,찬호께이 저/허유영 역,위즈덤하우스,"추리소설의 압도적 일인자《13·67》 《망내인》 찬호께이 3년 만의 신작
미스터리 독자들을 열광시킨찬호께이 초기작의 계보를 잇는 정통 범죄추리소설

‘중화권 추리소설의 출발점’으로 불리며 전 세계의 사랑을 받은 사회파 추리소설 《13·67》 《망내인》의 작가 찬호께이의 신작 장편소설 《고독한 용의자》가 위즈덤하우스에서 출간되었다. 《마술 피리》 이후 국내에서 약 3년 만에 선보이는 신작이다. 최근 소개된 작품들이 호러나 판타지에 가까웠다면 《고독한 용의자》는 《기억나지 않음, 형사》 이후 오랜만에 발표하는 정통 범죄추리소설이다. 찬호께이 저자는 한국어판 서문을 통해 “리얼리즘을 표방한 범죄추리소설로 포스트코로나 시대 홍콩 사회를 배경으로 하고 있다”고 밝히며, “사회현상을 반영한 범죄추리소설을 좋아하는 독자들에게 이 소설이 만족스러운 선물이 될 수 있길 바란다”고 전했다. “누구나 어느 정도의 정신병을 안고 있는” 압력솥 같은 도시 홍콩.",1,국내도서-소설/시/희곡
12,9791160078572,116768623,13.67,"17,100원",950원,찬호께이 저/강초아 역,한스미디어,"중국어권 최고의 추리소설 작가
찬호께이의 대표작 『13·67』
10쇄 기념 전면 개정판 출간!

2015년 추리소설의 불모지로 여겨졌던 중국, 그것도 홍콩에서 날아와 한국 독자들을 놀라게 한 걸작 추리소설이자 찬호께이의 대표작. 찬호께이는 홍콩 작가로서 『기억하지 않음, 형사』(한스미디어 출간)로 ‘제2회 시마다 소지 상’을 수상한 데 이어, 2014년에는 ‘2015 타이베이 국제 도서전’에서 대상을 수상한 『13·67』을 내놓아 결정적으로 국적을 넘어 세계에 이름을 떨치는 작가로 자리잡았다.
『13·67』은 홍콩을 배경으로 1967년도부터 2013년까지의 여섯 개 사건을 역순으로 펼쳐놓는 장편소설이다. 2020년대에 읽어도 참신한 순서의 구성에 더해 혼수상태에서조차 명추리를 자랑하는 경찰 고문 관전둬가 독자의 마음을 강렬하게 사로잡는다. ",1,국내도서-소설/시/희곡
13,9791167903068,147057608,매듭의 끝,"15,120원",840원,정해연 저,현대문학,"“극한까지 처절한 모성에 관한 이야기, 
두 번 다시 이런 소설을 쓸 자신이 없다!” 

한국 추리·미스터리 스릴러에 새로운 지각 변동을 일으킨 
《홍학의 자리》 정해연의 신작!

선보이는 작품마다 ‘뒤틀린 욕망이 사람을 어디까지 추락시킬 수 있는가’를 철저하게 파헤쳐온 정통파 추리·미스터리 스릴러 작가 정해연이 장편 신작 《매듭의 끝》으로 돌아왔다. 

《매듭의 끝》은 ‘행복했던 유년시절에 일어난 갑작스런 아버지의 자살 이후, 오랫동안 아버지의 석연치 않은 죽음에 대한 용의자로 어머니를 의심하는 이인우 형사’와 ‘아들을 절대로 살인자로 만들 수는 없는, 인생의 목표는 오로지 회사와 아들의 성공뿐인 자수성가한 사업가 박희숙’이라는 두 모자(母子)의 이야기가 교차하며 미스터리를 이끌어 나간다.",1,국내도서-소설/시/희곡
14,9788960174191,7218436,제노사이드,"16,200원",900원,다카노 가즈아키 저/김수영 역,황금가지,"『13계단』의 다카노 가즈아키가 6년 만에 내놓은 최신작이다. ‘인류보다 진화한 새로운 생물’의 출현에서 비롯한 인류 종말의 위협과 이를 둘러싼 음모를 추리 스릴러와 SF 기법을 통해 풀어나간 작품으로서, 한국 유학생의 활약과 한국의 ‘정’ 등 한국 문화에 대한 소개 등 한국 독자들이 관심을 가질 만한 내용들이 담겨 있다.

특히 한일 과거사에 대한 일본 우익들의 그릇된 사고를 비판적 시각으로 그려내어 일본에서 상당한 논쟁을 불러일으킨 작품이기도 하다. 실제로 일본 최대 인터넷 서점인 아마존 재팬의 200여 독자 서평 중 거의 대부분이 ‘재미있으나 작품에 담긴 반일 사고가 불편하다’, ‘관동대지진이나 난징대학살에 대한 언급 때문에 거부감이 든다’는 등 저자의 역사관에 불만을 표출하는 의견이 상당수를 차지한다.",1,국내도서-소설/시/희곡
15,9788960177789,11865798,애크로이드 살인 사건,"10,800원",600원,애거서 크리스티 저/김남주 역,황금가지,"전 세계 미스터리의 역사를 재창조한 추리 소설의 여왕,
애거서 크리스티를 대표하는 작품만을 모은 에디터스 초이스

시골 마을의 대지주인 로저 애크로이드가 살해당한다. 애크로이드의 친구인 쉐퍼드 의사는 자신의 옆집에 살면서 호박을 키우는 수상쩍은 남자가 유명한 탐정 푸아로라는 사실을 알게 되고, 애크로이드의 살인범을 쫓는 푸아로의 수사에 함께하는데……. 출간 당시 너무나 획기적인 결말로 인해 애거서 크리스티의 작품 중 가장 많은 논란을 불러일으키며 추리 소설계에 거대한 충격을 가져온 작품. 많은 이들이 『그리고 아무도 없었다』를 제치고 이 작품을 그녀의 최고 걸작으로 꼽고 있다! ",1,국내도서-소설/시/희곡
16,9791192684239,116026838,카지노,"14,850원",820원,김진명 저,새움,"일확천금을 꿈꾸는 사람들은 
오늘도 카지노로 향한다

바야흐로 돈이 지배하는 세상이다. 종교가 되고 이데올로기가 된 돈은 사람들의 몸과 마음을 장악한다. 일확천금을 꿈꾸는 사람들은 오늘도 카지노를 향해 발걸음을 옮긴다. 특별한 절차 없이 바로 돈으로 승부를 거는 곳 카지노. 지금 카지노에서는 어떤 일들이 벌어지고 있을까?

그간 현실과 픽션을 넘나들며 당대의 첨예한 미스터리들을 풀어 온 작가 김진명이 ‘진정한 프로 갬블러와 카지노의 세계’를 흥미진진하게 그려냈다. 작가는 '한 방', ‘일확천금’을 꿈꾸며 게임에 올인하다가 결국 피폐해지고 마는 도박사들의 삶 속에서, 어떤 ‘보편적인 원칙’을 찾고 싶었다고 한다. 이긴다는 환상에만 사로잡혀 주변을 모두 황폐화시키고, 본인 역시 삶을 그르치게 되는 갬블러의 숙명! 숱한 패배 속에서도 살아남는 지혜를 터득하고자 하는 인간, 갬블러의 몸부림을 생생하게 그려내고 있다.",1,국내도서-소설/시/희곡
17,9791192738482,142805014,이상한 집 2,"16,200원",900원,우케쓰 저/김은모 역,리드비(READbie),"더욱 정교하고 섬뜩해진 ‘이상한 집 시리즈’ 2탄 출간

11채의 이상한 집, 11개의 기묘한 평면도
모든 것이 연결되는 순간 끔찍한 비밀이 드러난다!

『이상한 집 2』 일본 종합 베스트셀러 1위(2024)
『이상한 집』 일본 문고 베스트셀러 1위(2024)
사상 최초, 일본 베스트셀러 2관왕

시리즈 누적 255만 부 돌파!
‘이상한 집’ 신드롬!

평면도만으로 독자들을 충격에 빠트린 『이상한 집』. 그 두 번째 이야기 『이상한 집 2 ― 11개의 평면도』가 리드비에서 출간된다. 

‘이상한 집 시리즈’는 인기 호러 콘텐츠 크리에이터이자 현재 일본에서 가장 주목받는 작가 우케쓰의 대표작이다. 온라인 커뮤니티를 떠들썩하게 만든 유튜브 영상 ‘이상한 집’에서 시작된 소설 『이상한 집』(2021)은 베스트셀러는 물론 영화, 코믹스로도 제작되며 선풍적인 인기를 끌었다.",1,국내도서-소설/시/희곡
18,9791170611561,128917300,당신이 누군가를 죽였다 (선라이즈 에디션),"17,820원",990원,히가시노 게이고 저/최고은 역,북다,"10만 부 판매 기념
어나더커버 선라이즈 에디션 
한정판 출간!

2024년 온·오프라인 서점 종합 1위
히가시노 게이고의 미스터리 『당신이 누군가를 죽였다』
10만 부 판매 기념 한정판 특별 에디션 출시!

일본 최고의 베스트셀러 작가 히가시노 게이고의 본격 미스터리 장편소설 『당신이 누군가를 죽였다』가 독자들의 뜨거운 호응을 얻어 출간 10개월 만에 10만 부 판매를 기록했다. 〈가가 형사 시리즈〉 열두 번째 작품으로 ‘황금시대 미스터리’를 구현한 걸작이라는 호평을 받으며 2023년 일본 서점 미스터리 분야 판매 1위를 석권한 소설은,  2024년 국내 출간 즉시 예스24 종합 3위, 교보문고·알라딘 종합 베스트 1위라는 독보적인 성적을 달성하며 베스트셀러가 되었다.",1,국내도서-소설/시/희곡
19,9791158886356,89553558,얼음나무 숲,"17,100원",950원,하지은 저,황금가지,"얼음나무 숲을 둘러싼 기묘한 전설이 살아 있는 음악의 도시 에단.
그곳에서 운명처럼 만난 두 음악 천재의 예술을 향한 갈망, 그리고 살인!

예술을 사랑하는 음악의 도시 에단에서 마에스트로의 칭호를 3회 연속으로 보유하며 거장의 반열에 오른 바이올리니스트 아나토제 바옐. 그리고 바옐의 음악을 진심으로 이해할 수 있는 단 하나의 진정한 청중이 되기 위해 노력하는 순수한 피아니스트 고요 드 모르페. 완전무결한 예술을 갈망하며 서로를 향한 욕망과 동경이 교차하던 이들에게 어느 날, 얼음나무 숲에서 발생한 끔찍한 살인 사건 소식이 들려온다. 평화롭기만 하던 에단에서 발생한 이 유례없는 살인 사건의 처음과 끝에는, 언제나 아나토제 바옐이 있었는데……. 하지은이 탐미적인 필치로 묘사하는 황홀한 선율이 눈앞에서 펼쳐진다.",1,국내도서-소설/시/희곡
20,9791170960706,123368321,메스를 든 사냥꾼,"15,120원",840원,최이도 저,해피북스투유,"출간 전 전격 영상화 확정!
메스를 든 법의관과 재단사 살인범의 추격 스릴러

『메스를 든 사냥꾼』은 소시오패스 법의관 세현이 연쇄 살인범이 남긴 사체로 그를 뒤쫓는 이야기를 담은 미스터리 추격 스릴러 소설이다. 사체를 통해 살인범을 밝혀내는 독특한 소재와 더불어 법의관과 경찰, 각기 다른 인물의 시선으로 이야기를 전개해 신선함을 더했다. 

『메스를 든 사냥꾼』은 최이도 작가의 첫 장편 소설로, 작가는 경찰행정학을 전공하며 공부한 범죄 전문 지식을 책 속에 녹여내 생생한 현장감을 극대화했다. 긴장감 넘치는 전개와 섬세한 묘사는 마치 독자들이 진짜 범죄 현장에 와있는 듯한 착각까지 들게 만든다. 생동감 있는 문체와 흡인력을 인정받아 영상화 문의가 쇄도하며 출간 전임에도 이례적으로 영상화가 확정되었다.",1,국내도서-소설/시/희곡
21,9791197708572,114906622,이상한 집,"13,500원",750원,우케쓰 저/김은모 역,리드비(READbie),"건축 평면도만으로도 엄청난 긴장감을 불러일으키며 ‘부동산 미스터리’라는 신기원을 열었다고 평가받는 우케쓰의 『이상한 집』이 마침내 한국에 소개된다.

2020년, 일본의 호러·오컬트 콘텐츠 크리에이터 ‘우케쓰’가 한 동영상을 올렸다. 언뜻 평범해 보이는 주택 평면도에 숨겨져 있는 ‘위화감’을 두 사람의 대화를 통해 찾아내는 내용이었다. 이 동영상은 눈을 뗄 수 없게 만드는 몰입감과 공포감이 굉장하다는 입소문을 타고 조회 수 1,000만 뷰를 돌파했고, 국내에도 누리꾼들이 커뮤니티에 자발적으로 번역, 공유하며 알려졌다.

온라인의 인기에 힘입어 소설화된 『이상한 집』은 유튜브에서는 미처 밝히지 못했던 ‘이상한 집’의 진짜 비밀이 무엇인지를 다룬다. 소설 『이상한 집』은 온라인에서의 흡인력이 그대로 살아있다는 극찬을 받으며 2021년 일본 호러 미스터리 베스트셀러 1위를 차지했다. 또한 아마존 재팬 초장기 베스트셀러에 등극하였으며, 영화로도 만들어질 예정이다.",1,국내도서-소설/시/희곡
22,9791158791971,114946621,우중괴담,"15,120원",840원,미쓰다 신조 저/현정수 역,북로드,"『우중괴담』은 일본 최고의 호러 미스터리 작가 미쓰다 신조의 소설로, 가슴 서늘하게 만드는 다섯 가지 괴담을 담고 있다. 미쓰다 신조는 호러와 미스터리라는 두 장르의 절묘하고 공교한 융합과 메타픽션의 작법을 통해 자신만의 독특한 작풍을 정립하며 특색 있는 작품을 꾸준히 선보여온 작가다. 또한 ‘미쓰다 월드’라는, 특유의 작품 세계를 지칭하는 용어이자 그의 소설을 열렬히 지지하는 마니아층을 호칭하는 말을 탄생시켰을 정도로 호러와 미스터리 장르의 독자들에게는 독보적인 존재로 인정받는 거장이기도 하다. 

‘나’는 호러 소설 작가다. 나는 꽤 오랜 기간 괴담을 수집해왔기에 종종 자신이 겪은 괴이한 일을 들려준다며 그 해석을 요구하는 이들도 있을 정도다. 이번에 나는 다섯 명의 사람에게서 기이한 체험담을 듣는다. ",1,국내도서-소설/시/희곡
