순위,ISBN,상품번호,상품명,판매가,YES포인트,저자,출판사,설명,출고예상일,관리분류
574,9791164052592,129780363,세인트자일스의 나환자,"15,120원",840원,엘리스 피터스 저,북하우스,"세대와 언어를 뛰어넘은 영원한 고전,
역사와 추리가 절묘하게 조화된 역사추리소설 최고의 걸작,
‘캐드펠 수사 시리즈’ 완간 30주년 기념 전면 개정판 출간!
놀라운 상상력과 치밀한 구성… 최고의 휴머니티 미스터리

《세인트자일스의 나환자》는 캐드펠 수사 시리즈의 다섯 번째 작품으로, 엘리스 피터스는 사랑과 살인이라는 드라마틱한 이야기를 통해 삶에 대한 깊은 통찰을 이야기한다. ‘캐드펠 수사 시리즈’는 끔찍한 살인사건이 중심이 되는 추리소설이지만, 작품마다 한 쌍 이상의 연인이 등장하여 작가의 ‘사랑’에 대한 관심과 애정, 사유를 엿볼 수 있다.

오만한 늙은 남작과 어린 고아 상속녀의 결혼 행렬이 수도원을 찾는다. 이 행렬을 지켜보는 의미심장한 눈빛들 속에서 캐드펠 수사는 기묘한 느낌에 사로잡힌다. 혼례식 전날 밤 신랑이 처참하게 살해당하고, 현장에서는 누군가 인위적으로 만들어놓은 덫이 발견되는데…….",1,국내도서-소설/시/희곡
575,9791169448550,115777579,아르키메데스는 손을 더럽히지 않는다,"12,600원",700원,고미네 하지메 저/민경욱 역,하빌리스,"히가시노 게이고를 작가의 길로 인도한 전설의 미스터리
제19회 에도가와 란포상 수상작

“이 작품과의 만남이 책을 싫어하던 멍청한 고교생의 운명을 바꿨다.”
『아르키메데스는 손을 더럽히지 않는다』를 추천한 작가 히가시노 게이고의 말이다. 현재 일본 문학계를 대표하는 작가인 히가시노 게이고가 추리 소설을 쓰겠다고 마음먹게 했다는 작품이라는 것만으로도 벌써 구미가 당길 독자가 있을 것이다.

17세 여고생 미유키가 임신 중절 수술 중 사망하자 아이의 아버지가 누군지를 놓고 한바탕 소동이 벌어진다. 미유키는 왜 끝까지 아이 아버지를 밝히지 않았나, 그리고 숨을 거두는 순간 미유키가 내뱉은 ‘아르키메데스’라는 말은 무엇을 뜻하는가.

이어 미유키가 다니던 학교의 점심시간, 도시락에 든 독을 먹고 한 학생이 중독되어 쓰러지는 사건과 이 학생의 집에서 시체가 발견되면서 사건은 돌이킬 수 없을 만큼 커져간다.",1,국내도서-소설/시/희곡
576,9791197550911,107875496,리슐리외 호텔 살인,"13,320원",740원,아니타 블랙몬 저/최호정 역,키멜리움,"미스터리 문학평론가 커티스 에반스가 “아칸소가 낳은 범죄소설의 여왕”이라고 극찬한 
아니타 블랙몬이 1937년 발표한 고전 추리 ‘잔혹 코믹극’

어느 따사로운 봄날 저녁 리슐리외 호텔에 장기 거주하고 있던 괴팍한 독신녀 애들레이드 애덤스의 방에서 한 남자가 잔인하게 살해된 채 발견된다. 살해된 남자는 이 호텔의 투숙객 중 한 명이 고용한 사설탐정으로 밝혀진다. 저마다의 비밀을 감추고 있는 이 호텔 장기 거주자들인 부유한 젊은 미망인과 그녀의 조카 폴리, 폴리의 전 애인 엘리트 은행원 호워드, 술독에 빠진 단 모스비와 그의 아내 로티, 바람기 넘치는 화장품 영업사원 스티븐 랜싱, 이혼 위자료로 한몫 잡은 요부 앤서니, 정체를 알 수 없는 어데어 모녀, 이들은 모두 살인이 일어난 것으로 추정되는 시간에 알리바이가 없거나 수상한 행적을 보였다. 꽃미남 엘리트 경위 호머 버니언이 이들을 상대로 자신만만하게 수사에 나선다.",1,국내도서-소설/시/희곡
577,9791189571542,102700638,히나구치 요리코의 최악의 낙하와 자포자기 캐논볼,"16,200원",900원,오승호(고 가쓰히로) 저/이연승 역,블루홀6,"빌어먹을. 살아야겠어.
제72회 일본추리작가협회상 장편 부문 후보작!
미스터리의 마에스트로 오승호의 야심작!!

오승호(고 가쓰히로)의 『도덕의 시간』과 『스완』, 『하얀 충동』을 국내 최초로 선보였던 블루홀식스가 이번에는 『히나구치 요리코의 최악의 낙하와 자포자기 캐논볼』을 출간한다. 『히나구치 요리코의 최악의 낙하와 자포자기 캐논볼』은 2015년 사회파 미스터리 『도덕의 시간』으로 데뷔해 가장 치열한 심사 과정을 거쳐 에도가와 란포상을 수상한 오승호 작가의 2018년 출간작이다. 제목부터가 범상치 않은 이 소설에서 오승호는 과연 어떤 이야기를 펼쳐 보일까. 

무차별 총기 난사 사건으로부터 3년. 무차별 살인범의 여동생으로 인생이 붕괴 직전인 ‘아오이’와 세뇌당해 감금 생활을 해온 ‘히나구치 요리코’가 볼링장에서 운명적으로 만나게 된다. ",1,국내도서-소설/시/희곡
578,9788925568966,89555180,배심원단,"17,820원",990원,마이클 코넬리 저/한정아 역,알에이치코리아(RHK),"죄책감을 느끼게 된 ‘인간쓰레기들의 수호자’
미키는 과연 자신을 스스로 구원할 수 있을까?

개성 넘치는 캐릭터, 치밀한 복선과 반전, 깨알 같은 디테일과 촘촘한 논리로 독자들을 사로잡는 법정 스릴러의 거장 마이클 코넬리의 신작 『배심원단』이 나왔다. 마이클 코넬리는 영미권에서 각종 추리문학상을 휩쓸고, 전 세계 40여 개국에 작품이 소개되어 말테스 팔콘(일본), 38 칼리베르(프랑스), 그랑프리(프랑스), 프리미오 반카렐라(이탈리아) 문학상 등을 수상했을 만큼 폭넓게 작품성을 인정받았으며, 책을 내놓을 때마다 「뉴욕 타임스」 베스트셀러 1위를 차지할 정도로 대중성까지 겸비한 작가다. 알에이치코리아에서는 『링컨 차를 타는 변호사』를 필두로 ‘변호사 미키 할러’ 시리즈를 꾸준히 출간하고 있다. LA에서 돈 밝히는 속물이자 악당 전문 변호사로 활약하는 미키 할러의 그 다섯 번째 이야기가 이번 책에서 펼쳐진다.",2,국내도서-소설/시/희곡
579,9788952776402,28788185,꼬리 많은 고양이 Cat of Many Tails,"13,320원",740원,엘러리 퀸 저/배지은 역,검은숲,"미스터리의 제왕 엘러리 퀸의 걸작들을 총망라한
국내 유일의 ‘엘러리 퀸 컬렉션’

미국미스터리작가협회(MWA)의 창립자이자, 세계적인 미스터리 컨벤션 ‘부셰콘’과 ‘앤서니 상’의 기원이 된 평론가 앤서니 부셰는 엘러리 퀸에 대해서 다음과 같은 말을 남긴 바 있다. “엘러리 퀸은 미국의 탐정 소설 그 자체이다.”

엘러리 퀸은 만프레드 리와 프레더릭 다네이 이 두 사촌 형제가 사용한 공동 필명으로, 미스터리 걸작들을 수없이 탄생시킨 저명한 작가이자 셜록 홈스에 버금가는 명탐정의 이름이다. 또한 아서 코넌 도일, 애거사 크리스티 등의 영국 미스터리에 답하는 미국의 자존심이며, 더 나아가 20세기 ‘미스터리’ 그 자체를 상징하는 이름이기도 하다. 

검은숲은 엘러리 퀸의 방대한 저작을 상세히 살피고 엄선하여, 엘러리 퀸 재단과 정식 계약을 맺고 2011년부터 단계적으로 그의 작품들을 출간하고 있다.",1,국내도서-소설/시/희곡
580,9791185051581,13618193,상어의 도시 1,"10,350원",570원,넬레 노이하우스 저/서유리 역,북로드,"《백설공주에게 죽음을》의 작가 넬레 노이하우스의 첫 번째 장편소설 

평범한 일상을 오싹한 범죄의 플롯으로 담아내다. 



《상어의 도시 Unter Haien》는 2005년 자비출판 형식으로 출간한 그녀의 첫 번째 장편소설로서 타우누스 시리즈가 큰 인기를 얻으면서 새롭게 주목을 받아 2012년 독일에서만 25만 부 이상이 팔리며 6주간 독일 아마존 베스트셀러 1위를 기록했던 작품이다. 



저자는 1990년대 중반 뉴욕을 여행하면서 떠오른 영감을 자신의 상상력과 결합하여 한 권으로 책으로 엮어냈다. 경제범죄와 투자은행 분야에 문외한이었던 그녀는 컴퓨터 해킹에 대한 책을 찾아 읽고 전문지식을 익혔으며 뉴욕시 안내서를 통해 사건 발생지를 면밀히 구상했다. 지금처럼 인터넷 검색으로 정보를 수집하기 쉽지 않았음에도 불구하고 저자는 많은 조사와 노력을 통해서 이 책을 철저히 준비했다.",1,국내도서-소설/시/희곡
581,9788954611343,3962797,그리고 명탐정이 태어났다,"13,500원",750원,우타노 쇼고 저/현정수 역,문학동네,"우타노 쇼고의 밀실 트릭 3부작

『벚꽃 지는 계절에 그대를 그리워하네』의 작가 우타노 쇼고의 밀실 트릭 3부작을 담았다. 눈 오는 산장과 외딴 섬, 서양식 저택까지 세 가지 밀실에서 펼쳐지는 반전과 트릭이 돋보이는 세 작품을 만날 수 있다.",1,국내도서-소설/시/희곡
582,9788952758514,3908712,쌍두의 악마 2,"8,820원",490원,아리스가와 아리스 저/김선영 역,시공사,"단절된 두 마을에서 동시에 일어난 이유 없는 살인
추리소설의 거장 아리스가와 아리스의 퍼즐 미스터리

일본 본격 추리소설의 거장으로 손꼽히는 아리스가와 아리스의 대표작. 에이토 대학 추리소설연구회 회원 ‘에가미―아리스’ 콤비가 활약하는 세 번째 작품으로, 작가의 스타일이 집대성된 미스터리 소설이다. 그의 작품의 근간이 되는 세 가지 기둥 논리 전개의 재미, 기상천외한 단서, 싱그러운 청춘 소설이 잘 드러나는 이 작품은 단절된 두 마을에서 동시에 일어난 이유 없는 살인 이야기를 흥미진진하게 들려준다.",1,국내도서-소설/시/희곡
583,9788982739927,2306657,블랙 달리아 1,"10,800원",600원,제임스 엘로이 저/이종인 역,황금가지,"미국 역사에 실제로 기록된 희대의 살인 사건을 추리 소설로 새롭게 재조명한 현대 하드보일드의 대표적인 걸작이다. 브리언 드 팔마의 최신 대작 영화 의 원작 소설이기도 하다.

1947년 1월 15일, 할리우드 시내의 빈터에서 젊은 여성의 시체가 발견된다. 스타가 되기 위해 도시의 밑바닥을 전전하던 여성의 처참한 최후. 검은 드레스에 칠흑 같은 머리카락을 지닌 여인을 언론에서는 '블랙달리아'라는 별명으로 대서특필한다. 당시 가장 촉망받는 두 형사가 이 사건을 맡게 되면서, 가려져 있던 할리우드의 뒷세계가 드...",1,국내도서-소설/시/희곡
584,9788982737015,276590,빛이 있는 동안,"10,800원",600원,애거서 크리스티 저/김남주 역,황금가지,"전 세계 미스터리의 역사를 재창조한 추리 소설의 여왕,
애거서 크리스티 국내 최초 공식 완역본 전집

애거서 크리스티는 전 세계에 ‘추리 소설의 여왕’으로 이름 높은 작가이다. 100권이 넘는 장편 소설과 단편집과 희곡을 썼으며, 그녀의 소설들은 100개가 넘는 언어로 번역되었고 전 세계적으로 20억 부가 넘게 팔려 나갔다. 그녀는 역사상 최고의 베스트셀러 작가인 것이다. 이런 공로를 인정받아 1971년 영국 왕실이 수여하는 ‘데임’의 명예로운 작위를 받은 그녀는 60년 동안 90여 권의 책을 펴냈다. 

자아도취적인 벨기엔 탐정 에르퀼 푸아로가 나오는 단편 두 편을 포함하여 날카로운 심리 소설들이 주를 이루는 『빛이 있는 동안』은 그녀의 유작 소설집이기도 하다. 특히 애거서 크리스티의 미스터리한 실종 직전에 쓰인 단편 「칼날」은 섬세한 심리 묘사가 압권이며, 모호한 결말과 묘사가 독자들에게 다양한 해설을 불러일으키는 「벽 속에서」 역시 독특한 매력이 있다.",1,국내도서-소설/시/희곡
585,9788972773795,119963376,사자 츠나구 1,"16,020원",890원,츠지무라 미즈키 저/오정화 역,리드리드출판,"* 나오키상, 메피스토상, 서점대상 수상작가
* 요시카와 에이지문학 신인상 수상작
* 영화 [츠나구]의 원작 소설 
* 100만 부 이상 팔린 밀리언셀러

“하늘로 떠난 그대를 다시 만날 수만 있다면…,
단 한 번 주어지는 산 자와 죽은 자의 하룻밤”

이 책의 저자 츠지무라 미즈키는 [도라에몽]을 즐겨 보고 추리소설에 빠져 살던 소녀에서 자신이 직접 도라에몽 각본을 쓰고 일본 추리소설계의 차세대 선두주자로 불리는 작가로 성장했다. 작가는 모두가 인정하는 컴퓨터 게임 덕후이기도 하다. 또한 일본 미스터리 소설의 번영을 이끈 아야츠지 유키토에게 소녀 시절부터 팬레터를 100장 이상 보낸 것은 일본 문단에 널리 알려진 사실이다. 이런 작가의 성장 배경은 그녀의 소설이 신세대적 감성으로 얼마나 반짝이고 흥미로울지 짐작하게 한다. 

작가는 ‘산 자와 죽은 자의 단 한 번의 해후’라는 다소 고전적인 주제로 독자의 마음을 사로잡기 위해 나섰다.",1,국내도서-소설/시/희곡
586,9791189571788,111402870,야미하라,"16,200원",900원,츠지무라 미즈키 저/문지원 역,블루홀6,"『야미하라』는 츠지무라 미즈키가 처음으로 선보이는 본격 호러 장편 미스터리다. 먼저 작품의 제목인 ‘야미하라’의 의미를 살펴보면 다음과 같다. 일본에서는 타인에 대한 괴롭힘을 뜻할 때 일본어와 영어 해러스먼트(harassment)를 결합해 ‘○○하라’라고 표현한다. 그 예로 성희롱을 뜻하는 세쿠하라, 직장 내 괴롭힘을 뜻하는 파와하라, 임신과 출산을 이유로 직장인 여성을 차별한다는 뜻의 마타하라, 정신적 괴롭힘을 뜻하는 모라하라, 음주를 강요하는 괴롭힘을 뜻하는 아루하라 등이 있다. 일상 속 괴롭힘을 지칭하는 신조어가 이렇게나 많다는 점이 놀라울 정도인데, 작가 츠지무라 미즈키에 의해 또 하나의 조어가 탄생했다. 누구에게나 존재하고 누구나 겪었을 법하지만 특별히 무어라 말하기 어려웠던 불쾌감과 공포, 즉 야미 해러스먼트, 야미하라가 바로 그것이다. 

호러 장편 소설을 집필하고 싶었다던 작가는, 누구나 예측할 만한 호러 소설이 아닌 작가 특유의 호러 소설을 쓰고야 말았다.",1,국내도서-소설/시/희곡
587,9788983085535,89850741,생사의 게임,"13,500원",750원,시드니 셀던 저/홍석연 역,문지사,,3,국내도서-소설/시/희곡
588,9788952736352,76897561,중간의 집,"13,320원",740원,엘러리 퀸 저/배지은 역,검은숲,"미스터리의 제왕 엘러리 퀸의 걸작들을 총망라한
국내 유일의 ‘엘러리 퀸 컬렉션’

미국미스터리작가협회(MWA)의 창립자이자, 세계적인 미스터리 컨벤션 ‘부셰콘’과 ‘앤서니 상’의 기원이 된 평론가 앤서니 부셰는 엘러리 퀸에 대해서 다음과 같은 말을 남긴 바 있다. “엘러리 퀸은 미국의 탐정 소설 그 자체이다.”

엘러리 퀸은 만프레드 리와 프레더릭 다네이 이 두 사촌 형제가 사용한 공동 필명으로, 미스터리 걸작들을 수없이 탄생시킨 저명한 작가이자 셜록 홈스에 버금가는 명탐정의 이름이다. 또한 아서 코넌 도일, 애거사 크리스티 등의 영국 미스터리에 답하는 미국의 자존심이며, 더 나아가 20세기 ‘미스터리’ 그 자체를 상징하는 이름이기도 하다. 

검은숲은 엘러리 퀸의 방대한 저작을 상세히 살피고 엄선하여, 엘러리 퀸 재단과 정식 계약을 맺고 2011년부터 단계적으로 그의 작품들을 출간하고 있다.",2,국내도서-소설/시/희곡
589,9791196123482,64248686,은수의 레퀴엠,"13,500원",750원,나카야마 시치리 저/이연승 역,블루홀6,"2009년 ‘이 미스터리가 대단해!’ 대상 수상, 일본 추리소설계의 ‘이야기의 장인’이자 ‘반전의 제왕’ 나카야마 시치리. 『속죄의 소나타』와『추억의 야상곡』에 이어지는 「미코시바 레이지 변호사 시리즈」의 3편 『은수의 레퀴엠』이 미스터리 전문 출판사 블루홀식스에서 출간되었다. 블루홀식스는 나카야마 시치리의 「미코시바 레이지 변호사 시리즈」외에도「우라와 의대 법의학 교실 시리즈」인『히포크라테스 선서』와『히포크라테스 우울』 「와타세 경부 시리즈」인 『테미스의 검』, 『세이렌의 참회』등을 출간해왔다. 앞으로도 블루홀식스를 통해 박진감 넘치고 강한 흡입력이 돋보이는 나카야마 시치리의 작품을 꾸준히 만나볼 수 있다. 

이번에 출간된 「미코시바 레이지 변호사 시리즈」 3편인 『은수의 레퀴엠』은 속죄의 의미를 묻는 압도적으로 박력감 넘치는 리걸 서스펜스다. 어느 날, 한국 여객선 블루오션호가 침몰해 251명이 사망했다.",1,국내도서-소설/시/희곡
590,9791195657353,23557751,셜록 홈즈 소설 전집 5 셜록 홈즈의 모험,"4,860원",270원,아서 코난 도일 저/바른번역 역/박광규 감수,코너스톤(도서),"최신 개정판으로 더욱 풍성하게 돌아온 코너스톤의 《셜록 홈즈 전집》!

꼼꼼한 번역, 깔끔한 편집으로 많은 사랑을 받아온 코너스톤의 《셜록 홈즈 전집》이 새로운 모습으로 돌아왔다. 추리소설 역사상 가장 많은 사랑을 받은 탐정, 셜록 홈즈. 번뜩이는 추리와 날카로운 통찰이 빛나는 홈즈만의 우아한 사건 기록을 원전 완역본으로 출간해 많은 사랑을 받았던 코너스톤이 특별한 개정판을 준비했다. 이번 개정판은 꼼꼼한 번역과 깔끔한 편집으로 많은 독자의 사랑을 받았던 기존 텍스트에 박광규 추리소설 전문가의 감수를 받아 작품의 완성도를 높였으며, 리하르트 거트슈미트, 시드니 패짓 등의 삽화를 수록하여 독자들이 셜록 홈즈의 세계에 더욱 몰입할 수 있도록 구성했다. 120여 년 동안 영화, 연극, 만화와 게임 등 다양한 장르 속에서 수없이 변주되어온 탐정의 대명사, 셜록 홈즈.",2,국내도서-소설/시/희곡
591,9788960178809,14352409,한국 공포 문학 단편선,"13,320원",740원,"유재중,김재은,박해로 등저",황금가지,"『한국 공포 문학 단편선』 시리즈의 여섯 번째 책인 『한국 공포 문학 단편선, 돼지가면 놀이』가 출간되었다. 2010년 시리즈의 5권이 출간된 후, 4년만에 출간된 신작 단편집이다. 이번 단편집은 기존 시리즈와 달리 공모전을 통해 엄선한 다섯 명의 신인 작가들이 새로 합류해 기존과 차별화된 재미를 선사한다. 

『한국 공포 문학 단편선』 시리즈는 2006년부터 2010년까지 매년 출간되어 '공포 소설' 불모지인 한국 장르 문학에 큰 반향을 일으킨 대표적인 앤솔로지로써, 시리즈에 수록된 여러 작품들의 영화와 드라마 판권이 판매되어 화제를 뿌렸다. 또한 시리즈의 외전격으로 작가들의 괴담을 소재로 런칭했던 ‘한국 공포 문학 괴담선’ 어플리케이션이 100만에 이르는 다운로드를 보이며 큰 주목을 받기도 했다.",2,국내도서-소설/시/희곡
592,9791156755227,14306711,몸을 긋는 소녀,"14,220원",790원,길리언 플린 저/문은실 역,푸른숲,"마지막 10페이지를 남기고 몹시 두려워졌지만, 
책장을 넘기지 않을 수 없었다. 

섬세한 작가의 예리한 쓰기, 그보다 더 날카로운 
통찰이 돋보이는 경이로운 작품! _스티븐 킹! 

《몸을 긋는 소녀Sharp Objects》, 《다크 플레이스Dark Places》, 《나를 찾아줘Gone Girl》. 길리언 플린은 지금까지 발표한 세 작품 모두 영화 판권이 팔리면서 데뷔 6년 만에 ‘할리우드에서 가장 영향력 있는 작가’로 선정된 천재 스토리텔러다. 《몸을 긋는 소녀》는 작가의 2006년 데뷔작으로, 최근 미국 엔터테인먼트 원 채널이 드라마 제작을 확정하면서 작품성과 대중성을 모두 인정받아 다시 한 번 주목받고 있다.",1,국내도서-소설/시/희곡
593,9788991931992,8324878,푸른 묘점,"13,320원",740원,마쓰모토 세이초 저/김욱 역,북스피어,"『푸른 묘점』은 마쓰모토 세이초가 『점과 선』, 『눈의 벽』 등으로 큰 인기를 얻은 직후, 다수의 작품을 동시에 연재하며 가장 왕성하게 집필 활동을 했던 시기에 쓰인 작품으로, 젊은이들을 주 독자층으로 삼은 잡지 《주간 묘조》(1958년 7월 27일~1959년 8월 30)에 연재되었다. 이 소설은 인기작가와 3류 저널리스트를 중심으로 발생한 사건을 해결해가는 이야기와, 이 사건을 추적하는 와중에 서로에게 호감을 느끼고 사랑을 가꾸어가는 한 커플의 이야기가 나란히 전개되며, 한쪽 이야기가 어두워질수록 다른 쪽 이야기는 그와 비례하여 밝아지는 구조를 가지고 있다. 즉, 미스터리와 로맨스가 합쳐진 형국이라 하겠는데, 그 덕분에 사건이 비극적으로 마무리됨에도 불구하고 독자들에게는 해피엔딩을 선사한다.",2,국내도서-소설/시/희곡
594,9788956051147,1460111,리틀 시스터,"12,600원",700원,레이먼드 챈들러 저/박현주 역,북하우스,"『빅 슬립』(1939)에서 시작하여 『하이 윈도』(1942) 『안녕 내 사랑』(1940)을 거쳐 『호수의 여인』(1943)까지, 챈들러가 창조해냈던 도시형 사립탐정 필립 말로의 캐릭터는 『리틀 시스터』에 이르러 상당히 달라진 모습을 보인다. 냉소적이지만 자못 매너 차릴 줄 알고, 비정하지만 유머 감각에 넘치던 멋쟁이 말로. 그러던 그가 이제 느끼한 형사반장의 전화를 기다릴 정도로 외로움을 타는가 하면, 한밤중에 대로를 드라이브하며 자조적 독백을 주절거리고, 고객을 앞에 두고 궁상맞게 독한 위스키를 홀짝거리기도 하는 것이다. 이...",1,국내도서-소설/시/희곡
595,9791186151693,129588064,"아서 코난 도일, 선상 미스터리 단편 컬렉션","15,120원",840원,아서 코난 도일 저/남궁진 편역,센텐스,"모든 파도는 비밀을 품고 있다. 

이 책은 전 세계적으로 유명한 추리 소설인 《셜록홈즈》의 저자, 아서 코난 도일의 작품으로 1922년 존 머레이 출판사에서 《Tales of Pirates and Blue Water(해적과 푸른 물 이야기)》로 출간되었습니다. 국내에는 영어 원문으로만 들어와 있고, 이 책이 국내 최초의 공식 번역본입니다.

아서 코난 도일은 영국의 의사이자 소설가로, 셜록 홈즈 시리즈를 성공시킨 추리 소설의 대가로 알려져 있습니다. 이 책은 선상에서 일어나는 미스터리를 다룬 6가지 이야기와 악명 높은 해적인 샤키 선장 모험기를 다룬 4가지 이야기로 구성되어 있습니다. 책의 초반부, 선상에서 일어나는 6가지의 미스터리한 이야기들은 셜록 홈스를 떠올리게 하는 듯합니다. 셜록 홈스가 육지에서의 미스터리였다면 이 책은 해상에서의 미스터리라고 할 수 있습니다. 후반부에는 전설의 악명 높은 해적인 샤키 선장의 이야기가 펼쳐집니다.",1,국내도서-소설/시/희곡
596,9791191193572,110556277,온난한 날들,"11,700원",650원,윤이안 저,안전가옥,,1,국내도서-소설/시/희곡
597,9791190974486,99421778,연쇄살인마 잭 더 리퍼 연대기 1+2,"17,900원",원,"에드먼드 피어슨,토머스 버크 등저/정진영 편역",바톤핑크,"1888년 런던 이스트엔드의 화이트채플에서 세상을 떠들썩하게 만든 연쇄살인이 벌어졌다. 이후 연쇄살인범의 시조로 일컬어지며 130년이 지난 현재까지 잡히지 않은 장기 미제 아니 영구 미제 사건의 범죄자, 잭 더 리퍼(Jack the Ripper)... 지금까지 수많은 모방 범죄와 용의자들을 양산해왔고, 그에 따라서 혼란과 논란도 증폭됐다. 이 희대의 살인마는 빈민가의 매춘 여성이라는 사회적 약자들을 범행 대상으로 삼은 비열함 뿐 아니라 희생자의 시신을 훼손하고 장기를 적출하는 등의 엽기적이고 잔혹한 범행수법을 보였다. 더구나 신출귀몰한 행적으로 말미암아 당대 공권력은 조롱거리가 되었고 여론몰이식 무차별적 용의자 검거는 또 다른 사회 문제를 야기했다. 이 책은 잭 더 리퍼로 대변되는, 이 사회의 깊고 어두운 그림자 속에 기생하는 살인자들에 관한 것이다.",6,국내도서-소설/시/희곡
